s_name,aumdate,aumtotal,classification,schemecode
WOC Pharma and Healthcare Fund-Reg(G),2025-10-31T00:00:00.000Z,480.08,Equity : Sectoral - Pharma,48472
Union Short Duration Fund-Reg(G),2025-11-30T00:00:00.000Z,479.44,Debt : Short Duration,49467
ICICI Pru FMP-85-10Y-I(G),2025-11-30T00:00:00.000Z,477.59,Debt : FTP/FMP,43023
DSP Nifty Midcap 150 Quality 50 Index Fund-Reg(G),2025-10-31T00:00:00.000Z,477.06,Equity : Index Funds,46467
Union Largecap Fund-Reg(G),2025-10-31T00:00:00.000Z,475.89,Equity : Large Cap,33066
Edelweiss Banking and PSU Debt Fund-Reg(G),2025-11-30T00:00:00.000Z,475.66,Debt : Banking & PSU,23296
Kotak FMP-292-1735D(G),2025-11-30T00:00:00.000Z,473.99,Debt : FTP/FMP,45679
Kotak FMP-292-1735D(IDCW),2025-11-30T00:00:00.000Z,473.99,Debt : FTP/FMP,45790
Mirae Asset Gold Silver Passive FoF-Reg(G),2025-10-31T00:00:00.000Z,472.28,FoFs : Domestic,50139
Union Active Momentum Fund-Reg(G),2025-10-31T00:00:00.000Z,467.09,Equity : Thematic,49020
LIC MF ULIS,2025-11-30T00:00:00.000Z,466.58,Hybrid : Solution Oriented,2154
Aditya Birla SL US Equity Passive FOF-Reg(G),2025-10-31T00:00:00.000Z,464.25,FoFs : Overseas,45711
Mirae Asset Silver ETF,2025-10-31T00:00:00.000Z,460.88,Gold : ETFs,46195
Nippon India Nifty 500 Equal Weight Index Fund-Reg(G),2025-11-30T00:00:00.000Z,459.11,Equity : Index Funds,49022
UTI Dynamic Bond Fund-Reg(G),2025-11-30T00:00:00.000Z,456.79,Debt : Dynamic Bond,11896
Invesco India ESG Integration Strategy Fund-Reg(G),2025-10-31T00:00:00.000Z,453.71,Equity : Thematic,45348
HDFC Nifty500 Multicap 50:25:25 Index Fund-Reg(G),2025-10-31T00:00:00.000Z,448.94,Equity : Index Funds,48970
ITI ELSS Tax Saver Fund-Reg(G),2025-10-31T00:00:00.000Z,445.7,Equity : Tax Saving (ELSS),44014
Tata Nifty Capital Markets Index Fund-Reg(G),2025-11-30T00:00:00.000Z,443.35,Equity : Index Funds,49234
DSP Nifty Private Bank ETF,2025-10-31T00:00:00.000Z,442.56,Equity : ETFs,47907
Invesco India - Invesco EQQQ NASDAQ-100 ETF FoF-Reg(G),2025-10-31T00:00:00.000Z,440.33,FoFs : Overseas,45943
Edelweiss ELSS Tax saver Fund-Reg(G),2025-10-31T00:00:00.000Z,439.5,Equity : Tax Saving (ELSS),7545
Sundaram Overnight Fund-Reg(G),2025-11-30T00:00:00.000Z,438.62,Debt : Overnight,42000
Invesco India Equity Savings Fund-Reg(G),2025-10-31T00:00:00.000Z,438.49,Hybrid : Equity Oriented,41505
Mirae Asset Nifty Financial Services ETF,2025-10-31T00:00:00.000Z,438.29,Equity : ETFs,45669
Aditya Birla SL Nifty 50 Equal Weight Index Fund-Reg(G),2025-10-31T00:00:00.000Z,438.25,Equity : Index Funds,44741
Bandhan CRISIL IBX Gilt April 2032 Index Fund-Reg(G),2025-11-30T00:00:00.000Z,438.08,Debt : Long Duration,47601
WOC ELSS Tax Saver Fund-Reg(G),2025-10-31T00:00:00.000Z,437.92,Equity : Tax Saving (ELSS),46773
Kotak CRISIL-IBX AAA Financial Services Index - Sep 2027 Fund-Reg(G),2025-11-30T00:00:00.000Z,437.84,Debt : Medium to Long Duration,49109
Mirae Asset Hang Seng TECH ETF,2025-10-31T00:00:00.000Z,437.82,Equity : ETFs,45737
HDFC NIFTY Midcap 150 Index Fund-Reg(G),2025-10-31T00:00:00.000Z,437.43,Equity : Index Funds,46619
Kotak Nifty IT ETF,2025-10-31T00:00:00.000Z,436.9,Equity : ETFs,45377
Bank of India Large & Mid Cap Fund-Reg(G),2025-10-31T00:00:00.000Z,436.69,Equity : Large & Mid Cap,6434
HDFC Nifty LargeMidcap 250 Index Fund-Reg(G),2025-10-31T00:00:00.000Z,436.21,Equity : Index Funds,48969
Nippon India MNC Fund-Reg(G),2025-11-30T00:00:00.000Z,435.58,Equity : Thematic - MNC,49503
Canara Rob Short Duration Fund-Reg(G),2025-11-30T00:00:00.000Z,435.08,Debt : Short Duration,12382
PGIM India Multi Cap Fund-Reg(G),2025-10-31T00:00:00.000Z,434.64,Equity : Multi Cap,48968
Bandhan CRISIL-IBX Financial Services 3-6 Months Debt Index Fund-Reg(G),2025-11-30T00:00:00.000Z,433.5,Debt : Ultra Short Duration,49706
Mirae Asset Nifty 200 Alpha 30 ETF,2025-10-31T00:00:00.000Z,432.02,Equity : ETFs,48243
Union Focused Fund-Reg(G),2025-10-31T00:00:00.000Z,430.63,Equity : Multi Cap,22068
DSP Silver ETF FoF-Reg(G),2025-10-31T00:00:00.000Z,430.01,FoFs : Domestic,49808
Bandhan CRISIL IBX 90:10 SDL Plus Gilt - April 2032 Index Fund-Reg(G),2025-11-30T00:00:00.000Z,428.14,Debt : Long Duration,46814
Motilal Oswal Silver ETF,2025-11-30T00:00:00.000Z,427.48,Gold : ETFs,50142
Aditya Birla SL Retirement Fund-30-Reg(G),2025-10-31T00:00:00.000Z,427.16,Hybrid : Solution Oriented,32078
Invesco India Gold ETF,2025-10-31T00:00:00.000Z,426.99,Gold : ETFs,8505
SBI FMP-81-1157D-Reg(G),2025-11-30T00:00:00.000Z,426.2,Debt : FTP/FMP,47876
HDFC NIFTY 100 Equal Weight Index Fund-Reg(G),2025-10-31T00:00:00.000Z,424.77,Equity : Index Funds,45997
Nippon India Taiwan Equity Fund-Reg(G),2025-11-30T00:00:00.000Z,423.45,Equity : International,45690
Tata BSE Sensex Index Fund-Reg(G),2025-11-30T00:00:00.000Z,422.6,Equity : Index Funds,3249
Axis Silver FoF-Reg(G),2025-10-31T00:00:00.000Z,420.68,Gold : MFs,46368
Edelweiss Nifty500 Multicap Momentum Quality 50 Index Fund-Reg(G),2025-10-31T00:00:00.000Z,419.65,Equity : Index Funds,49278
Franklin India Low Duration Fund-Reg(G),2025-11-30T00:00:00.000Z,418.87,Debt : Low Duration,49676
Nippon India Medium to Long Duration Fund(G),2025-11-30T00:00:00.000Z,417.75,Debt : Medium to Long Duration,2580
Bank of India Consumption Fund-Reg(G),2025-10-31T00:00:00.000Z,415.88,Equity : Thematic - Consumption,49323
SBI FMP-64-1169D-Reg(G),2025-10-31T00:00:00.000Z,412.16,Debt : FTP/FMP,46858
WOC Digital Bharat Fund-Reg(G),2025-10-31T00:00:00.000Z,407.61,Equity : Sectoral - Technology,49129
Mirae Asset Global X Artificial Intelligence & Technology ETF FoF-Reg(G),2025-10-31T00:00:00.000Z,406.86,FoFs : Overseas,45380
Aditya Birla SL Nifty Midcap 150 Index Fund-Reg(G),2025-10-31T00:00:00.000Z,405.57,Equity : Index Funds,44738
ITI Balanced Advantage Fund-Reg(G),2025-10-31T00:00:00.000Z,400.05,Hybrid : Dynamic Asset Allocation,44362
SBI FMP-44-1855D-Reg(G),2025-11-30T00:00:00.000Z,399.68,Debt : FTP/FMP,45552
Kotak Silver ETF FoF-Reg(G),2025-10-31T00:00:00.000Z,398.59,Gold : MFs,46628
Nippon India Nifty G-Sec Sep 2027 Maturity Index Fund-Reg(G),2025-11-30T00:00:00.000Z,396.4,Debt : Gilt,47186
Zerodha Silver ETF,2025-10-31T00:00:00.000Z,396.38,Gold : ETFs,49713
Motilal Oswal Nifty Next 50 Index Fund-Reg(G),2025-11-30T00:00:00.000Z,396.38,Equity : Index Funds,44368
Aditya Birla SL CRISIL IBX 50:50 Gilt Plus SDL Apr 2028 Index Fund-Reg(G),2025-11-30T00:00:00.000Z,395.08,Debt : Medium to Long Duration,46897
JM Large & Mid Cap Fund-Reg(G),2025-11-30T00:00:00.000Z,394.58,Equity : Large & Mid Cap,49975
Baroda BNP Paribas Retirement Fund-Reg(G),2025-10-31T00:00:00.000Z,391.85,Hybrid : Solution Oriented,48794
Axis NIFTY Bank ETF,2025-10-31T00:00:00.000Z,387.91,Equity : ETFs,14654
Nippon India Nifty AAA PSU Bond Plus SDL - Sep 2026 Maturity 50:50 Index Fund-Reg(G),2025-11-30T00:00:00.000Z,387.13,Debt : Banking & PSU,47034
SBI LT Advantage Fund-V-Reg(G),2025-10-31T00:00:00.000Z,386.77,Equity : Tax Saving (ELSS),38291
Mirae Asset Nifty MidSmallcap400 Momentum Quality 100 ETF,2025-10-31T00:00:00.000Z,385.99,Equity : ETFs,48681
Axis Nifty Next 50 Index Fund-Reg(G),2025-10-31T00:00:00.000Z,383.12,Equity : Index Funds,45702
Sundaram Low Duration Fund(G),2025-11-30T00:00:00.000Z,382.9,Debt : Low Duration,2343
HDFC NIFTY 100 Index Fund-Reg(G),2025-10-31T00:00:00.000Z,382.86,Equity : Index Funds,45996
Quant Healthcare Fund-Reg(G),2025-11-30T00:00:00.000Z,378.53,Equity : Sectoral - Pharma,48035
ICICI Pru Nifty Metal ETF,2025-11-30T00:00:00.000Z,378.27,Equity : ETFs,33835
Sundaram Banking & PSU Fund(G),2025-11-30T00:00:00.000Z,377.41,Debt : Banking & PSU,2960
Bandhan US Specific Equity Active FOF-Reg(G),2025-10-31T00:00:00.000Z,375.83,FoFs : Overseas,45674
Bandhan US Specific Equity Active FOF-Reg(IDCW),2025-10-31T00:00:00.000Z,375.83,FoFs : Overseas,45675
Kotak CRISIL-IBX Financial Services 3-6 Months Debt Index Fund-Reg(G),2025-11-30T00:00:00.000Z,375.51,Debt : Ultra Short Duration,49672
JM Arbitrage Fund(G),2025-11-30T00:00:00.000Z,373.23,Hybrid : Arbitrage,1843
HSBC Nifty 50 Index Fund-Reg(G),2025-11-30T00:00:00.000Z,373.03,Equity : Index Funds,44938
Bandhan CRISIL IBX Gilt April 2026 Index Fund-Reg(G),2025-11-30T00:00:00.000Z,371.4,Debt : Gilt,46815
ICICI Pru Global Advantage Fund(FOF)(G),2025-11-30T00:00:00.000Z,369.53,FoFs : Overseas,43240
Nippon India Nifty Auto ETF,2025-11-30T00:00:00.000Z,367.85,Equity : ETFs,45713
LIC MF Nifty 50 Index Fund(G),2025-11-30T00:00:00.000Z,366.82,Equity : Index Funds,2129
Tata Childrens Fund-Reg(G),2025-11-30T00:00:00.000Z,366.59,Hybrid : Solution Oriented,3304
Axis Credit Risk Fund-Reg(G),2025-11-30T00:00:00.000Z,366.48,Debt : Credit Risk,23018
Taurus Flexi Cap Fund-Reg(G),2025-10-31T00:00:00.000Z,363.83,Equity : Flexi Cap,3317
Samco Flexi Cap Fund-Reg(G),2025-10-31T00:00:00.000Z,363.22,Equity : Flexi Cap,46217
Union Value Fund-Reg(G),2025-10-31T00:00:00.000Z,362.18,Equity : Value / Contra,41740
Bandhan FTP-179-3652D-Reg(G),2025-11-30T00:00:00.000Z,361.41,Debt : FTP/FMP,42924
DSP NIFTY 1D Rate Liquid ETF,2025-11-30T00:00:00.000Z,361.19,Debt : ETFs,38904
Bajaj Finserv Nifty Bank ETF,2025-10-31T00:00:00.000Z,360.84,Equity : ETFs,48462
Kotak Nifty AAA Bond Financial Services Mar 2028 Index Fund-Reg(G),2025-10-31T00:00:00.000Z,358.49,Debt : Short Duration,49469
Samco Multi Asset Allocation Fund-Reg(G),2025-10-31T00:00:00.000Z,357.27,Hybrid : Multi Asset Allocation,49316
Quantum Gold Saving Fund-Reg(G),2025-11-30T00:00:00.000Z,357.1,Gold : MFs,19961
Bandhan Equity Savings Fund-Reg(G),2025-10-31T00:00:00.000Z,356.45,Hybrid : Equity Oriented,5300
Taurus Ethical Fund-Reg(G),2025-10-31T00:00:00.000Z,353.99,Equity : Multi Cap,7615
Bandhan Gilt Fund with 10 year constant duration Fund-Reg(G),2025-11-30T00:00:00.000Z,350.05,Debt : Gilt (10 Yr Constant Duration),1079
SBI FMP-61-1927D-Reg(G),2025-11-30T00:00:00.000Z,350.02,Debt : FTP/FMP,46511
LIC MF Midcap Fund-Reg(G),2025-11-30T00:00:00.000Z,349.56,Equity : Mid Cap,36348
SBI FMP-72-1239D-Reg(G),2025-11-30T00:00:00.000Z,349.35,Debt : FTP/FMP,47208
Mahindra Manulife Banking & Financial Services Fund-Reg(G),2025-10-31T00:00:00.000Z,348.2,Equity : Sectoral - Financial Services,49983
ITI Value Fund-Reg(G),2025-10-31T00:00:00.000Z,346.16,Equity : Value / Contra,45382
SBI BSE Sensex Index Fund-Reg(G),2025-10-31T00:00:00.000Z,346.01,Equity : Index Funds,47966
Navi Nifty Midcap 150 Index Fund-Reg(G),2025-10-31T00:00:00.000Z,345.98,Equity : Index Funds,45861
Samco Multi Cap Fund-Reg(G),2025-10-31T00:00:00.000Z,344.63,Equity : Multi Cap,49152
HDFC NIFTY Private Bank ETF,2025-10-31T00:00:00.000Z,340.58,Equity : ETFs,46045
Bank of India Multi Asset Allocation Fund-Reg(G),2025-11-30T00:00:00.000Z,340.15,Hybrid : Multi Asset Allocation,48027
ITI Bharat Consumption Fund-Reg(G),2025-10-31T00:00:00.000Z,339.7,Equity : Thematic - Consumption,49324
Altiva Hybrid Long-Short Fund-Reg(G),2025-10-31T00:00:00.000Z,339.69,Hybrid : Equity Oriented,75009
Baroda BNP Paribas Banking and Fin Serv Fund-Reg(G),2025-10-31T00:00:00.000Z,339.31,Equity : Sectoral - Financial Services,16955
Groww Nifty Total Market Index Fund-Reg(G),2025-10-31T00:00:00.000Z,338.59,Equity : Index Funds,48247
HDFC FMP-Sr 46-1359D-Sep 2022-Reg(G),2025-11-30T00:00:00.000Z,337.57,Debt : FTP/FMP,46945
UTI FTIF-XXXV-I(1260D)(G),2025-11-30T00:00:00.000Z,337.17,Debt : FTP/FMP,45364
Invesco India Technology Fund-Reg(G),2025-10-31T00:00:00.000Z,336.83,Equity : Sectoral - Technology,49047
Nippon India Nifty SDL Plus G-Sec-Jun 2028 Maturity 70:30 Index Fund-Reg(G),2025-11-30T00:00:00.000Z,336.39,Debt : Medium to Long Duration,46822
Bajaj Finserv Healthcare Fund-Reg(G),2025-10-31T00:00:00.000Z,335.88,Equity : Sectoral - Pharma,49421
ITI Banking & Financial Services Fund-Reg(G),2025-10-31T00:00:00.000Z,333.18,Equity : Sectoral - Financial Services,45720
ICICI Pru Nifty Infrastructure ETF,2025-11-30T00:00:00.000Z,331.77,Equity : ETFs,45998
Sundaram Arbitrage Fund(G),2025-10-31T00:00:00.000Z,331.15,Hybrid : Arbitrage,32098
ICICI Pru BSE 500 ETF,2025-11-30T00:00:00.000Z,331.03,Equity : ETFs,38531
Quant Commodities Fund-Reg(G),2025-11-30T00:00:00.000Z,331.02,Equity : Thematic,48343
UTI CRISIL SDL Maturity April 2033 Index Fund-Reg(G),2025-11-30T00:00:00.000Z,330.6,Debt : Long Duration,47337
SBI Nifty India Consumption Index Fund-Reg(G),2025-10-31T00:00:00.000Z,330.09,Equity : Index Funds,49106
Mirae Asset Nifty 1D Rate Liquid ETF(G),2025-11-30T00:00:00.000Z,329.22,Debt : ETFs,49344
Aditya Birla SL FTP-TI-1837D-Reg(G),2025-11-30T00:00:00.000Z,325.91,Debt : FTP/FMP,45593
Helios Balanced Advantage Fund-Reg(G),2025-11-30T00:00:00.000Z,325.75,Hybrid : Dynamic Asset Allocation,48678
Motilal Oswal Nifty Capital Market Index Fund-Reg(G),2025-11-30T00:00:00.000Z,325.44,Equity : Index Funds,49214
Nippon India ETF Nifty 100,2025-11-30T00:00:00.000Z,324.47,Equity : ETFs,17643
DSP CRISIL-IBX 50:50 Gilt Plus SDL - April 2033 Index Fund-Reg(G),2025-11-30T00:00:00.000Z,323.55,Debt : Long Duration,47476
Tata Income Plus Arbitrage Active FOF-Reg(G),2025-11-30T00:00:00.000Z,323.29,FoFs : Domestic,49848
SBI FMP-53-1839D-Reg(G),2025-11-30T00:00:00.000Z,321.87,Debt : FTP/FMP,45972
DSP Bond Fund-Reg(G),2025-11-30T00:00:00.000Z,319.74,Debt : Medium Duration,637
Navi Large & Midcap Fund-Reg(G),2025-10-31T00:00:00.000Z,318.87,Equity : Large & Mid Cap,31897
Bajaj Finserv Banking and PSU Fund-Reg(G),2025-11-30T00:00:00.000Z,318.63,Debt : Banking & PSU,48214
Motilal Oswal Active Momentum Fund-Reg(G),2025-11-30T00:00:00.000Z,317.91,Equity : Thematic,49517
Quant Teck Fund-Reg(G),2025-11-30T00:00:00.000Z,317.38,Equity : Sectoral - Technology,48195
Franklin India Floating Rate Fund(G),2025-11-30T00:00:00.000Z,316.84,Debt : Floater,3392
Axis Retirement Fund-Dynamic Plan-Reg(G),2025-10-31T00:00:00.000Z,316.43,Hybrid : Solution Oriented,43842
Axis CRISIL-IBX Financial Services 3-6 Months Debt Index Fund-Reg(G),2025-11-30T00:00:00.000Z,316.41,Debt : Ultra Short Duration,49971
Nippon India Nifty SDL Plus G-Sec - Jun 2029 Maturity 70:30 Index Fund-Reg(G),2025-11-30T00:00:00.000Z,315.12,Debt : Medium to Long Duration,46821
Invesco India Gilt Fund-Reg(G),2025-11-30T00:00:00.000Z,314.47,Debt : Gilt,4378
Samco Dynamic Asset Allocation Fund-Reg(G),2025-10-31T00:00:00.000Z,313.06,Hybrid : Dynamic Asset Allocation,48331
UTI Medium to Long Duration Fund-Reg(G),2025-11-30T00:00:00.000Z,312.61,Debt : Medium to Long Duration,3441
NJ ELSS Tax Saver Scheme-Reg(G),2025-11-30T00:00:00.000Z,311.84,Equity : Tax Saving (ELSS),46058
Edelweiss NIFTY Large Mid Cap 250 Index Fund-Reg(G),2025-10-31T00:00:00.000Z,311.3,Equity : Index Funds,45864
SBI FMP-51-1846D-Reg(G),2025-11-30T00:00:00.000Z,310.98,Debt : FTP/FMP,45889
SBI Nifty200 Quality 30 Index Fund-Reg(G),2025-10-31T00:00:00.000Z,309.67,Equity : Index Funds,49729
JM Focused Fund-Reg(G),2025-11-30T00:00:00.000Z,309.29,Equity : Large Cap,4282
Tata Nifty India Tourism Index Fund-Reg(G),2025-11-30T00:00:00.000Z,308.13,Equity : Index Funds,48992
Baroda BNP Paribas Short Duration Fund-Reg(G),2025-11-30T00:00:00.000Z,307.51,Debt : Short Duration,8374
Franklin India Ultra Short Duration Fund-Reg(G),2025-11-30T00:00:00.000Z,307.02,Debt : Ultra Short Duration,49073
Nippon India Active Momentum Fund-Reg(G),2025-11-30T00:00:00.000Z,307.02,Equity : Thematic,49115
Bandhan Floater Fund-Reg(G),2025-11-30T00:00:00.000Z,306.51,Debt : Floater,41962
HSBC Global Emerging Markets Fund(G),2025-11-30T00:00:00.000Z,305.97,FoFs : Overseas,4314
Groww Multi Asset Allocation Fund-Reg(G),2025-10-31T00:00:00.000Z,305.21,Hybrid : Multi Asset Allocation,50195
Axis Nifty 500 Index Fund-Reg(G),2025-10-31T00:00:00.000Z,304.58,Equity : Index Funds,48963
Canara Rob Overnight Fund-Reg(G),2025-11-30T00:00:00.000Z,304.01,Debt : Overnight,43350
HSBC Brazil Fund(G),2025-11-30T00:00:00.000Z,303.14,FoFs : Overseas,8587
HDFC NIFTY100 Low Volatility 30 Index Fund-Reg(G),2025-10-31T00:00:00.000Z,301.56,Equity : Index Funds,48653
Franklin Asian Equity Fund(G),2025-10-31T00:00:00.000Z,297.12,Equity : International,3813
Union Arbitrage Fund-Reg(G),2025-10-31T00:00:00.000Z,295.82,Hybrid : Arbitrage,42524
HSBC Gilt Fund-Reg(G),2025-11-30T00:00:00.000Z,295.06,Debt : Gilt,586
UTI Silver ETF FoF-Reg(G),2025-11-30T00:00:00.000Z,294.52,FoFs : Domestic,46882
PGIM India Money Market Fund-Reg(G),2025-11-30T00:00:00.000Z,294.25,Debt : Money Market,34742
LIC MF Banking & Financial Services Fund-Reg(G),2025-11-30T00:00:00.000Z,292.63,Equity : Sectoral - Financial Services,19955
Axis Long Duration Fund-Reg(G),2025-11-30T00:00:00.000Z,291.36,Debt : Long Duration,46626
Nippon India Japan Equity Fund(G),2025-11-30T00:00:00.000Z,289.88,Equity : International,24620
Aditya Birla SL BSE Sensex ETF,2025-10-31T00:00:00.000Z,289.07,Equity : ETFs,35815
Baroda BNP Paribas Low Duration Fund(G),2025-11-30T00:00:00.000Z,287.99,Debt : Low Duration,205
SBI Retirement Benefit Fund-Conservative Hybrid Plan-Reg(G),2025-11-30T00:00:00.000Z,287.43,Hybrid : Solution Oriented,30400
DSP Nifty Smallcap250 Quality 50 Index Fund-Reg(G),2025-10-31T00:00:00.000Z,286.77,Equity : Index Funds,48377
Kotak NIFTY Midcap 150 Momentum 50 Index Fund-Reg(G),2025-10-31T00:00:00.000Z,283.83,Equity : Index Funds,49180
Invesco India Income Plus Arbitrage Active FoF-Reg(G),2025-10-31T00:00:00.000Z,283.08,FoFs : Domestic,50006
LIC MF Arbitrage Fund-Reg(G),2025-11-30T00:00:00.000Z,281.55,Hybrid : Arbitrage,39948
Edelweiss Multi Asset Omni FoF-Reg(G),2025-10-31T00:00:00.000Z,279.74,FoFs : Domestic,50130
Invesco India Gold ETF FoF-Reg(G),2025-10-31T00:00:00.000Z,278.49,Gold : MFs,14593
Tata Equity Savings Fund-Reg(G),2025-11-30T00:00:00.000Z,276.87,Hybrid : Equity Oriented,3273
Aditya Birla SL CRISIL-IBX AAA NBFC-HFC Index-Dec 2025 Fund-Reg(G),2025-11-30T00:00:00.000Z,276.54,Debt : Short Duration,49202
Groww Nifty EV & New Age Automotive ETF,2025-10-31T00:00:00.000Z,276.09,Equity : ETFs,48978
ICICI Pru Nifty SDL Sep 2026 Index Fund-Reg(G),2025-11-30T00:00:00.000Z,274.58,Debt : Medium to Long Duration,47333
Aditya Birla SL Intl. Equity Fund(G),2025-10-31T00:00:00.000Z,273.51,Equity : International,460
Quant ESG Integration Strategy Fund-Reg(G),2025-11-30T00:00:00.000Z,273.02,Equity : Thematic,45130
SBI LT Advantage Fund-VI-Reg(G),2025-10-31T00:00:00.000Z,272.56,Equity : Tax Saving (ELSS),39495
Motilal Oswal Nifty 500 Momentum 50 ETF,2025-11-30T00:00:00.000Z,271.09,Equity : ETFs,49151
Baroda BNP Paribas Equity Savings Fund-Reg(G),2025-10-31T00:00:00.000Z,270.0,Hybrid : Equity Oriented,42783
LIC MF Short Duration Fund-Reg(G),2025-11-30T00:00:00.000Z,269.67,Debt : Short Duration,34304
Helios Overnight Fund-Reg(G),2025-11-30T00:00:00.000Z,268.9,Debt : Overnight,48295
SBI FMP-57-1835D-Reg(G),2025-11-30T00:00:00.000Z,267.92,Debt : FTP/FMP,46158
Mirae Asset Nifty Bank ETF,2025-10-31T00:00:00.000Z,267.34,Equity : ETFs,47993
UTI Income Plus Arbitrage Active FoF-Reg(G),2025-11-30T00:00:00.000Z,264.86,FoFs : Domestic,49714
SBI FMP-55-1849D-Reg(G),2025-11-30T00:00:00.000Z,264.59,Debt : FTP/FMP,46075
Aditya Birla SL Global Emerging Opp Fund(G),2025-10-31T00:00:00.000Z,263.08,FoFs : Overseas,6063
HDFC FMP-Sr 46-1406D-Aug 2022-Reg(G),2025-11-30T00:00:00.000Z,263.06,Debt : FTP/FMP,46755
Navi Flexi Cap Fund-Reg(G),2025-10-31T00:00:00.000Z,262.98,Equity : Flexi Cap,39516
SBI FMP-58-1842D-Reg(G),2025-11-30T00:00:00.000Z,261.47,Debt : FTP/FMP,46201
The Wealth Company Flexi Cap Fund-Reg(G),2025-11-30T00:00:00.000Z,261.26,Equity : Flexi Cap,50284
UTI Credit Risk Fund-Reg(G),2025-11-30T00:00:00.000Z,261.16,Debt : Credit Risk,14960
Aditya Birla SL Nifty Smallcap 50 Index Fund-Reg(G),2025-10-31T00:00:00.000Z,260.02,Equity : Index Funds,44737
Aditya Birla SL Multi-Asset Omni FOF(G),2025-10-31T00:00:00.000Z,259.19,FoFs : Domestic,2279
UTI Nifty Midcap 150 Quality 50 Index Fund-Reg(G),2025-11-30T00:00:00.000Z,259.07,Equity : Index Funds,45718
TRUSTMF Multi Cap Fund-Reg(G),2025-10-31T00:00:00.000Z,258.09,Equity : Multi Cap,49976
SBI FMP-60-1878D-Reg(G),2025-11-30T00:00:00.000Z,257.96,Debt : FTP/FMP,46397
Nippon India ETF Nifty 5 yr Benchmark G-Sec,2025-11-30T00:00:00.000Z,257.62,Debt : ETFs,45428
Kotak FMP-300-1223D(G),2025-11-30T00:00:00.000Z,257.35,Debt : FTP/FMP,47298
Bank of India Money Market Fund-Reg(G),2025-11-30T00:00:00.000Z,257.28,Debt : Money Market,49468
Bandhan Credit Risk Fund-Reg(G),2025-11-30T00:00:00.000Z,254.56,Debt : Credit Risk,36529
Kotak CRISIL-IBX AAA Bond Financial Services Index - Dec 2026 Fund-Reg(G),2025-11-30T00:00:00.000Z,254.01,Debt : Short Duration,49471
ICICI Pru Diversified Equity All Cap Omni FOF(G),2025-11-30T00:00:00.000Z,248.64,FoFs : Domestic,44626
WOC Balanced Hybrid Fund-Reg(G),2025-10-31T00:00:00.000Z,248.31,Hybrid : Dynamic Asset Allocation,48213
Bank of India Short Term Income Fund-Reg(G),2025-11-30T00:00:00.000Z,247.68,Debt : Short Duration,7456
HSBC Tax Saver Equity Fund(G),2025-11-30T00:00:00.000Z,245.87,Equity : Tax Saving (ELSS),1462
Shriram Overnight Fund-Reg(G),2025-11-30T00:00:00.000Z,245.5,Debt : Overnight,46777
ICICI Pru Nifty LargeMidcap 250 Index Fund-Reg(G),2025-11-30T00:00:00.000Z,245.35,Equity : Index Funds,48643
Mirae Asset Nifty MidSmallcap400 Momentum Quality 100 ETF FoF-Reg(G),2025-10-31T00:00:00.000Z,245.13,FoFs : Domestic,48822
DSP Gold ETF FoF-Reg(G),2025-10-31T00:00:00.000Z,244.57,Gold : MFs,48322
Axis Nifty AAA Bond Plus SDL Apr 2026 50:50 ETF FoF-Reg(G),2025-11-30T00:00:00.000Z,243.27,Debt : Medium to Long Duration,45699
Kotak Energy Opportunities Fund-Reg(G),2025-10-31T00:00:00.000Z,241.84,Equity : Sectoral - Energy / Power,49185
Baroda BNP Paribas Gold ETF,2025-10-31T00:00:00.000Z,241.0,Gold : ETFs,48145
HDFC BSE 500 Index Fund-Reg(G),2025-10-31T00:00:00.000Z,238.74,Equity : Index Funds,47913
Nippon India Diversified Equity Flexicap Passive FoF-Reg(G),2025-11-30T00:00:00.000Z,238.71,FoFs : Domestic,43928
Angel One Nifty 1D Rate Liquid ETF(G),2025-11-30T00:00:00.000Z,237.83,Debt : ETFs,49740
Aditya Birla SL Global Excellence Equity FoF(G),2025-10-31T00:00:00.000Z,236.56,FoFs : Overseas,3841
Axis Conservative Hybrid Fund-Reg(G),2025-11-30T00:00:00.000Z,236.35,Hybrid : Debt Oriented (Conservative),9765
Groww Nifty India Defence ETF,2025-10-31T00:00:00.000Z,236.03,Equity : ETFs,49018
Nippon India FMP-XLV-5-1158D(G),2025-11-30T00:00:00.000Z,235.82,Debt : FTP/FMP,47900
Nippon India FMP-XLIII-1-1755D(IDCW),2025-11-30T00:00:00.000Z,235.46,Debt : FTP/FMP,45796
Groww Multicap Fund-Reg(G),2025-10-31T00:00:00.000Z,234.79,Equity : Multi Cap,49400
SBI FMP-45-1840D-Reg(G),2025-11-30T00:00:00.000Z,234.37,Debt : FTP/FMP,45580
Groww Gold ETF,2025-10-31T00:00:00.000Z,232.85,Gold : ETFs,49188
ITI Pharma & Healthcare Fund-Reg(G),2025-10-31T00:00:00.000Z,232.83,Equity : Sectoral - Pharma,45724
Aditya Birla SL Dynamic Asset Allocation Omni FOF(G),2025-10-31T00:00:00.000Z,231.28,FoFs : Domestic,8303
SBI Equity Minimum Variance Fund-Reg(G),2025-10-31T00:00:00.000Z,229.45,Equity : Thematic,33878
Mirae Asset CRISIL IBX Gilt Index - April 2033 Index Fund-Reg(G),2025-11-30T00:00:00.000Z,228.78,Debt : Gilt,47042
UTI Nifty Private Bank Index Fund-Reg(G),2025-11-30T00:00:00.000Z,228.32,Equity : Index Funds,49146
JM ELSS Tax Saver Fund(G),2025-11-30T00:00:00.000Z,228.21,Equity : Tax Saving (ELSS),4198
Aditya Birla SL FTP-TQ-1879D-Reg(G),2025-11-30T00:00:00.000Z,227.8,Debt : FTP/FMP,46536
Quantum ELSS Tax Saver Fund-Reg(G),2025-11-30T00:00:00.000Z,226.78,Equity : Tax Saving (ELSS),19878
Tata BSE Select Business Groups Index Fund-Reg(G),2025-11-30T00:00:00.000Z,223.78,Equity : Index Funds,49326
ICICI Pru Nifty Financial Services Ex-Bank ETF,2025-11-30T00:00:00.000Z,222.76,Equity : ETFs,47166
Kotak Gold Silver Passive FOF-Reg(G),2025-10-31T00:00:00.000Z,220.91,Gold : MFs,50159
JM Overnight Fund-Reg(G),2025-11-30T00:00:00.000Z,220.88,Debt : Overnight,44156
Aditya Birla SL Nifty Next 50 Index Fund-Reg(G),2025-10-31T00:00:00.000Z,220.77,Equity : Index Funds,46360
Quant Consumption Fund-Reg(G),2025-11-30T00:00:00.000Z,218.24,Equity : Thematic - Consumption,48342
Mirae Asset Nifty India Manufacturing ETF,2025-10-31T00:00:00.000Z,218.17,Equity : ETFs,45869
Mirae Asset Nifty Smallcap 250 Momentum Quality 100 ETF FoF-Reg(G),2025-10-31T00:00:00.000Z,217.8,FoFs : Domestic,48497
Aditya Birla SL Nifty IT ETF,2025-10-31T00:00:00.000Z,216.72,Equity : ETFs,45697
PGIM India Aggressive Hybrid Equity Fund(G),2025-10-31T00:00:00.000Z,215.89,Hybrid : Equity Oriented,835
ICICI Pru Nifty Oil & Gas ETF,2025-11-30T00:00:00.000Z,215.88,Equity : ETFs,33836
Helios Financial Services Fund-Reg(G),2025-11-30T00:00:00.000Z,215.03,Equity : Sectoral - Financial Services,48897
UTI BSE Sensex Index Fund-Reg(G),2025-11-30T00:00:00.000Z,214.4,Equity : Index Funds,46317
Kotak Global Emerging Market Overseas Equity Omni FOF(G),2025-10-31T00:00:00.000Z,213.9,FoFs : Overseas,2047
SBI LT Advantage Fund-IV-Reg(G),2025-10-31T00:00:00.000Z,213.14,Equity : Tax Saving (ELSS),36734
Aditya Birla SL CRISIL-IBX AAA NBFC-HFC Index-Sep 2026 Fund-Reg(G),2025-11-30T00:00:00.000Z,212.98,Debt : Short Duration,49201
Edelweiss Nifty 50 Index Fund-Reg(G),2025-10-31T00:00:00.000Z,212.85,Equity : Index Funds,45957
Edelweiss Income Plus Arbitrage Active FoF-Reg(G),2025-10-31T00:00:00.000Z,211.99,FoFs : Domestic,50022
Bandhan Nifty 100 Index Fund-Reg(G),2025-10-31T00:00:00.000Z,211.32,Equity : Index Funds,46119
Mirae Asset Gold ETF FoF-Reg(G),2025-10-31T00:00:00.000Z,211.19,Gold : ETFs,49290
Mirae Asset Nifty200 Alpha 30 ETF FoF-Reg(G),2025-10-31T00:00:00.000Z,210.09,FoFs : Domestic,48937
Tata Nifty200 Alpha 30 Index Fund-Reg(G),2025-11-30T00:00:00.000Z,209.51,Equity : Index Funds,49080
PGIM India Ultra Short Duration Fund(G),2025-11-30T00:00:00.000Z,209.43,Debt : Ultra Short Duration,5925
ICICI Pru Multi Sector Passive FOF(G),2025-11-30T00:00:00.000Z,209.4,FoFs : Domestic,1698
SBI FMP-73-1226D-Reg(G),2025-11-30T00:00:00.000Z,208.82,Debt : FTP/FMP,47260
DSP Credit Risk Fund-Reg(G),2025-11-30T00:00:00.000Z,208.64,Debt : Credit Risk,685
Bank of India Large Cap Fund-Reg(G),2025-10-31T00:00:00.000Z,207.85,Equity : Large Cap,45571
The Wealth Company Arbitrage Fund-Reg(G),2025-11-30T00:00:00.000Z,207.81,Hybrid : Arbitrage,50304
