s_name,aumdate,aumtotal,classification,schemecode
Union Diversified Equity All Cap Active FOF-Reg(G),2025-10-31T00:00:00.000Z,206.26,FoFs : Domestic,50158
Aditya Birla SL CRISIL IBX Gilt - April 2026 Index Fund-Reg(G),2025-11-30T00:00:00.000Z,205.56,Debt : Medium Duration,46891
Motilal Oswal Nifty Realty ETF,2025-11-30T00:00:00.000Z,204.92,Equity : ETFs,48548
Franklin India Conservative Hybrid Fund(G),2025-11-30T00:00:00.000Z,204.88,Hybrid : Debt Oriented (Conservative),1018
LIC MF Value Fund-Reg(G),2025-11-30T00:00:00.000Z,204.07,Equity : Value / Contra,39956
360 ONE Multi Asset Allocation Fund-Reg(G),2025-10-31T00:00:00.000Z,203.54,Hybrid : Multi Asset Allocation,49121
Nippon India ETF Nifty India Consumption,2025-11-30T00:00:00.000Z,203.23,Equity : ETFs,17478
LIC MF Medium to Long Duration Fund-Reg(G),2025-11-30T00:00:00.000Z,200.98,Debt : Medium to Long Duration,2087
SBI FMP-68-1302D-Reg(G),2025-11-30T00:00:00.000Z,200.49,Debt : FTP/FMP,46919
Bajaj Finserv Nifty 50 ETF,2025-10-31T00:00:00.000Z,199.86,Equity : ETFs,48461
Mahindra Manulife Ultra Short Duration Fund-Reg(G),2025-11-30T00:00:00.000Z,199.69,Debt : Ultra Short Duration,43845
Baroda BNP Paribas Credit Risk Fund-Reg(G),2025-11-30T00:00:00.000Z,199.04,Debt : Credit Risk,25569
Shriram Multi Sector Rotation Fund-Reg(G),2025-11-30T00:00:00.000Z,198.61,Equity : Thematic,49112
Axis US Specific Equity Passive FOF-Reg(G),2025-10-31T00:00:00.000Z,196.05,FoFs : Overseas,47017
Baroda BNP Paribas Dynamic Bond Fund(G),2025-11-30T00:00:00.000Z,196.01,Debt : Dynamic Bond,116
LIC MF Ultra Short Duration Fund-Reg(G),2025-11-30T00:00:00.000Z,195.36,Debt : Ultra Short Duration,44073
Sundaram Short Duration Fund(G),2025-11-30T00:00:00.000Z,193.66,Debt : Short Duration,2381
Canara Rob Banking and PSU Debt Fund-Reg(G),2025-11-30T00:00:00.000Z,193.41,Debt : Banking & PSU,46050
HSBC CRISIL IBX Gilt June 2027 Index Fund-Reg(G),2025-11-30T00:00:00.000Z,193.22,Debt : Medium Duration,47676
WOC Equity Savings Fund-Reg(G),2025-10-31T00:00:00.000Z,193.22,Hybrid : Equity Oriented,49513
Nippon India Nifty IT Index Fund-Reg(G),2025-11-30T00:00:00.000Z,192.79,Equity : Index Funds,48568
ICICI Pru Nifty50 Value 20 ETF,2025-11-30T00:00:00.000Z,192.52,Equity : ETFs,33839
DSP FMP 270-1144D-Reg(G),2025-11-30T00:00:00.000Z,192.24,Debt : FTP/FMP,47634
HDFC Charity Fund for Cancer Cure-Reg(50% IDCW Donation Option),2025-11-30T00:00:00.000Z,190.3,Debt : FTP/FMP,46200
Kotak Nifty SDL Jul 2033 Index Fund-Reg(G),2025-10-31T00:00:00.000Z,189.61,Debt : Long Duration,47612
HDFC Nifty SDL Oct 2026 Index Fund-Reg(G),2025-11-30T00:00:00.000Z,188.4,Debt : Medium Duration,46867
UTI FTIF-XXXV-II(1223D)(G),2025-11-30T00:00:00.000Z,187.96,Debt : FTP/FMP,47273
Franklin India G-Sec Fund(G),2025-11-30T00:00:00.000Z,187.22,Debt : Gilt,3373
HDFC Nifty India Digital Index Fund-Reg(G),2025-10-31T00:00:00.000Z,186.94,Equity : Index Funds,49178
Edelweiss Nifty Smallcap 250 Index Fund-Reg(G),2025-10-31T00:00:00.000Z,186.48,Equity : Index Funds,47167
Bandhan Retirement Fund-Reg(G),2025-10-31T00:00:00.000Z,186.48,Hybrid : Solution Oriented,48226
Union Retirement Fund-Reg(G),2025-10-31T00:00:00.000Z,186.21,Hybrid : Solution Oriented,45735
Capitalmind Flexi Cap Fund-Reg(G),2025-10-31T00:00:00.000Z,185.87,Equity : Flexi Cap,50096
ICICI Pru Nifty50 Equal Weight Index Fund-Reg(G),2025-11-30T00:00:00.000Z,183.34,Equity : Index Funds,46902
Nippon India FMP-XLIII-5-2315D(G),2025-11-30T00:00:00.000Z,183.17,Debt : FTP/FMP,46433
Edelweiss US Value Equity Offshore Fund-Reg(G),2025-10-31T00:00:00.000Z,182.88,FoFs : Overseas,21920
Shriram Liquid Fund-Reg(G),2025-11-30T00:00:00.000Z,182.38,Debt : Liquid,48954
Nippon India Nifty Bank Index Fund-Reg(G),2025-11-30T00:00:00.000Z,182.08,Equity : Index Funds,48148
Union Gold ETF,2025-10-31T00:00:00.000Z,181.96,Gold : ETFs,49576
Tata Nifty India Digital ETF,2025-11-30T00:00:00.000Z,181.76,Equity : ETFs,45944
Aditya Birla SL US Treasury 3-10 year Bond ETFs FoF-Reg(G),2025-10-31T00:00:00.000Z,181.55,Debt : ETFs,48284
JM Low Duration Fund(G),2025-11-30T00:00:00.000Z,181.11,Debt : Low Duration,1938
Motilal Oswal Nifty 500 ETF,2025-11-30T00:00:00.000Z,180.88,Equity : ETFs,48267
DSP Regular Savings Fund-Reg(G),2025-11-30T00:00:00.000Z,180.25,Hybrid : Debt Oriented (Conservative),719
Tata Nifty Midcap 150 Index Fund-Reg(G),2025-11-30T00:00:00.000Z,179.06,Equity : Index Funds,49937
DSP Nifty PSU Bank ETF,2025-10-31T00:00:00.000Z,178.96,Equity : ETFs,47908
Axis NIFTY IT ETF,2025-10-31T00:00:00.000Z,178.57,Equity : ETFs,45427
Unifi Liquid Fund-Reg(G),2025-11-30T00:00:00.000Z,178.22,Debt : Liquid,49844
ICICI Pru Nifty Auto Index Fund-Reg(G),2025-11-30T00:00:00.000Z,176.29,Equity : Sectoral - Auto,45995
ICICI Pru Nifty 200 Quality 30 ETF,2025-11-30T00:00:00.000Z,175.75,Equity : ETFs,48118
Mirae Asset CRISIL-IBX Financial Services 9-12 Months Debt Index Fund-Reg(G),2025-11-30T00:00:00.000Z,175.68,Debt : Low Duration,49980
Groww Liquid Fund-Reg(G),2025-11-30T00:00:00.000Z,175.54,Debt : Liquid,15502
SBI Retirement Benefit Fund-Conservative Plan-Reg(G),2025-11-30T00:00:00.000Z,174.57,Hybrid : Solution Oriented,30401
Tata Retirement Sav Fund - Cons Plan(G),2025-11-30T00:00:00.000Z,174.34,Hybrid : Solution Oriented,15378
Edelweiss Nifty Next 50 Index Fund-Reg(G),2025-10-31T00:00:00.000Z,173.77,Equity : Index Funds,47171
LIC MF Focused Fund-Reg(G),2025-11-30T00:00:00.000Z,173.04,Equity : Large Cap,32627
Edelweiss Europe Dynamic Equity Off-shore Fund-Reg(G),2025-10-31T00:00:00.000Z,172.25,FoFs : Overseas,24618
Invesco India Medium Duration Fund-Reg(G),2025-11-30T00:00:00.000Z,172.19,Debt : Medium Duration,45607
SBI FMP-76-1221D-Reg(G),2025-11-30T00:00:00.000Z,171.87,Debt : FTP/FMP,47541
Quantum Small Cap Fund-Reg(G),2025-11-30T00:00:00.000Z,171.55,Equity : Small Cap,48248
UTI Nifty SDL Plus AAA PSU Bond Apr 2026 75:25 Index Fund-Reg(G),2025-11-30T00:00:00.000Z,171.34,Debt : Medium Duration,47587
Mirae Asset Nifty EV and New Age Automotive ETF,2025-10-31T00:00:00.000Z,170.93,Equity : ETFs,48935
Invesco India Banking and PSU Fund-Reg(G),2025-11-30T00:00:00.000Z,170.71,Debt : Banking & PSU,17249
Kotak Nifty 100 Low Volatility 30 ETF,2025-10-31T00:00:00.000Z,170.53,Equity : ETFs,45688
HSBC Dynamic Bond Fund-Reg(G),2025-11-30T00:00:00.000Z,170.49,Debt : Dynamic Bond,925
Invesco India - Invesco Global Equity Income FoF-Reg(G),2025-10-31T00:00:00.000Z,169.7,FoFs : Overseas,24405
Kotak Nifty Smallcap 50 Index Fund-Reg(G),2025-10-31T00:00:00.000Z,169.49,Equity : Index Funds,46631
HDFC NIFTY G-Sec Apr 2029 Index Fund-Reg(G),2025-11-30T00:00:00.000Z,169.33,Debt : Medium to Long Duration,47712
Union Money Market Fund-Reg(G),2025-11-30T00:00:00.000Z,168.85,Debt : Money Market,45360
DSP World Mining Overseas Equity Omni FoF-Reg(G),2025-10-31T00:00:00.000Z,168.58,FoFs : Overseas,8359
HDFC FMP-Sr 46-1158D-July 2022-Reg(G),2025-08-31T00:00:00.000Z,168.34,Debt : FTP/FMP,46672
Edelweiss MSCI India Domestic & World Healthcare 45 Index Fund-Reg(G),2025-10-31T00:00:00.000Z,167.84,Equity : Index Funds,45117
Quant Arbitrage Fund-Reg(G),2025-11-30T00:00:00.000Z,167.74,Hybrid : Arbitrage,49743
HDFC Nifty100 Quality 30 Index Fund-Reg(G),2025-10-31T00:00:00.000Z,166.91,Equity : Index Funds,49573
Nippon India ETF Nifty Infrastructure BeES,2025-11-30T00:00:00.000Z,166.86,Equity : ETFs,12859
Samco Special Opportunities Fund-Reg(G),2025-10-31T00:00:00.000Z,166.05,Equity : Thematic,48744
Bank of India Ultra Short Duration Fund-Reg(G),2025-11-30T00:00:00.000Z,165.9,Debt : Ultra Short Duration,5842
ITI Ultra Short Duration Fund-Reg(G),2025-11-30T00:00:00.000Z,165.46,Debt : Ultra Short Duration,45498
Tata Nifty G-Sec Dec 2029 Index Fund-Reg(G),2025-11-30T00:00:00.000Z,165.16,Debt : Medium to Long Duration,47405
HDFC FMP-Sr 47-2638D-Feb 2023-Reg(G),2025-11-30T00:00:00.000Z,164.36,Debt : FTP/FMP,47642
SBI FMP-74-1243D-Reg(G),2025-11-30T00:00:00.000Z,164.33,Debt : FTP/FMP,47381
Groww Silver ETF,2025-10-31T00:00:00.000Z,164.16,FoFs : Domestic,49846
ICICI Pru Quant Fund(G),2025-11-30T00:00:00.000Z,163.65,Equity : Thematic,42805
Edelweiss Emerging Markets Opp Eq. Offshore Fund-Reg(G),2025-10-31T00:00:00.000Z,163.61,FoFs : Overseas,20281
HDFC Retirement Savings Fund-Hybrid-Debt Plan-Reg(G),2025-11-30T00:00:00.000Z,161.67,Hybrid : Solution Oriented,24807
Tata Nifty MidSmall Healthcare Index Fund-Reg(G),2025-11-30T00:00:00.000Z,161.36,Equity : Index Funds,48764
DSP Nifty 50 ETF,2025-10-31T00:00:00.000Z,160.45,Equity : ETFs,36811
Nippon India ETF Nifty 50 Value 20,2025-11-30T00:00:00.000Z,159.11,Equity : ETFs,31920
Edelweiss Nifty 100 Quality 30 Index Fund-Reg(G),2025-10-31T00:00:00.000Z,158.74,Equity : Index Funds,45961
Edelweiss Overnight Fund-Reg(G),2025-11-30T00:00:00.000Z,158.13,Debt : Overnight,42955
ICICI Pru Nifty Auto ETF,2025-11-30T00:00:00.000Z,157.89,Equity : ETFs,46229
Aditya Birla SL CRISIL IBX SDL Jun 2032 Index Fund-Reg(G),2025-11-30T00:00:00.000Z,157.43,Debt : Long Duration,47592
Groww Nifty EV & New Age Automotive ETF FOF-Reg(G),2025-10-31T00:00:00.000Z,156.5,FoFs : Domestic,48990
Baroda BNP Paribas NIFTY SDL Dec 2026 Index Fund-Reg(G),2025-11-30T00:00:00.000Z,156.28,Debt : Medium to Long Duration,47387
ICICI Pru Nifty 100 ETF,2025-11-30T00:00:00.000Z,156.18,Equity : ETFs,22404
Unifi Flexi Cap Fund-Reg(G),2025-10-31T00:00:00.000Z,155.65,Equity : Flexi Cap,49807
Aditya Birla SL Long Duration Fund-Reg(G),2025-11-30T00:00:00.000Z,155.54,Debt : Long Duration,46711
Edelweiss Government Securities Fund-Reg(G),2025-11-30T00:00:00.000Z,154.76,Debt : Gilt,21922
Invesco India Credit Risk Fund-Reg(G),2025-11-30T00:00:00.000Z,154.76,Debt : Credit Risk,21522
Bandhan CRISIL IBX 90:10 SDL Plus Gilt - Sep 2027 Index Fund-Reg(G),2025-11-30T00:00:00.000Z,150.85,Debt : Gilt,46212
Nippon India Retirement Fund-Income Generation(G),2025-11-30T00:00:00.000Z,150.14,Hybrid : Solution Oriented,17166
Mirae Asset Nifty IT ETF,2025-10-31T00:00:00.000Z,148.8,Equity : ETFs,48250
HSBC Conservative Hybrid Fund(G),2025-11-30T00:00:00.000Z,148.63,Hybrid : Debt Oriented (Conservative),1458
Edelweiss CRISIL IBX 50:50 Gilt Plus SDL Short Duration Index Fund-Reg(G),2025-11-30T00:00:00.000Z,147.67,Debt : Short Duration,47430
Edelweiss Nifty Alpha Low Volatility 30 Index Fund-Reg(G),2025-10-31T00:00:00.000Z,147.48,Equity : Index Funds,48808
Canara Rob Gilt Fund-Reg(G),2025-11-30T00:00:00.000Z,146.23,Debt : Gilt,538
Sundaram Global Brand Theme - Equity Active FoF(G),2025-10-31T00:00:00.000Z,145.02,FoFs : Overseas,3005
Edelweiss CRISIL IBX 50:50 Gilt Plus SDL Sep 2028 Index Fund-Reg(G),2025-11-30T00:00:00.000Z,144.84,Debt : Medium to Long Duration,47075
Samco Large & Mid Cap Fund-Reg(G),2025-10-31T00:00:00.000Z,144.46,Equity : Large & Mid Cap,49779
Bank of India Balanced Advantage Fund-Reg(G),2025-10-31T00:00:00.000Z,144.4,Hybrid : Dynamic Asset Allocation,21917
Axis Nifty Bank Index Fund-Reg(G),2025-10-31T00:00:00.000Z,143.27,Equity : Index Funds,48680
Samco Large Cap Fund-Reg(G),2025-10-31T00:00:00.000Z,143.27,Equity : Large Cap,49506
Motilal Oswal Quant Fund-Reg(G),2025-11-30T00:00:00.000Z,143.19,Equity : Thematic,48806
SBI FMP-52-1848D-Reg(G),2025-11-30T00:00:00.000Z,142.7,Debt : FTP/FMP,45915
HSBC Nifty Next 50 Index Fund-Reg(G),2025-11-30T00:00:00.000Z,141.89,Equity : Index Funds,33548
Kotak Long Duration Fund-Reg(G),2025-11-30T00:00:00.000Z,141.05,Debt : Long Duration,48538
UTI Gilt Fund with 10 year Constant Duration-Reg(G),2025-11-30T00:00:00.000Z,140.6,Debt : Gilt (10 Yr Constant Duration),40967
Union Equity Savings Fund-Reg(G),2025-10-31T00:00:00.000Z,139.88,Hybrid : Equity Oriented,40627
Shriram Multi Asset Allocation Fund-Reg(G),2025-11-30T00:00:00.000Z,139.6,Hybrid : Multi Asset Allocation,48029
Zerodha Nifty Midcap 150 ETF,2025-10-31T00:00:00.000Z,138.95,Equity : ETFs,48886
Axis Income Plus Arbitrage Passive FOF-Reg(G),2025-11-30T00:00:00.000Z,138.14,FoFs : Domestic,50378
ICICI Pru FMP-88-1226D-F(G),2025-11-30T00:00:00.000Z,138.12,Debt : FTP/FMP,47232
Bandhan Nifty200 Momentum 30 Index Fund-Reg(G),2025-10-31T00:00:00.000Z,137.88,Equity : Index Funds,46608
Motilal Oswal Nifty 5 Year Benchmark G-Sec ETF,2025-10-31T00:00:00.000Z,137.72,Debt : ETFs,45196
Shriram Flexi Cap Fund-Reg(G),2025-11-30T00:00:00.000Z,137.54,Equity : Flexi Cap,38781
SBI FMP-46-1850D-Reg(G),2025-11-30T00:00:00.000Z,136.71,Debt : FTP/FMP,45620
Axis BSE Sensex ETF,2025-10-31T00:00:00.000Z,136.7,Equity : ETFs,47768
Bandhan Long Duration Fund-Reg(G),2025-11-30T00:00:00.000Z,136.13,Debt : Long Duration,48582
Tata Floating Rate Fund-Reg(G),2025-11-30T00:00:00.000Z,135.72,Debt : Floater,45375
Axis NIFTY IT Index Fund-Reg(G),2025-10-31T00:00:00.000Z,134.7,Equity : Index Funds,47983
Bandhan US Treasury Bond 0-1 year specific Debt Passive FOF-Reg(G),2025-10-31T00:00:00.000Z,134.68,FoFs : Overseas,47724
Groww Short Duration Fund-Reg(G),2025-11-30T00:00:00.000Z,134.63,Debt : Short Duration,23158
Quantum Diversified Equity All Cap Active FOF-Reg(G),2025-11-30T00:00:00.000Z,134.4,FoFs : Domestic,19904
Nippon India Medium Duration Fund(G),2025-11-30T00:00:00.000Z,134.04,Debt : Medium Duration,21911
Nippon India Nifty G-Sec Oct 2028 Maturity Index Fund-Reg(G),2025-11-30T00:00:00.000Z,133.87,Debt : Medium to Long Duration,47629
Kotak FMP-310-1131D(G),2025-11-30T00:00:00.000Z,133.86,Debt : FTP/FMP,47871
Tata Nifty India Digital ETF FoF-Reg(G),2025-11-30T00:00:00.000Z,133.81,FoFs : Domestic,46355
Taurus Mid Cap Fund-Reg(G),2025-10-31T00:00:00.000Z,133.35,Equity : Mid Cap,3306
360 ONE Overnight Fund-Reg(G),2025-11-30T00:00:00.000Z,132.43,Debt : Overnight,44412
Kotak NIFTY 100 Low Volatility 30 Index Fund-Reg(G),2025-10-31T00:00:00.000Z,132.24,Equity : Index Funds,45716
Motilal Oswal Nifty 200 Momentum 30 ETF,2025-11-30T00:00:00.000Z,132.23,Equity : ETFs,46325
Groww Largecap Fund-Reg(G),2025-10-31T00:00:00.000Z,132.11,Equity : Large Cap,15997
SBI Magnum Childrens Benefit Fund-Savings Plan,2025-11-30T00:00:00.000Z,131.9,Hybrid : Solution Oriented,2748
Edelweiss ASEAN Equity Off-Shore Fund-Reg(G),2025-10-31T00:00:00.000Z,131.49,FoFs : Overseas,13404
TRUSTMF Banking & PSU Fund-Reg(G),2025-11-30T00:00:00.000Z,131.49,Debt : Banking & PSU,45242
Sundaram Nifty 100 Equal Weight Fund(G),2025-10-31T00:00:00.000Z,131.46,Equity : Index Funds,2384
Motilal Oswal Nifty Smallcap 250 ETF,2025-11-30T00:00:00.000Z,131.01,Equity : ETFs,48657
DSP FMP 268-1281D-Reg(G),2025-11-30T00:00:00.000Z,130.63,Debt : FTP/FMP,47124
SBI FMP-78-1170D-Reg(G),2025-11-30T00:00:00.000Z,130.11,Debt : FTP/FMP,47638
ICICI Pru Nifty Healthcare ETF,2025-11-30T00:00:00.000Z,129.47,Equity : ETFs,45383
SBI Nifty Bank Index Fund-Reg(G),2025-10-31T00:00:00.000Z,129.29,Equity : Index Funds,49104
Union Income Plus Arbitrage Active FOF-Reg(G),2025-10-31T00:00:00.000Z,128.88,FoFs : Domestic,49932
Motilal Oswal NASDAQ Q 50 ETF,2025-11-30T00:00:00.000Z,127.16,Equity : ETFs,46181
Tata Nifty500 Multicap India Manufacturing 50:30:20 Index Fund-Reg(G),2025-11-30T00:00:00.000Z,127.13,Equity : Index Funds,48782
Kotak Nifty Commodities Index Fund-Reg(G),2025-10-31T00:00:00.000Z,126.89,Equity : Thematic,49317
Axis Floater Fund-Reg(G),2025-11-30T00:00:00.000Z,126.85,Debt : Floater,45632
SBI FMP-50-1843D-Reg(G),2025-11-30T00:00:00.000Z,126.67,Debt : FTP/FMP,45842
ICICI Pru Strategic Metal and Energy Equity FoF-Reg(G),2025-11-30T00:00:00.000Z,126.09,FoFs : Overseas,46205
Navi Aggressive Hybrid Fund-Reg(G),2025-10-31T00:00:00.000Z,125.96,Hybrid : Equity Oriented,39479
HDFC NIFTY Realty Index Fund-Reg(G),2025-10-31T00:00:00.000Z,123.82,Equity : Index Funds,48654
Samco ELSS Tax Saver Fund-Reg(G),2025-10-31T00:00:00.000Z,123.5,Equity : Tax Saving (ELSS),46606
Motilal Oswal BSE Enhanced Value ETF,2025-11-30T00:00:00.000Z,122.99,Equity : ETFs,46740
Baroda BNP Paribas Multi Asset Active FoF-Reg(G),2025-10-31T00:00:00.000Z,122.56,FoFs : Domestic,49872
Groww Nifty Smallcap 250 Index Fund-Reg(G),2025-10-31T00:00:00.000Z,121.54,Equity : Index Funds,48617
Canara Rob Income Fund-Reg(G),2025-11-30T00:00:00.000Z,121.22,Debt : Medium to Long Duration,542
SBI FMP-43-1616D-Reg(G),2025-08-31T00:00:00.000Z,121.08,Debt : FTP/FMP,45525
Tata Nifty Next 50 Index Fund-Reg(G),2025-11-30T00:00:00.000Z,119.52,Equity : Index Funds,50239
Nippon India FMP-XLV-4-1111D(G),2025-11-30T00:00:00.000Z,118.89,Debt : FTP/FMP,47822
UTI NIFTY50 Equal Weight Index Fund-Reg(G),2025-11-30T00:00:00.000Z,118.79,Equity : Index Funds,47962
Kotak FMP-304-3119D(G),2025-11-30T00:00:00.000Z,118.52,Debt : FTP/FMP,47401
Quantum Dynamic Bond Fund-Reg(G),2025-11-30T00:00:00.000Z,118.0,Debt : Dynamic Bond,37428
Aditya Birla SL Retirement Fund-40-Reg(G),2025-10-31T00:00:00.000Z,117.7,Hybrid : Solution Oriented,42770
Mirae Asset Nifty 100 ESG Sector Leaders ETF,2025-10-31T00:00:00.000Z,117.37,Equity : ETFs,45134
Mirae Asset Dynamic Bond Fund-Reg(G),2025-11-30T00:00:00.000Z,117.22,Debt : Dynamic Bond,36556
Motilal Oswal Asset Allocation Passive FoF-Aggressive-Reg(G),2025-11-30T00:00:00.000Z,117.09,FoFs : Domestic,45344
Groww Nifty 1D Rate Liquid ETF,2025-11-30T00:00:00.000Z,116.98,Debt : ETFs,49128
ITI Dynamic Bond Fund-Reg(G),2025-11-30T00:00:00.000Z,116.02,Debt : Dynamic Bond,45597
Motilal Oswal BSE Low Volatility Index Fund-Reg(G),2025-11-30T00:00:00.000Z,115.85,Equity : Index Funds,46438
Mirae Asset Nifty India Manufacturing ETF FoF-Reg(G),2025-10-31T00:00:00.000Z,114.14,FoFs : Domestic,46053
Edelweiss CRISIL IBX AAA Financial Services Bond - Jan 2028 Index Fund-Reg(G),2025-11-30T00:00:00.000Z,113.47,Debt : Medium to Long Duration,49393
Groww Overnight Fund-Reg(G),2025-11-30T00:00:00.000Z,113.32,Debt : Overnight,42042
Canara Rob Corp Bond Fund-Reg(G),2025-11-30T00:00:00.000Z,112.96,Debt : Corporate Bond,23504
ICICI Pru Nifty200 Value 30 Index Fund-Reg(G),2025-11-30T00:00:00.000Z,111.8,Equity : Index Funds,49113
TRUSTMF Money Market Fund-Reg(G),2025-11-30T00:00:00.000Z,111.77,Debt : Money Market,46735
Union Gilt Fund-Reg(G),2025-11-30T00:00:00.000Z,111.58,Debt : Gilt,46221
SBI Nifty200 Momentum 30 Index Fund-Reg(G),2025-10-31T00:00:00.000Z,111.56,Equity : Index Funds,49727
TRUSTMF Short Duration Fund-Reg(G),2025-11-30T00:00:00.000Z,111.52,Debt : Short Duration,45652
Quant Gilt Fund-Reg(G),2025-11-30T00:00:00.000Z,110.46,Debt : Gilt,47345
Axis Nifty500 Momentum 50 Index Fund-Reg(G),2025-10-31T00:00:00.000Z,109.54,Equity : Index Funds,49216
DSP Global Clean Energy Overseas Equity Omni FoF-Reg(G),2025-10-31T00:00:00.000Z,109.11,FoFs : Overseas,7866
ICICI Pru Diversified Debt Strategy Active FOF(G),2025-11-30T00:00:00.000Z,109.07,FoFs : Domestic,1707
Nippon India Quant Fund(G),2025-11-30T00:00:00.000Z,108.97,Equity : Thematic,5153
Motilal Oswal Nifty Capital Market ETF,2025-11-30T00:00:00.000Z,108.66,Equity : ETFs,49686
Navi ELSS Tax Saver Nifty 50 Index Fund-Reg(G),2025-10-31T00:00:00.000Z,108.29,Equity : Tax Saving (ELSS),47657
ICICI Pru Nifty50 Value 20 Index Fund-Reg(G),2025-11-30T00:00:00.000Z,108.25,Equity : Index Funds,48523
PGIM India Healthcare Fund-Reg(G),2025-10-31T00:00:00.000Z,106.92,Equity : Sectoral - Pharma,48975
Bank of India Credit Risk Fund-Reg(G),2025-11-30T00:00:00.000Z,106.72,Debt : Credit Risk,30390
Axis Nifty500 Value 50 Index Fund-Reg(G),2025-10-31T00:00:00.000Z,106.13,Equity : Index Funds,37710
Baroda BNP Paribas Income Plus Arbitrage Active FoF-Reg(G),2025-10-31T00:00:00.000Z,105.57,FoFs : Domestic,49897
Kotak Nifty SDL Jul 2026 Index Fund-Reg(G),2025-10-31T00:00:00.000Z,105.19,Debt : Medium to Long Duration,46729
Canara Rob Dynamic Bond Fund-Reg(G),2025-11-30T00:00:00.000Z,105.06,Debt : Dynamic Bond,7792
PGIM India Gilt Fund(G),2025-11-30T00:00:00.000Z,105.01,Debt : Gilt,7012
Union Gold ETF FoF-Reg(G),2025-10-31T00:00:00.000Z,104.64,Gold : MFs,49466
DSP Nifty Midcap 150 Quality 50 ETF,2025-10-31T00:00:00.000Z,104.35,Equity : ETFs,46157
Union Dynamic Bond Fund(G),2025-11-30T00:00:00.000Z,104.26,Debt : Dynamic Bond,16032
Baroda BNP Paribas Childrens Fund-Reg(G),2025-10-31T00:00:00.000Z,103.64,Hybrid : Solution Oriented,49110
Quantum ESG Best In Class Strategy Fund-Reg(G),2025-11-30T00:00:00.000Z,103.11,Equity : Thematic,43878
Bandhan CRISIL IBX 90:10 SDL Plus Gilt - Nov 2026 Index Fund-Reg(G),2025-11-30T00:00:00.000Z,103.03,Debt : Medium to Long Duration,46213
Invesco India - Invesco Pan European Equity FoF-Reg(G),2025-10-31T00:00:00.000Z,102.87,FoFs : Overseas,24619
Bandhan Conservative Hybrid Fund-Reg(G),2025-11-30T00:00:00.000Z,102.54,Hybrid : Debt Oriented (Conservative),8465
Nippon India ETF BSE Sensex Next 50,2025-11-30T00:00:00.000Z,102.11,Equity : ETFs,43930
Baroda BNP Paribas Gold ETF FoF-Reg(G),2025-10-31T00:00:00.000Z,102.07,FoFs : Domestic,50181
PGIM India Arbitrage Fund-Reg(G),2025-10-31T00:00:00.000Z,101.83,Hybrid : Arbitrage,28514
Tata Nifty Auto Index Fund-Reg(G),2025-11-30T00:00:00.000Z,101.57,Equity : Sectoral - Auto,48683
Motilal Oswal Infrastructure Fund-Reg(G),2025-11-30T00:00:00.000Z,101.22,Equity : Sectoral - Infrastructure,49811
Aditya Birla SL CRISIL IBX Gilt April 2033 Index Fund-Reg(G),2025-11-30T00:00:00.000Z,101.21,Debt : Long Duration,48411
Kotak FMP-308-1125D(G),2025-11-30T00:00:00.000Z,100.94,Debt : FTP/FMP,47570
LIC MF Nifty Next 50 Index Fund(G),2025-11-30T00:00:00.000Z,100.68,Equity : Index Funds,12836
Edelweiss Nifty 1D Rate Liquid ETF(G),2025-11-30T00:00:00.000Z,100.56,Debt : ETFs,50360
PGIM India Dynamic Bond Fund(G),2025-11-30T00:00:00.000Z,100.18,Debt : Dynamic Bond,15247
Mirae Asset Hang Seng TECH ETF FoF-Reg(G),2025-10-31T00:00:00.000Z,99.81,FoFs : Overseas,46071
SBI BSE PSU Bank Index Fund-Reg(G),2025-10-31T00:00:00.000Z,99.12,Equity : Index Funds,49726
UTI Long Duration Fund-Reg(G),2025-11-30T00:00:00.000Z,99.0,Debt : Long Duration,47733
Axis FTP-113-1228D-Reg(G),2025-11-30T00:00:00.000Z,98.94,Debt : FTP/FMP,47799
HDFC NIFTY200 Momentum 30 ETF,2025-10-31T00:00:00.000Z,98.75,Equity : ETFs,46042
Nippon India CRISIL-IBX AAA Financial Services - Dec 2026 Index Fund-Reg(G),2025-11-30T00:00:00.000Z,98.55,Debt : Short Duration,49222
Mirae Asset Nifty 100 ESG Sector Leaders FoF-Reg(G),2025-10-31T00:00:00.000Z,98.34,FoFs : Domestic,45135
Invesco India Nifty 50 ETF,2025-10-31T00:00:00.000Z,97.32,Equity : ETFs,12694
PGIM India Retirement Fund-Reg(G),2025-10-31T00:00:00.000Z,96.28,Hybrid : Solution Oriented,44436
Aditya Birla SL Nifty Next 50 ETF,2025-10-31T00:00:00.000Z,96.07,Equity : ETFs,38262
Tata Nifty G-Sec Dec 2026 Index Fund-Reg(G),2025-11-30T00:00:00.000Z,95.32,Debt : Medium Duration,47436
Groww Nifty India Railways PSU ETF,2025-10-31T00:00:00.000Z,95.31,Equity : ETFs,49496
Edelweiss CRISIL IBX 50:50 Gilt Plus SDL June 2027 Index Fund-Reg(G),2025-11-30T00:00:00.000Z,95.26,Debt : Medium to Long Duration,46999
UTI Nifty Midsmallcap 400 Momentum Quality 100 Index Fund-Reg(G),2025-11-30T00:00:00.000Z,95.04,Equity : Index Funds,49586
HDFC NIFTY Midcap 150 ETF,2025-10-31T00:00:00.000Z,94.44,Equity : ETFs,46873
LIC MF BSE Sensex Index Fund-Reg(G),2025-11-30T00:00:00.000Z,94.38,Equity : Index Funds,2133
ICICI Pru BSE Midcap Select ETF,2025-11-30T00:00:00.000Z,94.36,Equity : ETFs,33837
ICICI Pru Nifty Pharma Index Fund-Reg(G),2025-11-30T00:00:00.000Z,94.13,Equity : Sectoral - Pharma,47224
HDFC NIFTY Next 50 ETF,2025-10-31T00:00:00.000Z,94.02,Equity : ETFs,39624
ICICI Pru Retirement Fund-Pure Debt Plan(G),2025-11-30T00:00:00.000Z,93.93,Hybrid : Solution Oriented,25670
Mahindra Manulife Dynamic Bond Fund-Reg(G),2025-11-30T00:00:00.000Z,93.78,Debt : Credit Risk,40695
Mirae Asset Nifty 8-13 yr G-Sec ETF,2025-11-30T00:00:00.000Z,93.53,Debt : ETFs,47899
Mirae Asset Nifty Metal ETF,2025-10-31T00:00:00.000Z,93.01,Equity : ETFs,49100
Mirae Asset Nifty50 Equal Weight ETF,2025-10-31T00:00:00.000Z,92.29,Equity : ETFs,49859
360 ONE ELSS Tax Saver Nifty 50 Index Fund-Reg(G),2025-10-31T00:00:00.000Z,92.11,Equity : Tax Saving (ELSS),47302
Kotak International REIT Overseas Equity Omni FOF-Reg(G),2025-10-31T00:00:00.000Z,91.31,FoFs : Overseas,42804
TRUSTMF Arbitrage Fund-Reg(G),2025-10-31T00:00:00.000Z,91.27,Hybrid : Arbitrage,50178
ICICI Pru Nifty PSU Bank ETF,2025-11-30T00:00:00.000Z,91.1,Equity : ETFs,36397
Aditya Birla SL US Treasury 1-3 year Bond ETFs FoF-Reg(G),2025-10-31T00:00:00.000Z,90.79,Debt : ETFs,48274
ICICI Pru Retirement Fund-Hybrid Cons Plan(G),2025-11-30T00:00:00.000Z,89.83,Hybrid : Solution Oriented,25668
ICICI Pru Global Stable Equity Fund(FOF)(G),2025-11-30T00:00:00.000Z,89.82,FoFs : Overseas,16718
Zerodha Nifty 100 ETF,2025-10-31T00:00:00.000Z,89.05,Equity : ETFs,48885
Motilal Oswal Services Fund-Reg(G),2025-11-30T00:00:00.000Z,88.97,Equity : Thematic,49929
ICICI Pru Nifty Commodities ETF,2025-11-30T00:00:00.000Z,88.04,Equity : Thematic,47332
PGIM India Corp Bond Fund(G),2025-11-30T00:00:00.000Z,87.89,Debt : Corporate Bond,854
Tata Nifty Financial Services Index Fund-Reg(G),2025-11-30T00:00:00.000Z,87.77,Equity : Index Funds,48760
DSP Nifty SDL Plus G-Sec Sep 2027 50:50 Index Fund-Reg(G),2025-11-30T00:00:00.000Z,87.52,Debt : Medium to Long Duration,47548
JM Short Duration Fund-Reg(G),2025-11-30T00:00:00.000Z,87.29,Debt : Short Duration,46751
Quantum Ethical Fund-Reg(G),2025-11-30T00:00:00.000Z,87.22,Equity : Thematic,49179
Franklin India Income Plus Arbitrage Active FoF(G),2025-10-31T00:00:00.000Z,87.11,FoFs : Domestic,31040
Kotak Nifty Midcap 50 ETF,2025-10-31T00:00:00.000Z,87.08,Equity : ETFs,45730
Kotak Nifty 50 Value 20 ETF,2025-10-31T00:00:00.000Z,86.94,Equity : ETFs,31116
LIC MF Healthcare Fund-Reg(G),2025-11-30T00:00:00.000Z,86.0,Equity : Sectoral - Pharma,41330
SBI FMP-79-1130D-Reg(G),2025-11-30T00:00:00.000Z,85.21,Debt : FTP/FMP,47764
Mahindra Manulife Arbitrage Fund-Reg(G),2025-10-31T00:00:00.000Z,84.67,Hybrid : Arbitrage,45042
Edelweiss CRISIL-IBX AAA Bond NBFC-HFC-Jun 2027 Index Fund-Reg(G),2025-11-30T00:00:00.000Z,84.66,Debt : Short Duration,49624
Groww Nifty India Defence ETF FOF-Reg(G),2025-10-31T00:00:00.000Z,83.44,FoFs : Domestic,49023
Nippon India Nifty 1D Rate Liquid ETF(G),2025-11-30T00:00:00.000Z,83.4,Debt : Liquid,50023
Edelweiss Nifty LargeMidcap 250 ETF,2025-10-31T00:00:00.000Z,82.73,Equity : ETFs,50250
