s_name,aumdate,aumtotal,classification,schemecode
SBI Nifty 50 ETF,2025-01-31T00:00:00.000Z,189650.42,Equity : ETFs,33369
SBI BSE Sensex ETF,2025-01-31T00:00:00.000Z,110720.76,Equity : ETFs,20447
HDFC Balanced Advantage Fund(G),2025-01-31T00:00:00.000Z,94251.41,Hybrid : Dynamic Asset Allocation,1273
Parag Parikh Flexi Cap Fund-Reg(G),2025-01-31T00:00:00.000Z,89703.46,Equity : Flexi Cap,21520
HDFC Mid-Cap Opportunities Fund(G),2025-01-31T00:00:00.000Z,73510.09,Equity : Mid Cap,1305
SBI Equity Hybrid Fund-Reg(G),2025-01-31T00:00:00.000Z,71142.58,Hybrid : Equity Oriented,2747
HDFC Liquid Fund(G),2025-02-28T00:00:00.000Z,70412.56,Debt : Liquid,1286
SBI Liquid Fund-Reg(G),2025-02-28T00:00:00.000Z,66778.13,Debt : Liquid,2828
HDFC Flexi Cap Fund(G),2025-01-31T00:00:00.000Z,65966.82,Equity : Flexi Cap,1131
ICICI Pru Bluechip Fund(G),2025-01-31T00:00:00.000Z,63296.96,Equity : Large Cap,4980
ICICI Pru Balanced Advantage Fund(G),2025-01-31T00:00:00.000Z,60347.26,Hybrid : Dynamic Asset Allocation,1470
Kotak Equity Arbitrage Fund(G),2025-01-31T00:00:00.000Z,57567.02,Hybrid : Arbitrage,1979
Aditya Birla SL Liquid Fund(G),2025-02-28T00:00:00.000Z,57091.44,Debt : Liquid,293
Nippon India Small Cap Fund(G),2025-01-31T00:00:00.000Z,57009.7,Equity : Small Cap,12758
ICICI Pru Liquid Fund(G),2025-02-28T00:00:00.000Z,55112.4,Debt : Liquid,1659
UTI Nifty 50 ETF,2025-02-28T00:00:00.000Z,53996.96,Equity : ETFs,33150
ICICI Pru Multi-Asset Fund(G),2025-01-31T00:00:00.000Z,52760.77,Hybrid : Multi Asset Allocation,1495
SBI BlueChip Fund-Reg(G),2025-01-31T00:00:00.000Z,49128.07,Equity : Large Cap,2711
Kotak Flexicap Fund(G),2025-01-31T00:00:00.000Z,49112.04,Equity : Flexi Cap,7874
Kotak Emerging Equity Fund(G),2025-01-31T00:00:00.000Z,49091.55,Equity : Mid Cap,1977
ICICI Pru Value Discovery Fund(G),2025-01-31T00:00:00.000Z,48400.3,Equity : Value / Contra,1492
Axis Liquid Fund-Reg(G),2025-02-28T00:00:00.000Z,42866.63,Debt : Liquid,8029
SBI Contra Fund-Reg(G),2025-01-31T00:00:00.000Z,41634.25,Equity : Value / Contra,2809
UTI BSE Sensex ETF,2025-02-28T00:00:00.000Z,40885.46,Equity : ETFs,33151
ICICI Pru Equity & Debt Fund(G),2025-01-31T00:00:00.000Z,39886.28,Hybrid : Equity Oriented,1482
Nippon India ETF Nifty 50 BeES,2025-01-31T00:00:00.000Z,38966.12,Equity : ETFs,2272
Kotak Liquid Fund-Reg(G),2025-02-28T00:00:00.000Z,38144.21,Debt : Liquid,2060
Mirae Asset Large Cap Fund-Reg(G),2025-01-31T00:00:00.000Z,37845.29,Equity : Large Cap,4457
Nippon India Multi Cap Fund(G),2025-01-31T00:00:00.000Z,37593.67,Equity : Multi Cap,2466
CPSE ETF,2025-01-31T00:00:00.000Z,37397.22,Equity : ETFs,27621
Mirae Asset Large & Midcap Fund-Reg(G),2025-01-31T00:00:00.000Z,36514.01,Equity : Large & Mid Cap,9767
HDFC Large Cap Fund(G),2025-01-31T00:00:00.000Z,35672.64,Equity : Large Cap,1331
Nippon India Large Cap Fund(G),2025-01-31T00:00:00.000Z,35667.3,Equity : Large Cap,2455
SBI Focused Equity Fund-Reg(G),2025-01-31T00:00:00.000Z,34678.0,Equity : Multi Cap,2817
Axis ELSS Tax Saver Fund-Reg(G),2025-01-31T00:00:00.000Z,34496.58,Equity : Tax Saving (ELSS),8408
Nippon India Liquid Fund(G),2025-02-28T00:00:00.000Z,33917.18,Debt : Liquid,2637
SBI Balanced Advantage Fund-Reg(G),2025-01-31T00:00:00.000Z,33308.58,Hybrid : Dynamic Asset Allocation,32097
Nippon India Growth Fund(G),2025-01-31T00:00:00.000Z,33033.09,Equity : Mid Cap,2573
Axis Bluechip Fund-Reg(G),2025-01-31T00:00:00.000Z,32271.39,Equity : Large Cap,8250
HDFC Corp Bond Fund(G),2025-02-28T00:00:00.000Z,32190.9,Debt : Corporate Bond,8241
SBI Arbitrage Opportunities Fund-Reg(G),2025-01-31T00:00:00.000Z,32168.95,Hybrid : Arbitrage,2709
HDFC Small Cap Fund-Reg(G),2025-01-31T00:00:00.000Z,31230.11,Equity : Small Cap,4455
SBI Small Cap Fund-Reg(G),2025-01-31T00:00:00.000Z,31227.19,Equity : Small Cap,7885
ICICI Pru Corp Bond Fund(G),2025-02-28T00:00:00.000Z,29545.49,Debt : Corporate Bond,7925
SBI Large & Midcap Fund-Reg(G),2025-01-31T00:00:00.000Z,28677.29,Equity : Large & Mid Cap,2801
Axis Midcap Fund-Reg(G),2025-01-31T00:00:00.000Z,28380.17,Equity : Mid Cap,13049
Tata Money Market Fund-Reg(G),2025-02-28T00:00:00.000Z,28157.29,Debt : Money Market,3267
Aditya Birla SL Frontline Equity Fund(G),2025-01-31T00:00:00.000Z,28080.88,Equity : Large Cap,447
Kotak Money Market Fund(G),2025-02-28T00:00:00.000Z,27942.82,Debt : Money Market,1999
HDFC Money Market Fund-Reg(G),2025-02-28T00:00:00.000Z,27399.0,Debt : Money Market,1119
SBI Long Term Equity Fund-Reg(G),2025-01-31T00:00:00.000Z,27305.51,Equity : Tax Saving (ELSS),2815
Aditya Birla SL Money Manager Fund(G),2025-02-28T00:00:00.000Z,26752.16,Debt : Money Market,394
SBI Savings Fund-Reg(G),2025-02-28T00:00:00.000Z,26155.08,Debt : Money Market,2774
Tata Liquid Fund-Reg(G),2025-02-28T00:00:00.000Z,25965.16,Debt : Liquid,3212
ICICI Pru Money Market Fund(G),2025-02-28T00:00:00.000Z,25881.7,Debt : Money Market,1690
ICICI Pru Equity-Arbitrage Fund(G),2025-01-31T00:00:00.000Z,25324.33,Hybrid : Arbitrage,1467
Aditya Birla SL Corp Bond Fund(G),2025-02-28T00:00:00.000Z,25293.29,Debt : Corporate Bond,453
Quant Small Cap Fund(G),2025-01-31T00:00:00.000Z,25183.45,Equity : Small Cap,876
UTI Liquid Fund-Reg(G),2025-02-28T00:00:00.000Z,24805.07,Debt : Liquid,3590
ICICI Pru India Opp Fund(G),2025-01-31T00:00:00.000Z,24746.94,Equity : Thematic,42140
Kotak Equity Opp Fund(G),2025-01-31T00:00:00.000Z,24533.81,Equity : Large & Mid Cap,2069
Motilal Oswal Midcap Fund-Reg(G),2025-01-31T00:00:00.000Z,24488.0,Equity : Mid Cap,22533
Mirae Asset ELSS Tax Saver Fund-Reg(G),2025-01-31T00:00:00.000Z,24007.47,Equity : Tax Saving (ELSS),33536
ICICI Pru Asset Allocator Fund(FOF)(G),2025-01-31T00:00:00.000Z,23854.29,FoFs : Domestic,1704
UTI Flexi Cap Fund-Reg(G),2025-02-28T00:00:00.000Z,23403.53,Equity : Flexi Cap,3461
HDFC Hybrid Equity Fund(G),2025-01-31T00:00:00.000Z,23353.84,Hybrid : Equity Oriented,1311
Canara Rob Emerg Equities Fund-Reg(G),2025-01-31T00:00:00.000Z,23338.91,Equity : Large & Mid Cap,523
ICICI Pru Nifty 50 ETF,2025-01-31T00:00:00.000Z,23240.85,Equity : ETFs,20803
HDFC Large and Mid Cap Fund-Reg(G),2025-01-31T00:00:00.000Z,23139.67,Equity : Large & Mid Cap,2271
Axis Small Cap Fund-Reg(G),2025-01-31T00:00:00.000Z,23139.08,Equity : Small Cap,21651
ICICI Pru Savings Fund(G),2025-02-28T00:00:00.000Z,22237.65,Debt : Low Duration,1500
DSP Liquidity Fund-Reg(G),2025-01-31T00:00:00.000Z,21927.12,Debt : Liquid,708
SBI Flexicap Fund-Reg(G),2025-01-31T00:00:00.000Z,21592.65,Equity : Flexi Cap,2799
SBI Overnight Fund-Reg(G),2025-02-28T00:00:00.000Z,21498.46,Debt : Overnight,2787
Aditya Birla SL Flexi Cap Fund(G),2025-01-31T00:00:00.000Z,21416.97,Equity : Flexi Cap,445
SBI Magnum Midcap Fund-Reg(G),2025-01-31T00:00:00.000Z,21177.2,Equity : Mid Cap,2789
SBI Corp Bond Fund-Reg(G),2025-02-28T00:00:00.000Z,20671.63,Debt : Corporate Bond,40450
ICICI Pru Short Term Fund(G),2025-02-28T00:00:00.000Z,20112.23,Debt : Short Duration,1682
HSBC Liquid Fund(G),2025-02-28T00:00:00.000Z,20043.37,Debt : Liquid,1340
UTI Nifty 50 Index Fund-Reg(G),2025-02-28T00:00:00.000Z,19486.2,Equity : Index Funds,3641
SBI Multicap Fund-Reg(G),2025-01-31T00:00:00.000Z,18769.04,Equity : Multi Cap,46405
Invesco India Arbitrage Fund(G),2025-01-31T00:00:00.000Z,18673.68,Hybrid : Arbitrage,2167
ICICI Pru Large & Mid Cap Fund(G),2025-01-31T00:00:00.000Z,18624.12,Equity : Large & Mid Cap,1608
BHARAT Bond ETF - April 2030,2025-02-28T00:00:00.000Z,18502.89,Debt : ETFs,44421
HDFC Nifty 50 Index Fund(G)(Post Addendum),2025-01-31T00:00:00.000Z,18382.62,Equity : Index Funds,12633
HDFC Low Duration Fund(G),2025-02-28T00:00:00.000Z,18130.9,Debt : Low Duration,1114
UTI Money Market Fund-Reg(G),2025-02-28T00:00:00.000Z,18083.13,Debt : Money Market,7914
Bharat 22 ETF,2025-01-31T00:00:00.000Z,17937.82,Equity : ETFs,38252
DSP Midcap Fund-Reg(G),2025-01-31T00:00:00.000Z,17762.02,Equity : Mid Cap,735
HDFC Arbitrage-WP(G),2025-01-31T00:00:00.000Z,17654.29,Hybrid : Arbitrage,1103
Franklin India Flexi Cap Fund(G),2025-01-31T00:00:00.000Z,17202.58,Equity : Flexi Cap,950
Kotak Bond Short Term Fund(G),2025-02-28T00:00:00.000Z,17187.72,Debt : Short Duration,1971
Invesco India Contra Fund(G),2025-01-31T00:00:00.000Z,17167.52,Equity : Value / Contra,2169
Axis Money Market Fund-Reg(G),2025-02-28T00:00:00.000Z,17124.13,Debt : Money Market,21218
Nippon India ETF Gold BeES,2025-01-31T00:00:00.000Z,16975.8,Gold : ETFs,1024
Nippon India Money Market Fund(G),2025-02-28T00:00:00.000Z,16856.31,Debt : Money Market,2628
Kotak Balanced Advantage Fund-Reg(G),2025-01-31T00:00:00.000Z,16648.57,Hybrid : Dynamic Asset Allocation,40623
Kotak Small Cap Fund(G),2025-01-31T00:00:00.000Z,16450.27,Equity : Small Cap,2066
ICICI Pru Flexicap Fund(G),2025-01-31T00:00:00.000Z,16176.14,Equity : Flexi Cap,45492
HDFC Multi Cap Fund-Reg(G),2025-01-31T00:00:00.000Z,16088.87,Equity : Multi Cap,46093
DSP ELSS Tax Saver Fund-Reg(G),2025-01-31T00:00:00.000Z,15985.06,Equity : Tax Saving (ELSS),745
Kotak Multicap Fund-Reg(G),2025-01-31T00:00:00.000Z,15725.61,Equity : Multi Cap,45336
HDFC Focused 30 Fund(G),2025-01-31T00:00:00.000Z,15687.54,Equity : Multi Cap,1129
Mirae Asset Midcap Fund-Reg(G),2025-01-31T00:00:00.000Z,15460.84,Equity : Mid Cap,43349
HSBC Small Cap Fund-Reg(G),2025-01-31T00:00:00.000Z,15453.03,Equity : Small Cap,22139
HDFC ELSS Tax saver(G),2025-01-31T00:00:00.000Z,15413.45,Equity : Tax Saving (ELSS),1329
ICICI Pru BSE Sensex ETF,2025-01-31T00:00:00.000Z,15242.62,Equity : ETFs,2848
Bandhan Liquid Fund-Reg(G),2025-02-28T00:00:00.000Z,15178.12,Debt : Liquid,1032
HDFC Floating Rate Debt Fund(G),2025-02-28T00:00:00.000Z,15117.78,Debt : Floater,3728
DSP Small Cap Fund-Reg(G),2025-01-31T00:00:00.000Z,14995.68,Equity : Small Cap,714
Aditya Birla SL Savings Fund-Reg(G),2025-02-28T00:00:00.000Z,14987.55,Debt : Ultra Short Duration,468
Nippon India Arbitrage Fund(G),2025-01-31T00:00:00.000Z,14701.22,Hybrid : Arbitrage,12938
Aditya Birla SL ELSS Tax Saver Fund(G),2025-01-31T00:00:00.000Z,14626.04,Equity : Tax Saving (ELSS),4637
Canara Rob Bluechip Equity Fund-Reg(G),2025-01-31T00:00:00.000Z,14579.48,Equity : Large Cap,8217
Nippon India ELSS Tax Saver Fund(G),2025-01-31T00:00:00.000Z,14449.23,Equity : Tax Saving (ELSS),2667
Kotak Corporate Bond Fund(G),2025-02-28T00:00:00.000Z,14448.9,Debt : Corporate Bond,265
HDFC Short Term Debt Fund(G),2025-02-28T00:00:00.000Z,14390.68,Debt : Short Duration,11925
Invesco India Liquid Fund(G),2025-02-28T00:00:00.000Z,14275.62,Debt : Liquid,2240
HDFC Ultra Short Term Fund-Reg(G),2025-02-28T00:00:00.000Z,14202.29,Debt : Ultra Short Duration,39949
ICICI Pru Technology Fund(G),2025-01-31T00:00:00.000Z,14101.47,Equity : Sectoral - Technology,1695
Bandhan Corp Bond Fund-Reg(G),2025-02-28T00:00:00.000Z,13995.73,Debt : Corporate Bond,31896
Aditya Birla SL Arbitrage Fund(G),2025-01-31T00:00:00.000Z,13920.19,Hybrid : Arbitrage,7889
SBI Short Term Debt Fund-Reg(G),2025-02-28T00:00:00.000Z,13905.29,Debt : Short Duration,2843
ICICI Pru Multicap Fund(G),2025-01-31T00:00:00.000Z,13850.38,Equity : Multi Cap,1677
ICICI Pru Ultra Short Term Fund Fund(G),2025-01-31T00:00:00.000Z,13813.18,Debt : Ultra Short Duration,12454
ICICI Pru All Seasons Bond Fund(G),2025-02-28T00:00:00.000Z,13643.93,Debt : Dynamic Bond,8499
ICICI Pru ELSS Tax Saver Fund(G),2025-01-31T00:00:00.000Z,13548.75,Equity : Tax Saving (ELSS),1694
Axis Growth Opp Fund-Reg(G),2025-01-31T00:00:00.000Z,13522.21,Equity : Large & Mid Cap,38080
DSP Equity Opportunities Fund-Reg(G),2025-01-31T00:00:00.000Z,13444.08,Equity : Large & Mid Cap,716
Bandhan Banking & PSU Debt Fund-Reg(G),2025-02-28T00:00:00.000Z,13421.37,Debt : Banking & PSU,20747
Nippon India ETF BSE Sensex,2025-01-31T00:00:00.000Z,13416.12,Equity : ETFs,30127
Aditya Birla SL Floating Rate Fund(G),2025-02-28T00:00:00.000Z,13190.34,Debt : Floater,7727
Axis Banking & PSU Debt Fund-Reg(G),2025-02-28T00:00:00.000Z,12987.92,Debt : Banking & PSU,16903
Tata Arbitrage Fund-Reg(G),2025-01-31T00:00:00.000Z,12921.02,Hybrid : Arbitrage,38865
Edelweiss Arbitrage Fund-Reg(G),2025-01-31T00:00:00.000Z,12905.8,Hybrid : Arbitrage,27622
Franklin India Smaller Cos Fund(G),2025-01-31T00:00:00.000Z,12861.81,Equity : Small Cap,952
HSBC Value Fund-Reg(G),2025-01-31T00:00:00.000Z,12848.97,Equity : Value / Contra,8262
ICICI Pru Equity Savings Fund-Reg(G),2025-01-31T00:00:00.000Z,12788.49,Hybrid : Equity Oriented,31230
BHARAT Bond ETF - April 2031,2025-02-28T00:00:00.000Z,12763.71,Debt : ETFs,45008
Mirae Asset Liquid Fund-Reg(G),2025-02-28T00:00:00.000Z,12730.95,Debt : Liquid,7554
Kotak Savings Fund(G),2025-02-28T00:00:00.000Z,12726.31,Debt : Ultra Short Duration,1995
HDFC Overnight Fund(G),2025-02-28T00:00:00.000Z,12517.25,Debt : Overnight,1117
Tata Digital India Fund-Reg(G),2025-01-31T00:00:00.000Z,12464.64,Equity : Sectoral - Technology,33727
Axis Focused Fund-Reg(G),2025-01-31T00:00:00.000Z,12349.87,Equity : Multi Cap,15557
SBI Magnum Low Duration Fund-Reg(G),2025-02-28T00:00:00.000Z,12334.94,Debt : Low Duration,2832
Canara Rob Flexi Cap Fund-Reg(G),2025-01-31T00:00:00.000Z,12285.79,Equity : Flexi Cap,526
Edelweiss Balanced Advantage Fund-Reg(G),2025-01-31T00:00:00.000Z,12238.46,Hybrid : Dynamic Asset Allocation,7912
Aditya Birla SL Low Duration Fund(G),2025-02-28T00:00:00.000Z,12214.04,Debt : Low Duration,440
Nippon India ETF Nifty 1D Rate Liquid BeES,2025-02-28T00:00:00.000Z,12198.23,Debt : ETFs,2155
Axis Flexi Cap Fund-Reg(G),2025-01-31T00:00:00.000Z,12125.4,Equity : Flexi Cap,38212
ICICI Pru Nifty 50 Index Fund-Reg(G),2025-01-31T00:00:00.000Z,12044.58,Equity : Index Funds,1623
SBI Magnum Ultra Short Duration Fund-Reg(G),2025-02-28T00:00:00.000Z,11987.0,Debt : Ultra Short Duration,2785
HDFC Manufacturing Fund-Reg(G),2025-01-31T00:00:00.000Z,11967.04,Equity : Thematic,48655
Motilal Oswal Flexi Cap Fund-Reg(G),2025-01-31T00:00:00.000Z,11855.06,Equity : Flexi Cap,26481
LIC MF Liquid Fund-Reg(G),2025-02-28T00:00:00.000Z,11780.16,Debt : Liquid,2137
Kotak Low Duration Fund(G),2025-02-28T00:00:00.000Z,11754.82,Debt : Low Duration,4573
UTI Large Cap Fund-Reg(G),2025-02-28T00:00:00.000Z,11720.45,Equity : Large Cap,3626
Franklin India Prima Fund(G),2025-01-31T00:00:00.000Z,11655.69,Equity : Mid Cap,948
Sundaram Mid Cap Fund-Reg(G),2025-01-31T00:00:00.000Z,11638.05,Equity : Mid Cap,3067
ICICI Pru Business Cycle Fund(G),2025-01-31T00:00:00.000Z,11616.63,Equity : Thematic,44146
Franklin India Focused Equity Fund(G),2025-01-31T00:00:00.000Z,11553.45,Equity : Multi Cap,938
Canara Rob Small Cap Fund-Reg(G),2025-01-31T00:00:00.000Z,11527.91,Equity : Small Cap,42350
SBI Magnum Gilt Fund-Reg(G),2025-02-28T00:00:00.000Z,11226.06,Debt : Gilt,2754
DSP Flexi Cap Fund-Reg(G),2025-01-31T00:00:00.000Z,11032.79,Equity : Flexi Cap,642
Bandhan Money Manager Fund-Reg(G),2025-02-28T00:00:00.000Z,10852.57,Debt : Money Market,1052
HSBC Midcap Fund-Reg(G),2025-01-31T00:00:00.000Z,10752.86,Equity : Mid Cap,611
BHARAT Bond ETF - April 2032,2025-02-28T00:00:00.000Z,10607.06,Debt : ETFs,46127
PGIM India Midcap Opp Fund-Reg(G),2025-01-31T00:00:00.000Z,10459.7,Equity : Mid Cap,24741
Baroda BNP Paribas Liquid Fund(G),2025-02-28T00:00:00.000Z,10428.96,Debt : Liquid,7594
Quant ELSS Tax Saver Fund(G),2025-01-31T00:00:00.000Z,10278.66,Equity : Tax Saving (ELSS),889
DSP Aggressive Hybrid Fund-Reg(G),2025-01-31T00:00:00.000Z,10137.49,Hybrid : Equity Oriented,635
Tata Balanced Adv Fund-Reg(G),2025-01-31T00:00:00.000Z,10109.2,Hybrid : Dynamic Asset Allocation,39531
ICICI Pru Banking & PSU Debt Fund(G),2025-02-28T00:00:00.000Z,10092.25,Debt : Banking & PSU,8080
ICICI Pru Focused Equity Fund(G),2025-01-31T00:00:00.000Z,10064.52,Equity : Large Cap,7747
ICICI Pru Overnight Fund(G),2025-02-28T00:00:00.000Z,10036.94,Debt : Overnight,41653
BHARAT Bond ETF - April 2025,2025-02-28T00:00:00.000Z,10033.75,Debt : ETFs,45007
SBI Energy Opportunities Fund-Reg(G),2025-01-31T00:00:00.000Z,9928.46,Equity : Sectoral - Energy / Power,48474
UTI Mid Cap Fund-Reg(G),2025-02-28T00:00:00.000Z,9899.35,Equity : Mid Cap,3628
Quant Active Fund(G),2025-01-31T00:00:00.000Z,9863.14,Equity : Multi Cap,871
Canara Rob Equity Hybrid Fund-Reg(G),2025-02-28T00:00:00.000Z,9841.01,Hybrid : Equity Oriented,513
Bandhan Bond Fund - Short Term Plan-Reg(G),2025-02-28T00:00:00.000Z,9664.73,Debt : Short Duration,1097
HDFC Childrens Fund,2025-01-31T00:00:00.000Z,9629.05,Hybrid : Solution Oriented,1126
Bandhan Sterling Value Fund-Reg(G),2025-01-31T00:00:00.000Z,9587.46,Equity : Value / Contra,4270
Aditya Birla SL Banking & PSU Debt(G),2025-02-28T00:00:00.000Z,9585.97,Debt : Banking & PSU,5183
Aditya Birla SL Nifty SDL Plus PSU Bond Sep 2026 60:40 Index Fund-Reg(G),2025-02-28T00:00:00.000Z,9553.94,Debt : Medium to Long Duration,45732
SBI Conservative Hybrid Fund-Reg(G),2025-02-28T00:00:00.000Z,9552.8,Hybrid : Debt Oriented (Conservative),2797
ICICI Pru Energy Opportunities Fund-Reg(G),2025-01-31T00:00:00.000Z,9510.0,Equity : Sectoral - Energy / Power,48896
Nippon India Nivesh Lakshya Fund(G),2025-02-28T00:00:00.000Z,9489.09,Debt : Long Duration,35207
SBI CPSE Bond Plus SDL Sep 2026 50:50 Index Fund-Reg(G),2025-02-28T00:00:00.000Z,9296.59,Debt : Medium Duration,45947
Kotak Bluechip Fund(G),2025-01-31T00:00:00.000Z,9267.66,Equity : Large Cap,1962
Bandhan Small Cap Fund-Reg(G),2025-01-31T00:00:00.000Z,9236.21,Equity : Small Cap,42342
SBI Dividend Yield Fund-Reg(G),2025-01-31T00:00:00.000Z,9205.99,Equity : Thematic - Dividend Yield,47653
Motilal Oswal Nasdaq 100 ETF,2025-01-31T00:00:00.000Z,9173.54,Equity : ETFs,13397
ICICI Pru Banking & Fin Serv Fund(G),2025-01-31T00:00:00.000Z,9045.56,Equity : Sectoral - Financial Services,5736
ICICI Pru Nifty PSU Bond Plus SDL Sep 2027 40:60 Index Fund-Reg(G),2025-02-28T00:00:00.000Z,8996.1,Debt : Medium to Long Duration,45898
UTI Value Fund-Reg(G),2025-02-28T00:00:00.000Z,8944.59,Equity : Value / Contra,3644
Tata Small Cap Fund-Reg(G),2025-01-31T00:00:00.000Z,8883.39,Equity : Small Cap,35242
Axis Short Duration Fund-Reg(G),2025-02-28T00:00:00.000Z,8825.08,Debt : Short Duration,8488
Nippon India Balanced Advantage Fund(G),2025-01-31T00:00:00.000Z,8757.84,Hybrid : Dynamic Asset Allocation,2654
SBI Nifty Index Fund-Reg(G),2025-01-31T00:00:00.000Z,8752.04,Equity : Index Funds,2782
Aditya Birla SL Short Term Fund(G),2025-02-28T00:00:00.000Z,8689.03,Debt : Short Duration,287
Mirae Asset Aggressive Hybrid Fund-Reg(G),2025-01-31T00:00:00.000Z,8685.12,Hybrid : Equity Oriented,33228
Quant Mid Cap Fund(G),2025-01-31T00:00:00.000Z,8608.01,Equity : Mid Cap,887
Motilal Oswal Large & Midcap Fund-Reg(G),2025-01-31T00:00:00.000Z,8446.92,Equity : Large & Mid Cap,42803
Canara Rob ELSS Tax Saver-Reg(G),2025-01-31T00:00:00.000Z,8375.66,Equity : Tax Saving (ELSS),7600
Edelweiss Mid Cap Fund-Reg(G),2025-01-31T00:00:00.000Z,8268.27,Equity : Mid Cap,3790
Nippon India Flexi Cap Fund-Reg(G),2025-01-31T00:00:00.000Z,8258.52,Equity : Flexi Cap,45335
Kotak Equity Savings Fund(G),2025-01-31T00:00:00.000Z,8176.82,Hybrid : Equity Oriented,30690
Nippon India Value Fund(G),2025-01-31T00:00:00.000Z,8170.2,Equity : Value / Contra,2662
Nippon India Pharma Fund(G),2025-01-31T00:00:00.000Z,8160.74,Equity : Sectoral - Pharma,2659
Aditya Birla SL Overnight Fund-Reg(G),2025-02-28T00:00:00.000Z,8138.11,Debt : Overnight,41518
Tata Equity P/E Fund(G),2025-01-31T00:00:00.000Z,8067.54,Equity : Value / Contra,3098
HDFC Gold ETF,2025-01-31T00:00:00.000Z,8019.63,Gold : ETFs,12319
Tata Large & Mid Cap Fund-Reg(G),2025-01-31T00:00:00.000Z,7943.04,Equity : Large & Mid Cap,3096
Nippon India Focused Equity Fund(G),2025-01-31T00:00:00.000Z,7874.78,Equity : Flexi Cap,2641
ICICI Pru Smallcap Fund(G),2025-01-31T00:00:00.000Z,7870.56,Equity : Small Cap,1625
Axis Overnight Fund-Reg(G),2025-02-28T00:00:00.000Z,7828.07,Debt : Overnight,42062
HDFC BSE Sensex Index Fund(G)(Post Addendum),2025-01-31T00:00:00.000Z,7798.26,Equity : Index Funds,12635
Edelweiss Nifty PSU Bond Plus SDL Apr 2026 50:50 Index Fund-Reg(G),2025-02-28T00:00:00.000Z,7734.43,Debt : Banking & PSU,45388
Kotak Nifty SDL Apr 2027 Top 12 Equal Weight Index Fund-Reg(G),2025-02-28T00:00:00.000Z,7712.24,Debt : Medium to Long Duration,46381
Kotak Multi Asset Allocation Fund-Reg(G),2025-01-31T00:00:00.000Z,7680.06,Hybrid : Multi Asset Allocation,48028
Mirae Asset Focused Fund-Reg(G),2025-01-31T00:00:00.000Z,7663.56,Equity : Multi Cap,42898
Nippon India Floating Rate Fund(G),2025-02-28T00:00:00.000Z,7624.32,Debt : Floater,2566
Bandhan Core Equity Fund-Reg(G),2025-01-31T00:00:00.000Z,7574.37,Equity : Large & Mid Cap,2858
Nippon India Ultra Short Duration Fund(G),2025-02-28T00:00:00.000Z,7544.61,Debt : Ultra Short Duration,2615
Bandhan Arbitrage Fund-Reg(G),2025-01-31T00:00:00.000Z,7508.63,Hybrid : Arbitrage,2854
SBI Innovative Opportunities Fund-Reg(G),2025-01-31T00:00:00.000Z,7453.97,Equity : Thematic,48899
ICICI Pru Infrastructure Fund(G),2025-01-31T00:00:00.000Z,7434.93,Equity : Sectoral - Infrastructure,1629
Franklin India Bluechip Fund(G),2025-01-31T00:00:00.000Z,7408.19,Equity : Large Cap,931
Aditya Birla SL Focused Fund(G),2025-01-31T00:00:00.000Z,7353.75,Equity : Large Cap,489
Aditya Birla SL Equity Hybrid 95 Fund(G),2025-01-31T00:00:00.000Z,7312.62,Hybrid : Equity Oriented,430
Nippon India Low Duration Fund(G),2025-02-28T00:00:00.000Z,7275.82,Debt : Low Duration,2621
Edelweiss Liquid Fund-Reg(G),2025-02-28T00:00:00.000Z,7269.86,Debt : Liquid,6688
HDFC Credit Risk Debt Fund-(G),2025-02-28T00:00:00.000Z,7252.42,Debt : Credit Risk,21538
Aditya Birla SL Balanced Advantage Fund(G),2025-01-31T00:00:00.000Z,7239.48,Hybrid : Dynamic Asset Allocation,1713
ICICI Pru Floating Interest Fund(G),2025-02-28T00:00:00.000Z,7218.91,Debt : Floater,1512
SBI Multi Asset Allocation Fund-Reg(G),2025-02-28T00:00:00.000Z,7132.2,Hybrid : Multi Asset Allocation,2796
UTI Nifty200 Momentum 30 Index Fund-Reg(G),2025-02-28T00:00:00.000Z,7044.14,Equity : Index Funds,45342
Nippon India Power & Infra Fund(G),2025-01-31T00:00:00.000Z,7001.46,Equity : Sectoral - Energy / Power,2452
ICICI Pru Gold ETF,2025-01-31T00:00:00.000Z,6992.96,Gold : ETFs,12328
Bandhan Flexi Cap Fund-Reg(G),2025-01-31T00:00:00.000Z,6990.76,Equity : Flexi Cap,2906
BHARAT Bond FOF - April 2030 -Reg(G),2025-02-28T00:00:00.000Z,6973.92,FoFs : Domestic,44426
Bandhan CRISIL IBX Gilt June 2027 Index Fund-Reg(G),2025-02-28T00:00:00.000Z,6967.4,Debt : Gilt,45412
HDFC Capital Builder Value Fund(G),2025-01-31T00:00:00.000Z,6950.43,Equity : Value / Contra,1112
360 ONE Focused Equity Fund-Reg(G),2025-01-31T00:00:00.000Z,6885.21,Equity : Multi Cap,30046
Nippon India Overnight Fund-Reg(G),2025-02-28T00:00:00.000Z,6838.54,Debt : Overnight,41900
Quant Flexi Cap Fund(G),2025-01-31T00:00:00.000Z,6829.09,Equity : Flexi Cap,6305
Nippon India ETF Nifty Bank BeES,2025-01-31T00:00:00.000Z,6817.74,Equity : ETFs,267
Kotak Equity Hybrid Fund(G),2025-01-31T00:00:00.000Z,6753.16,Hybrid : Equity Oriented,31224
Axis Multicap Fund-Reg(G),2025-01-31T00:00:00.000Z,6748.6,Equity : Multi Cap,45362
Kotak Gold ETF,2025-01-31T00:00:00.000Z,6654.06,Gold : ETFs,2050
Bandhan ELSS Tax Saver Fund-Reg(G),2025-01-31T00:00:00.000Z,6620.13,Equity : Tax Saving (ELSS),7433
Sundaram Liquid Fund(G),2025-02-28T00:00:00.000Z,6619.27,Debt : Liquid,2323
ICICI Pru Nifty Next 50 Index Fund(G),2025-01-31T00:00:00.000Z,6616.28,Equity : Index Funds,11889
SBI Gold ETF,2025-01-31T00:00:00.000Z,6573.02,Gold : ETFs,7741
SBI Banking & Financial Services Fund-Reg(G),2025-01-31T00:00:00.000Z,6556.02,Equity : Sectoral - Financial Services,30125
SBI Magnum Medium Duration Fund-Reg(G),2025-02-28T00:00:00.000Z,6514.83,Debt : Medium Duration,2778
Nippon India Corp Bond Fund(G),2025-02-28T00:00:00.000Z,6497.76,Debt : Corporate Bond,2646
Sundaram Large and Mid Cap Fund(G),2025-01-31T00:00:00.000Z,6470.35,Equity : Large & Mid Cap,2947
Franklin India ELSS Tax Saver Fund(G),2025-01-31T00:00:00.000Z,6438.34,Equity : Tax Saving (ELSS),957
ICICI Pru Innovation Fund-Reg(G),2025-01-31T00:00:00.000Z,6428.07,Equity : Thematic,47918
UTI Arbitrage Fund-Reg(G),2025-02-28T00:00:00.000Z,6414.57,Hybrid : Arbitrage,3660
ICICI Pru Manufacturing Fund(G),2025-01-31T00:00:00.000Z,6379.45,Equity : Thematic,32077
ICICI Pru Gilt Fund(G),2025-02-28T00:00:00.000Z,6355.81,Debt : Gilt,1606
Nippon India Short Term Fund(G),2025-02-28T00:00:00.000Z,6339.97,Debt : Short Duration,2664
SBI Magnum Global Fund-Reg(G),2025-01-31T00:00:00.000Z,6309.28,Equity : Thematic - MNC,2766
Axis Corp Bond Fund-Reg(G),2025-02-28T00:00:00.000Z,6298.58,Debt : Corporate Bond,36744
Motilal Oswal Nasdaq 100 FOF-Reg(G),2025-01-31T00:00:00.000Z,6256.58,FoFs : Overseas,41322
Invesco India Large & Mid Cap Fund(G),2025-01-31T00:00:00.000Z,6249.9,Equity : Large & Mid Cap,2235
Nippon India Banking & Financial Services Fund(G),2025-01-31T00:00:00.000Z,6225.84,Equity : Sectoral - Financial Services,2445
ICICI Pru Credit Risk Fund(G),2025-02-28T00:00:00.000Z,6187.43,Debt : Credit Risk,12456
BHARAT Bond ETF - April 2033,2025-02-28T00:00:00.000Z,6149.02,Debt : ETFs,47283
PGIM India Flexi Cap Fund-Reg(G),2025-01-31T00:00:00.000Z,6054.1,Equity : Flexi Cap,31642
DSP Arbitrage Fund-Reg(G),2025-01-31T00:00:00.000Z,6029.71,Hybrid : Arbitrage,30760
HDFC Dividend Yield Fund-Reg(G),2025-01-31T00:00:00.000Z,5982.98,Equity : Thematic - Dividend Yield,45197
ICICI Pru Midcap Fund(G),2025-01-31T00:00:00.000Z,5975.14,Equity : Mid Cap,1499
Franklin India Opportunities Fund(G),2025-01-31T00:00:00.000Z,5948.48,Equity : Thematic,946
Axis Treasury Advantage Fund-Reg(G),2025-02-28T00:00:00.000Z,5933.18,Debt : Low Duration,8032
Aditya Birla SL Pure Value Fund(G),2025-01-31T00:00:00.000Z,5929.32,Equity : Value / Contra,4453
Invesco India Smallcap Fund-Reg(G),2025-01-31T00:00:00.000Z,5904.85,Equity : Small Cap,40339
Invesco India Corporate Bond Fund(G),2025-02-28T00:00:00.000Z,5903.25,Debt : Corporate Bond,2158
HDFC Retirement Savings Fund-Equity Plan-Reg(G),2025-01-31T00:00:00.000Z,5897.09,Hybrid : Solution Oriented,24803
Kotak ELSS Tax Saver Fund(G),2025-01-31T00:00:00.000Z,5892.76,Equity : Tax Saving (ELSS),2075
Aditya Birla SL Multi-Cap Fund-Reg(G),2025-01-31T00:00:00.000Z,5878.59,Equity : Multi Cap,45476
