s_name,aumdate,aumtotal,classification,schemecode
Aditya Birla SL Pharma & Healthcare Fund-Reg(G),2024-11-30T00:00:00.000Z,854.32,Equity : Sectoral - Pharma,37591
DSP US Flexible Equity FoF-Reg(G),2024-11-30T00:00:00.000Z,853.08,FoFs : Overseas,17236
LIC MF Infra Fund-Reg(G),2024-11-30T00:00:00.000Z,852.07,Equity : Sectoral - Infrastructure,4324
Quant PSU Fund-Reg(G),2024-11-30T00:00:00.000Z,849.94,Equity : Thematic,48341
Kotak Quant Fund-Reg(G),2024-11-30T00:00:00.000Z,847.43,Equity : Thematic,48083
Union Large & Midcap Fund-Reg(G),2024-11-30T00:00:00.000Z,847.32,Equity : Large & Mid Cap,44300
Motilal Oswal Nifty Smallcap 250 Index Fund-Reg(G),2024-11-30T00:00:00.000Z,845.04,Equity : Index Funds,43811
UTI Innovation Fund-Reg(G),2024-11-30T00:00:00.000Z,842.53,Equity : Thematic,48238
SBI Nifty 500 Index Fund-Reg(G),2024-11-30T00:00:00.000Z,841.64,Equity : Index Funds,49019
HSBC Medium Duration Fund-Reg(G),2024-11-30T00:00:00.000Z,841.36,Debt : Medium Duration,31014
Nippon India Nifty Pharma ETF,2024-11-30T00:00:00.000Z,840.57,Equity : ETFs,45584
LIC MF BSE Sensex ETF,2024-11-30T00:00:00.000Z,835.82,Equity : ETFs,33579
Motilal Oswal BSE Enhanced Value Index Fund-Reg(G),2024-11-30T00:00:00.000Z,834.33,Equity : Index Funds,46741
Axis Global Equity Alpha FoF-Reg(G),2024-11-30T00:00:00.000Z,833.59,FoFs : Overseas,23016
TRUSTMF Flexi Cap Fund-Reg(G),2024-11-30T00:00:00.000Z,832.89,Equity : Flexi Cap,48451
LIC MF Nifty 50 ETF,2024-11-30T00:00:00.000Z,832.1,Equity : ETFs,33580
Nippon India Hybrid Bond Fund(G),2024-11-30T00:00:00.000Z,831.48,Hybrid : Debt Oriented (Conservative),2649
ITI Large & Mid Cap Fund-Reg(G),2024-11-30T00:00:00.000Z,828.8,Equity : Large & Mid Cap,48956
Invesco India Manufacturing Fund-Reg(G),2024-11-30T00:00:00.000Z,827.52,Equity : Thematic,47579
LIC MF Overnight Fund-Reg(G),2024-11-30T00:00:00.000Z,821.4,Debt : Overnight,43784
Motilal Oswal Liquid Fund-Reg(G),2024-11-30T00:00:00.000Z,811.78,Debt : Liquid,41872
Bandhan Hybrid Equity Fund-Reg(G),2024-11-30T00:00:00.000Z,809.77,Hybrid : Equity Oriented,34066
UTI Banking & PSU Fund-Reg(G),2024-11-30T00:00:00.000Z,806.13,Debt : Banking & PSU,21956
Edelweiss CRISIL PSU Plus SDL 50:50 Oct 2025 Index Fund-Reg(G),2024-11-30T00:00:00.000Z,803.68,Debt : Medium Duration,46448
Mirae Asset Nifty SDL Jun 2027 Index Fund-Reg(G),2024-11-30T00:00:00.000Z,802.58,Debt : Medium to Long Duration,46134
LIC MF Balanced Advantage Fund-Reg(G),2024-11-30T00:00:00.000Z,797.15,Hybrid : Equity Oriented,45941
HDFC NIFTY200 Momentum 30 Index Fund-Reg(G),2024-11-30T00:00:00.000Z,794.94,Equity : Index Funds,48466
Mirae Asset S&P 500 Top 50 ETF,2024-11-30T00:00:00.000Z,793.32,Equity : ETFs,45835
HDFC Dynamic Debt Fund(G),2024-11-30T00:00:00.000Z,790.76,Debt : Dynamic Bond,1274
HDFC NIFTY G-Sec Jun 2036 Index Fund-Reg(G),2024-11-30T00:00:00.000Z,786.35,Debt : Long Duration,47714
Axis Value Fund-Reg(G),2024-11-30T00:00:00.000Z,785.25,Equity : Value / Contra,45838
Aditya Birla SL Special Opp Fund-Reg(G),2024-11-30T00:00:00.000Z,778.57,Equity : Thematic,45096
360 ONE Liquid Fund-Reg(G),2024-11-30T00:00:00.000Z,772.94,Debt : Liquid,15687
Kotak Nifty 50 Index Fund-Reg(G),2024-11-30T00:00:00.000Z,772.38,Equity : Index Funds,45556
PGIM India ELSS Tax Saver Fund-Reg(G),2024-11-30T00:00:00.000Z,769.51,Equity : Tax Saving (ELSS),26780
Edelweiss Nifty Midcap150 Momentum 50 Index Fund-Reg(G),2024-11-30T00:00:00.000Z,766.59,Equity : Index Funds,47175
Nippon India Index Fund-BSE Sensex Plan(G),2024-11-30T00:00:00.000Z,766.29,Equity : Index Funds,12865
Kotak Silver ETF,2024-11-30T00:00:00.000Z,764.68,Gold : ETFs,46627
Bank of India Multi Cap Fund-Reg(G),2024-11-30T00:00:00.000Z,758.12,Equity : Multi Cap,46115
Franklin India Corp Debt Fund-A(G),2024-11-30T00:00:00.000Z,757.64,Debt : Corporate Bond,3381
Kotak Credit Risk Fund(G),2024-11-30T00:00:00.000Z,749.62,Debt : Credit Risk,8472
Baroda BNP Paribas Conservative Hybrid Fund-Reg(G),2024-11-30T00:00:00.000Z,747.1,Hybrid : Debt Oriented (Conservative),210
HDFC Nifty G-Sec Jun 2027 Index Fund-Reg(G),2024-11-30T00:00:00.000Z,742.47,Debt : Gilt,46618
360 ONE Dynamic Bond Fund-Reg(G),2024-11-30T00:00:00.000Z,737.47,Debt : Dynamic Bond,17578
Sundaram Corp Bond Fund(G),2024-11-30T00:00:00.000Z,734.87,Debt : Corporate Bond,2955
Navi Nifty Next 50 Index Fund-Reg(G),2024-11-30T00:00:00.000Z,731.73,Equity : Index Funds,45860
Motilal Oswal Manufacturing Fund-Reg(G),2024-11-30T00:00:00.000Z,727.81,Equity : Thematic,48962
HDFC NIFTY Smallcap 250 ETF,2024-11-30T00:00:00.000Z,727.34,Equity : ETFs,46874
Franklin India Equity Savings Fund(G),2024-11-30T00:00:00.000Z,726.01,Hybrid : Equity Oriented,39645
LIC MF Nifty 100 ETF,2024-11-30T00:00:00.000Z,720.46,Equity : ETFs,33578
ICICI Pru Retirement Fund-Hybrid Aggressive Plan(G),2024-11-30T00:00:00.000Z,720.39,Hybrid : Solution Oriented,25669
JM Aggressive Hybrid Fund(G),2024-11-30T00:00:00.000Z,719.68,Hybrid : Equity Oriented,1847
Nippon India US Equity Opp Fund(G),2024-11-30T00:00:00.000Z,719.18,Equity : International,19246
DSP Floater Fund-Reg(G),2024-11-30T00:00:00.000Z,717.85,Debt : Floater,45396
UTI India Consumer Fund-Reg(G),2024-11-30T00:00:00.000Z,715.4,Equity : Thematic - Consumption,3581
Nippon India Equity Savings Fund(G),2024-11-30T00:00:00.000Z,712.61,Hybrid : Equity Oriented,30963
Nippon India ETF Hang Seng BeES,2024-11-30T00:00:00.000Z,711.22,Equity : ETFs,8564
Nippon India Nifty G-Sec Jun 2036 Maturity Index Fund-Reg(G),2024-11-30T00:00:00.000Z,707.79,Debt : Gilt,47190
DSP NIFTY 1D Rate Liquid ETF,2024-11-30T00:00:00.000Z,706.6,Debt : ETFs,38904
SBI Nifty Midcap 150 Index Fund-Reg(G),2024-11-30T00:00:00.000Z,702.68,Equity : Index Funds,45376
Franklin India NSE Nifty 50 Index Fund(G),2024-11-30T00:00:00.000Z,698.43,Equity : Index Funds,942
LIC MF Nifty Midcap 100 ETF,2024-11-30T00:00:00.000Z,696.73,Equity : ETFs,48473
Axis Gold Fund-Reg(G),2024-11-30T00:00:00.000Z,696.01,Gold : MFs,15330
Aditya Birla SL CRISIL IBX Gilt Apr 2029 Index Fund-Reg(G),2024-12-31T00:00:00.000Z,695.18,Debt : Gilt,46950
Edelweiss Technology Fund-Reg(G),2024-11-30T00:00:00.000Z,690.2,Equity : Sectoral - Technology,43844
Baroda BNP Paribas Focused Fund-Reg(G),2024-11-30T00:00:00.000Z,689.04,Equity : Flexi Cap,32452
Tata Nifty 50 ETF,2024-11-30T00:00:00.000Z,687.27,Equity : ETFs,41017
Aditya Birla SL ESG Integration Strategy Fund-Reg(G),2024-11-30T00:00:00.000Z,686.84,Equity : Thematic,44736
Tata Nifty Midcap 150 Momentum 50 Index Fund-Reg(G),2024-11-30T00:00:00.000Z,685.98,Equity : Index Funds,47010
Invesco India Overnight Fund-Reg(G),2024-11-30T00:00:00.000Z,685.95,Debt : Overnight,44317
Motilal Oswal Digital India Fund-Reg(G),2024-11-30T00:00:00.000Z,684.28,Equity : Sectoral - Technology,48960
Axis NIFTY 50 ETF,2024-11-30T00:00:00.000Z,684.09,Equity : ETFs,33980
WOC Special Opp Fund-Reg(G),2024-11-30T00:00:00.000Z,672.12,Equity : Thematic,48833
HDFC Nifty G-Sec Jul 2031 Index Fund-Reg(G),2024-11-30T00:00:00.000Z,666.04,Debt : Gilt,46620
WOC Large Cap Fund-Reg(G),2024-11-30T00:00:00.000Z,661.36,Equity : Large Cap,47079
DSP FMP 267-1246D-Reg(G),2024-11-30T00:00:00.000Z,660.62,Debt : FTP/FMP,47071
SBI FMP-66-1361D-Reg(G),2024-11-30T00:00:00.000Z,659.45,Debt : FTP/FMP,46633
DSP NIFTY 50 Index Fund-Reg(G),2024-11-30T00:00:00.000Z,655.82,Equity : Index Funds,41642
Baroda BNP Paribas Overnight Fund-Reg(G),2024-11-30T00:00:00.000Z,653.48,Debt : Overnight,43376
SBI Magnum Comma Fund-Reg(G),2024-11-30T00:00:00.000Z,652.93,Equity : Thematic,2750
UTI Gilt Fund-Reg(G),2024-11-30T00:00:00.000Z,644.7,Debt : Gilt,3560
Mirae Asset S&P 500 Top 50 ETF FoF-Reg(G),2024-11-30T00:00:00.000Z,643.39,FoFs : Overseas,45836
Axis CRISIL-IBX AAA Bond NBFC - Jun 2027 Index Fund-Reg(G),2024-11-30T00:00:00.000Z,642.47,Debt : Medium to Long Duration,49127
UTI Equity Savings Fund-Reg(G),2024-11-30T00:00:00.000Z,641.86,Hybrid : Equity Oriented,35818
Union Aggressive Hybrid Fund-Reg(G),2024-11-30T00:00:00.000Z,636.88,Hybrid : Equity Oriented,44512
Bank of India Business Cycle Fund-Reg(G),2024-11-30T00:00:00.000Z,636.39,Equity : Thematic,48964
HDFC MNC Fund-Reg(G),2024-11-30T00:00:00.000Z,632.82,Equity : Thematic - MNC,47648
Kotak Global Innovation FoF-Reg(G),2024-11-30T00:00:00.000Z,629.63,FoFs : Overseas,45334
Quant BFSI Fund-Reg(G),2024-11-30T00:00:00.000Z,626.2,Equity : Sectoral - Financial Services,47989
Aditya Birla SL Equity Savings Fund-Reg(G),2024-11-30T00:00:00.000Z,624.33,Hybrid : Equity Oriented,30757
Motilal Oswal Nifty Bank Index Fund-Reg(G),2024-11-30T00:00:00.000Z,617.88,Equity : Index Funds,43789
JM Small Cap Fund-Reg(G),2024-11-30T00:00:00.000Z,612.4,Equity : Small Cap,48452
360 ONE Quant Fund-Reg(G),2024-11-30T00:00:00.000Z,604.73,Equity : Thematic,46015
Samco Dynamic Asset Allocation Fund-Reg(G),2024-11-30T00:00:00.000Z,604.66,Hybrid : Dynamic Asset Allocation,48331
Canara Rob Ultra Short Term Fund-Reg(G),2024-11-30T00:00:00.000Z,602.35,Debt : Ultra Short Duration,5902
Samco Flexi Cap Fund-Reg(G),2024-11-30T00:00:00.000Z,601.68,Equity : Flexi Cap,46217
HDFC Nifty G-Sec Sep 2032 Index Fund-Reg(G),2024-11-30T00:00:00.000Z,600.86,Debt : Gilt,46872
DSP Gold ETF,2024-11-30T00:00:00.000Z,597.88,Gold : ETFs,47938
Baroda BNP Paribas Business Cycle Fund-Reg(G),2024-11-30T00:00:00.000Z,597.77,Equity : Thematic,45686
PGIM India Large and Mid Cap Fund(G),2024-11-30T00:00:00.000Z,597.16,Equity : Large & Mid Cap,48543
Mahindra Manulife Large Cap Fund-Reg(G),2024-11-30T00:00:00.000Z,594.99,Equity : Large Cap,38073
Mahindra Manulife Low Duration Fund-Reg(G),2024-11-30T00:00:00.000Z,593.88,Debt : Low Duration,36894
PGIM India Large Cap Fund(G),2024-11-30T00:00:00.000Z,593.54,Equity : Large Cap,758
Kotak Nifty SDL Plus AAA PSU Bond Jul 2028 60:40 Index Fund-Reg(G),2024-11-30T00:00:00.000Z,588.26,Debt : Medium to Long Duration,46730
Kotak Technology Fund-Reg(G),2024-11-30T00:00:00.000Z,586.39,Equity : Sectoral - Technology,48587
Motilal Oswal Nifty 50 Index Fund-Reg(G),2024-11-30T00:00:00.000Z,586.05,Equity : Index Funds,44366
ICICI Pru Nifty Midcap 150 Index Fund-Reg(G),2024-11-30T00:00:00.000Z,585.0,Equity : Index Funds,46108
Sundaram Money Market Fund-Reg(G),2024-11-30T00:00:00.000Z,584.34,Debt : Money Market,39625
HSBC Equity Savings Fund-Reg(G),2024-11-30T00:00:00.000Z,583.31,Hybrid : Equity Oriented,15304
Bandhan CRISIL IBX 90:10 SDL Plus Gilt - April 2032 Index Fund-Reg(G),2024-11-30T00:00:00.000Z,583.11,Debt : Long Duration,46814
HSBC Credit Risk Fund-Reg(G),2024-11-30T00:00:00.000Z,581.67,Debt : Credit Risk,8016
Franklin India Banking & PSU Debt Fund(G),2024-11-30T00:00:00.000Z,580.32,Debt : Banking & PSU,28458
Mahindra Manulife Equity Savings Fund-Reg(G),2024-11-30T00:00:00.000Z,580.13,Hybrid : Equity Oriented,36671
Tata Housing Opportunities Fund-Reg(G),2024-11-30T00:00:00.000Z,578.65,Equity : Thematic,46764
Axis Nifty 50 Index Fund-Reg(G),2024-11-30T00:00:00.000Z,575.83,Equity : Index Funds,45701
Invesco India Aggressive Hybrid Fund-Reg(G),2024-11-30T00:00:00.000Z,574.0,Hybrid : Equity Oriented,39893
Union Business Cycle Fund-Reg(G),2024-11-30T00:00:00.000Z,573.82,Equity : Thematic,48599
SBI FMP-67-1467D-Reg(G),2024-11-30T00:00:00.000Z,566.48,Debt : FTP/FMP,46703
Edelweiss Equity Savings Fund-Reg(G),2024-11-30T00:00:00.000Z,560.91,Hybrid : Equity Oriented,30730
ICICI Pru Nifty 10 yr Benchmark G-Sec ETF,2024-11-30T00:00:00.000Z,559.91,Debt : Gilt (10 Yr Constant Duration),47331
UTI Dynamic Bond Fund-Reg(G),2024-11-30T00:00:00.000Z,554.96,Debt : Dynamic Bond,11896
Nippon India Nifty 500 Momentum 50 Index Fund-Reg(G),2024-11-30T00:00:00.000Z,552.32,Equity : Index Funds,49162
ICICI Pru Nifty IT Index Fund-Reg(G),2024-11-30T00:00:00.000Z,546.25,Equity : Index Funds,46707
Mahindra Manulife Multi Asset Allocation Fund-Reg(G),2024-11-30T00:00:00.000Z,544.76,Hybrid : Multi Asset Allocation,48449
Motilal Oswal Nifty Midcap 100 ETF,2024-11-30T00:00:00.000Z,543.49,Equity : ETFs,13595
Bandhan Transportation and Logistics Fund-Reg(G),2024-11-30T00:00:00.000Z,543.31,Equity : Sectoral - Auto,46986
UTI BSE Low Volatility Index Fund-Reg(G),2024-11-30T00:00:00.000Z,540.57,Equity : Index Funds,46409
Bank of India Mfg & Infra Fund-Reg(G),2024-11-30T00:00:00.000Z,538.8,Equity : Sectoral - Infrastructure,8484
Edelweiss Overnight Fund-Reg(G),2024-11-30T00:00:00.000Z,538.64,Debt : Overnight,42955
LIC MF Aggressive Hybrid Fund(G),2024-11-30T00:00:00.000Z,535.89,Hybrid : Equity Oriented,2085
Navi Nifty Bank Index Fund-Reg(G),2024-11-30T00:00:00.000Z,532.87,Equity : Index Funds,45873
Invesco India ESG Integration Strategy Fund-Reg(G),2024-11-30T00:00:00.000Z,519.9,Equity : Thematic,45348
Franklin India Pension Plan(G),2024-11-30T00:00:00.000Z,518.46,Hybrid : Solution Oriented,3396
Axis CRISIL IBX 70:30 CPSE Plus SDL April 2025 Index Fund-Reg(G),2024-11-30T00:00:00.000Z,517.1,Debt : Medium Duration,45992
Nippon India Nifty Next 50 Junior BeES FoF-Reg(G),2024-11-30T00:00:00.000Z,516.25,FoFs : Domestic,40664
ICICI Pru Nifty Bank Index Fund-Reg(G),2024-11-30T00:00:00.000Z,514.7,Equity : Index Funds,45994
UTI Nifty 500 Value 50 Index Fund-Reg(G),2024-11-30T00:00:00.000Z,510.43,Equity : Index Funds,47577
Axis Long Duration Fund-Reg(G),2024-11-30T00:00:00.000Z,510.2,Debt : Long Duration,46626
ITI Focused Equity Fund-Reg(G),2024-11-30T00:00:00.000Z,508.96,Equity : Flexi Cap,45722
Axis Global Innovation FoF-Reg(G),2024-11-30T00:00:00.000Z,508.64,FoFs : Overseas,45539
ICICI Pru Nifty 200 Momentum 30 Index Fund-Reg(G),2024-11-30T00:00:00.000Z,505.89,Equity : Index Funds,46683
DSP Nifty Bank ETF,2024-11-30T00:00:00.000Z,505.31,Equity : ETFs,46468
ICICI Pru Nifty IT ETF,2024-11-30T00:00:00.000Z,505.3,Equity : ETFs,44401
Quantum Liquid Fund-Reg(G),2024-11-30T00:00:00.000Z,504.04,Debt : Liquid,19756
SBI Silver ETF,2024-11-30T00:00:00.000Z,503.78,Gold : ETFs,48967
LIC MF ULIS,2024-11-30T00:00:00.000Z,498.67,Hybrid : Solution Oriented,2154
Nippon India Silver ETF FOF-Reg(G),2024-11-30T00:00:00.000Z,497.67,FoFs : Domestic,46198
JM Large Cap Fund-Reg(G),2024-11-30T00:00:00.000Z,495.06,Equity : Large Cap,1858
Invesco India Short Duration Fund(G),2024-11-30T00:00:00.000Z,485.32,Debt : Short Duration,2262
Aditya Birla SL Silver ETF,2024-11-30T00:00:00.000Z,485.09,Gold : ETFs,46194
Bandhan Bond Fund - Income Plan-Reg(G),2024-11-30T00:00:00.000Z,483.32,Debt : Long Duration,1090
HSBC Low Duration Fund-Reg(G),2024-11-30T00:00:00.000Z,481.92,Debt : Low Duration,13350
Bajaj Finserv Consumption Fund-Reg(G),2024-11-30T00:00:00.000Z,475.18,Equity : Thematic - Consumption,49345
Bandhan CRISIL IBX Gilt April 2026 Index Fund-Reg(G),2024-11-30T00:00:00.000Z,471.92,Debt : Gilt,46815
HDFC Nifty LargeMidcap 250 Index Fund-Reg(G),2024-11-30T00:00:00.000Z,471.13,Equity : Index Funds,48969
HDFC BSE Sensex ETF,2024-11-30T00:00:00.000Z,465.43,Equity : ETFs,34084
Motilal Oswal Nifty 500 Momentum 50 Index Fund-Reg(G),2024-11-30T00:00:00.000Z,464.01,Equity : Index Funds,48961
Baroda BNP Paribas Money Market Fund-Reg(G),2024-11-30T00:00:00.000Z,463.78,Debt : Money Market,25167
LIC MF Dividend Yield Fund-Reg(G),2024-11-30T00:00:00.000Z,463.64,Equity : Thematic - Dividend Yield,41332
SBI FMP-42-1857D-Reg(G),2024-11-30T00:00:00.000Z,462.59,Debt : FTP/FMP,45447
Axis Nifty Smallcap 50 Index Fund-Reg(G),2024-11-30T00:00:00.000Z,457.49,Equity : Index Funds,45856
Mirae Asset Gold ETF,2024-11-30T00:00:00.000Z,456.91,Gold : ETFs,47117
HDFC FMP-Sr 46-1861D-Mar 2022-Reg(G),2024-11-30T00:00:00.000Z,450.97,Debt : FTP/FMP,46453
PGIM India Liquid Fund(G),2024-11-30T00:00:00.000Z,450.83,Debt : Liquid,818
Mirae Asset Nifty Next 50 ETF,2024-11-30T00:00:00.000Z,448.5,Equity : ETFs,44314
Quant Commodities Fund-Reg(G),2024-11-30T00:00:00.000Z,446.18,Equity : Thematic,48343
Nippon India Nifty AAA PSU Bond Plus SDL - Sep 2026 Maturity 50:50 Index Fund-Reg(G),2024-11-30T00:00:00.000Z,445.7,Debt : Banking & PSU,47034
Mirae Asset Nifty 1D Rate Liquid ETF(IDCW),2024-11-30T00:00:00.000Z,443.7,Debt : ETFs,48119
Quant Teck Fund-Reg(G),2024-11-30T00:00:00.000Z,442.1,Equity : Sectoral - Technology,48195
Kotak FMP-292-1735D(G),2024-11-30T00:00:00.000Z,441.84,Debt : FTP/FMP,45679
Kotak FMP-292-1735D(IDCW),2024-11-30T00:00:00.000Z,441.84,Debt : FTP/FMP,45790
Sundaram Low Duration Fund(G),2024-11-30T00:00:00.000Z,440.68,Debt : Low Duration,2343
ICICI Pru FMP-85-10Y-I(G),2024-11-30T00:00:00.000Z,440.64,Debt : FTP/FMP,43023
Quant Healthcare Fund-Reg(G),2024-11-30T00:00:00.000Z,439.55,Equity : Sectoral - Pharma,48035
Motilal Oswal Ultra Short Term Fund-Reg(G),2024-11-30T00:00:00.000Z,439.26,Debt : Ultra Short Duration,22532
Kotak Nifty Alpha 50 ETF,2024-11-30T00:00:00.000Z,439.19,Equity : ETFs,45687
Union Largecap Fund-Reg(G),2024-11-30T00:00:00.000Z,438.15,Equity : Large Cap,33066
ICICI Pru Nifty Smallcap 250 Index Fund(G),2024-11-30T00:00:00.000Z,438.05,Equity : Index Funds,45684
ICICI Pru Nifty FMCG ETF,2024-11-30T00:00:00.000Z,436.2,Equity : ETFs,45651
Bandhan CRISIL IBX Gilt April 2032 Index Fund-Reg(G),2024-11-30T00:00:00.000Z,435.2,Debt : Long Duration,47601
Aditya Birla SL Gold Fund(G),2024-11-30T00:00:00.000Z,434.72,Gold : MFs,16220
Invesco India - Invesco EQQQ NASDAQ-100 ETF FoF-Reg(G),2024-11-30T00:00:00.000Z,426.0,FoFs : Overseas,45943
ICICI Pru Nifty Midcap 150 ETF,2024-11-30T00:00:00.000Z,424.94,Equity : ETFs,44494
Mirae Asset Nifty Smallcap 250 Momentum Quality 100 ETF,2024-11-30T00:00:00.000Z,424.01,Equity : ETFs,48496
Mahindra Manulife Consumption Fund-Reg(G),2024-11-30T00:00:00.000Z,423.34,Equity : Thematic - Consumption,38749
Union Focused Fund-Reg(G),2024-11-30T00:00:00.000Z,423.34,Equity : Multi Cap,22068
Kotak Healthcare Fund-Reg(G),2024-11-30T00:00:00.000Z,418.74,Equity : Sectoral - Pharma,47949
HDFC Silver ETF,2024-11-30T00:00:00.000Z,418.61,Gold : ETFs,46223
HDFC Nifty500 Multicap 50:25:25 Index Fund-Reg(G),2024-11-30T00:00:00.000Z,417.19,Equity : Index Funds,48970
Axis Credit Risk Fund-Reg(G),2024-11-30T00:00:00.000Z,416.97,Debt : Credit Risk,23018
Axis Nifty Midcap 50 Index Fund-Reg(G),2024-11-30T00:00:00.000Z,413.12,Equity : Index Funds,46459
LIC MF Small Cap Fund(G),2024-11-30T00:00:00.000Z,411.35,Equity : Small Cap,36914
Nippon India Nifty G-Sec Sep 2027 Maturity Index Fund-Reg(G),2024-11-30T00:00:00.000Z,410.99,Debt : Gilt,47186
Nippon India Nifty 500 Equal Weight Index Fund-Reg(G),2024-11-30T00:00:00.000Z,410.39,Equity : Index Funds,49022
Kotak CRISIL-IBX AAA Financial Services Index - Sep 2027 Fund-Reg(G),2024-11-30T00:00:00.000Z,409.45,Debt : Medium to Long Duration,49109
Aditya Birla SL Nifty India Defence Index Fund-Reg(G),2024-11-30T00:00:00.000Z,408.71,Equity : Index Funds,49044
Aditya Birla SL NASDAQ 100 FOF-Reg(G),2024-11-30T00:00:00.000Z,406.49,FoFs : Overseas,45711
TRUSTMF Small Cap Fund-Reg(G),2024-11-30T00:00:00.000Z,405.18,Equity : Small Cap,48991
Nippon India Nifty SDL Plus G-Sec-Jun 2028 Maturity 70:30 Index Fund-Reg(G),2024-11-30T00:00:00.000Z,402.43,Debt : Medium to Long Duration,46822
Aditya Birla SL Retirement Fund-30-Reg(G),2024-11-30T00:00:00.000Z,401.29,Hybrid : Solution Oriented,32078
ICICI Pru Nifty 200 Momentum 30 ETF,2024-11-30T00:00:00.000Z,400.36,Equity : ETFs,46682
ITI ELSS Tax Saver Fund-Reg(G),2024-11-30T00:00:00.000Z,398.64,Equity : Tax Saving (ELSS),44014
Aditya Birla SL CRISIL IBX 50:50 Gilt Plus SDL Apr 2028 Index Fund-Reg(G),2024-12-31T00:00:00.000Z,397.78,Debt : Medium to Long Duration,46897
Edelweiss ELSS Tax saver Fund-Reg(G),2024-11-30T00:00:00.000Z,397.74,Equity : Tax Saving (ELSS),7545
SBI FMP-81-1157D-Reg(G),2024-11-30T00:00:00.000Z,397.47,Debt : FTP/FMP,47876
Nippon India Income Fund(G),2024-11-30T00:00:00.000Z,394.77,Debt : Medium to Long Duration,2580
Kotak Nifty 200 Momentum 30 Index Fund-Reg(G),2024-11-30T00:00:00.000Z,394.66,Equity : Index Funds,47977
SBI FMP-64-1169D-Reg(G),2024-11-30T00:00:00.000Z,389.32,Debt : FTP/FMP,46858
ITI Balanced Advantage Fund-Reg(G),2024-11-30T00:00:00.000Z,388.43,Hybrid : Dynamic Asset Allocation,44362
Axis Retirement Fund-Dynamic Plan-Reg(G),2024-11-30T00:00:00.000Z,387.54,Hybrid : Solution Oriented,43842
DSP Bond Fund-Reg(G),2024-11-30T00:00:00.000Z,378.52,Debt : Medium Duration,637
ITI Large Cap Fund-Reg(G),2024-11-30T00:00:00.000Z,376.92,Equity : Large Cap,44400
DSP CRISIL SDL Plus G-Sec Apr 2033 50:50 Index Fund-Reg(G),2024-11-30T00:00:00.000Z,376.28,Debt : Long Duration,47476
Bank of India Large & Mid Cap Equity Fund-Reg(G),2024-11-30T00:00:00.000Z,374.46,Equity : Large & Mid Cap,6434
SBI FMP-44-1855D-Reg(G),2024-11-30T00:00:00.000Z,372.49,Debt : FTP/FMP,45552
Aditya Birla SL CRISIL-IBX AAA NBFC-HFC Index-Dec 2025 Fund-Reg(G),2024-12-31T00:00:00.000Z,372.35,Debt : Short Duration,49202
Kotak Nifty Next 50 Index Fund-Reg(G),2024-11-30T00:00:00.000Z,372.33,Equity : Index Funds,44443
Taurus Flexi Cap Fund-Reg(G),2024-11-30T00:00:00.000Z,370.89,Equity : Flexi Cap,3317
HDFC NIFTY Smallcap 250 Index Fund-Reg(G),2024-11-30T00:00:00.000Z,370.78,Equity : Index Funds,47916
Bajaj Finserv Nifty Bank ETF,2024-11-30T00:00:00.000Z,370.41,Equity : ETFs,48462
SBI LT Advantage Fund-V-Reg(G),2024-11-30T00:00:00.000Z,369.13,Equity : Tax Saving (ELSS),38291
Tata BSE Sensex Index Fund-Reg(G),2024-11-30T00:00:00.000Z,368.49,Equity : Index Funds,3249
Tata Young Citizen Fund,2024-11-30T00:00:00.000Z,366.67,Hybrid : Solution Oriented,3304
UTI Nifty200 Quality 30 Index Fund-Reg(G),2024-11-30T00:00:00.000Z,366.42,Equity : Index Funds,49144
Mirae Asset Short Duration Fund-Reg(G),2024-11-30T00:00:00.000Z,365.39,Debt : Short Duration,38870
DSP Nifty Midcap 150 Quality 50 Index Fund-Reg(G),2024-11-30T00:00:00.000Z,363.87,Equity : Index Funds,46467
SBI Nifty India Consumption Index Fund-Reg(G),2024-11-30T00:00:00.000Z,363.68,Equity : Index Funds,49106
HDFC NIFTY100 Low Volatility 30 Index Fund-Reg(G),2024-11-30T00:00:00.000Z,358.21,Equity : Index Funds,48653
Nippon India Taiwan Equity Fund-Reg(G),2024-11-30T00:00:00.000Z,358.08,Equity : International,45690
Mirae Asset Nifty 200 Alpha 30 ETF,2024-11-30T00:00:00.000Z,356.12,Equity : ETFs,48243
Samco Multi Cap Fund-Reg(G),2024-11-30T00:00:00.000Z,354.14,Equity : Multi Cap,49152
Invesco India Equity Savings Fund-Reg(G),2024-11-30T00:00:00.000Z,353.91,Hybrid : Equity Oriented,41505
Bank of India Multi Asset Allocation Fund-Reg(G),2024-11-30T00:00:00.000Z,351.16,Hybrid : Multi Asset Allocation,48027
ICICI Pru BSE 500 ETF,2024-11-30T00:00:00.000Z,350.29,Equity : ETFs,38531
Canara Rob Short Duration Fund-Reg(G),2024-11-30T00:00:00.000Z,348.16,Debt : Short Duration,12382
Baroda BNP Paribas Retirement Fund-Reg(G),2024-11-30T00:00:00.000Z,348.04,Hybrid : Solution Oriented,48794
Bandhan G-Sec-Constant Maturity Plan-Reg(G),2024-11-30T00:00:00.000Z,346.13,Debt : Gilt (10 Yr Constant Duration),1079
LIC MF Ultra Short Duration Fund-Reg(G),2024-11-30T00:00:00.000Z,345.69,Debt : Ultra Short Duration,44073
Bandhan US Equity FoF-Reg(G),2024-11-30T00:00:00.000Z,345.37,FoFs : Overseas,45674
Bandhan US Equity FoF-Reg(IDCW),2024-11-30T00:00:00.000Z,345.37,FoFs : Overseas,45675
Aditya Birla SL Nifty 50 Equal Weight Index Fund-Reg(G),2024-11-30T00:00:00.000Z,342.36,Equity : Index Funds,44741
PGIM India Multi Cap Fund-Reg(G),2024-11-30T00:00:00.000Z,341.06,Equity : Multi Cap,48968
Quant Consumption Fund-Reg(G),2024-11-30T00:00:00.000Z,337.74,Equity : Thematic - Consumption,48342
UTI CRISIL SDL Maturity April 2033 Index Fund-Reg(G),2024-11-30T00:00:00.000Z,337.37,Debt : Long Duration,47337
Sundaram Banking & PSU Fund(G),2024-11-30T00:00:00.000Z,336.01,Debt : Banking & PSU,2960
Bandhan FTP-179-3652D-Reg(G),2024-11-30T00:00:00.000Z,333.14,Debt : FTP/FMP,42924
Aditya Birla SL BSE Sensex ETF,2024-11-30T00:00:00.000Z,331.86,Equity : ETFs,35815
HDFC NIFTY 100 Equal Weight Index Fund-Reg(G),2024-11-30T00:00:00.000Z,327.8,Equity : Index Funds,45997
Bandhan Nifty Alpha 50 Index Fund-Reg(G),2024-11-30T00:00:00.000Z,327.08,Equity : Index Funds,48314
ICICI Pru Global Advantage Fund(FOF)(G),2024-11-30T00:00:00.000Z,326.52,FoFs : Overseas,43240
DSP Nifty 50 ETF,2024-11-30T00:00:00.000Z,326.26,Equity : ETFs,36811
SBI FMP-72-1239D-Reg(G),2024-11-30T00:00:00.000Z,326.07,Debt : FTP/FMP,47208
Mirae Asset Global X Artificial Intelligence & Technology ETF FoF-Reg(G),2024-11-30T00:00:00.000Z,325.58,FoFs : Overseas,45380
SBI FMP-61-1927D-Reg(G),2024-11-30T00:00:00.000Z,323.91,Debt : FTP/FMP,46511
Axis Greater China Equity FoF-Reg(G),2024-11-30T00:00:00.000Z,323.64,FoFs : Overseas,44318
Invesco India Technology Fund-Reg(G),2024-11-30T00:00:00.000Z,322.78,Equity : Sectoral - Technology,49047
Bandhan Floating Rate Fund-Reg(G),2024-11-30T00:00:00.000Z,320.89,Debt : Floater,41962
Nippon India Asset Allocator FoF-Reg(G),2024-11-30T00:00:00.000Z,320.54,FoFs : Domestic,44074
LIC MF Midcap Fund(G),2024-11-30T00:00:00.000Z,319.49,Equity : Mid Cap,36348
LIC MF Nifty 50 Index Fund(G),2024-11-30T00:00:00.000Z,319.29,Equity : Index Funds,2129
WOC Ultra Short Duration Fund-Reg(G),2024-11-30T00:00:00.000Z,319.08,Debt : Ultra Short Duration,42221
Navi Large & Midcap Fund-Reg(G),2024-11-30T00:00:00.000Z,318.75,Equity : Large & Mid Cap,31897
HDFC NIFTY Private Bank ETF,2024-11-30T00:00:00.000Z,317.92,Equity : ETFs,46045
UTI Credit Risk Fund-Reg(G),2024-11-30T00:00:00.000Z,316.12,Debt : Credit Risk,14960
UTI FTIF-XXXV-I(1260D)(G),2024-11-30T00:00:00.000Z,315.01,Debt : FTP/FMP,45364
HDFC FMP-Sr 46-1359D-Sep 2022-Reg(G),2024-11-30T00:00:00.000Z,314.9,Debt : FTP/FMP,46945
UTI Medium to Long Duration Fund-Reg(G),2024-11-30T00:00:00.000Z,314.19,Debt : Medium to Long Duration,3441
Quant ESG Equity Fund-Reg(G),2024-11-30T00:00:00.000Z,312.26,Equity : Thematic,45130
ITI Value Fund-Reg(G),2024-11-30T00:00:00.000Z,311.43,Equity : Value / Contra,45382
Motilal Oswal Nifty Next 50 Index Fund-Reg(G),2024-11-30T00:00:00.000Z,310.18,Equity : Index Funds,44368
WOC ELSS Tax Saver Fund-Reg(G),2024-11-30T00:00:00.000Z,308.52,Equity : Tax Saving (ELSS),46773
Franklin India Overnight Fund(G),2024-11-30T00:00:00.000Z,308.06,Debt : Overnight,43438
Invesco India - Invesco Global Consumer Trends FoF-Reg(G),2024-11-30T00:00:00.000Z,305.95,FoFs : Overseas,45201
