s_name,aumdate,aumtotal,classification,schemecode
Kotak ESG Exclusionary Strategy Fund-Reg(G),2025-01-31T00:00:00.000Z,860.61,Equity : Thematic,44147
DSP NIFTY Next 50 Index Fund-Reg(G),2025-01-31T00:00:00.000Z,859.49,Equity : Index Funds,41641
Tata Nifty SDL Plus AAA PSU Bond Dec 2027 60:40 Index Fund-Reg(G),2025-02-28T00:00:00.000Z,854.6,Debt : Medium to Long Duration,46351
Mirae Asset Equity Allocator FoF-Reg(G),2025-01-31T00:00:00.000Z,847.91,FoFs : Domestic,45064
Motilal Oswal Nifty 200 Momentum 30 Index Fund-Reg(G),2025-01-31T00:00:00.000Z,840.59,Equity : Index Funds,46320
Mahindra Manulife Manufacturing Fund-Reg(G),2025-01-31T00:00:00.000Z,838.12,Equity : Thematic,48881
Union Multi Asset Allocation Fund-Reg(G),2025-01-31T00:00:00.000Z,837.62,Hybrid : Multi Asset Allocation,48944
Mirae Asset S&P 500 Top 50 ETF,2025-01-31T00:00:00.000Z,831.1,Equity : ETFs,45835
Axis Retirement Fund-Aggressive Plan-Reg(G),2025-01-31T00:00:00.000Z,825.61,Hybrid : Solution Oriented,43841
UTI Banking & PSU Fund-Reg(G),2025-02-28T00:00:00.000Z,825.46,Debt : Banking & PSU,21956
Mirae Asset Overnight Fund-Reg(G),2025-02-28T00:00:00.000Z,825.15,Debt : Overnight,44008
Nippon India Hybrid Bond Fund(G),2025-02-28T00:00:00.000Z,824.78,Hybrid : Debt Oriented (Conservative),2649
360 ONE Balanced Hybrid Fund-Reg(G),2025-02-28T00:00:00.000Z,818.4,Hybrid : Equity Oriented,48144
Aditya Birla SL Pharma & Healthcare Fund-Reg(G),2025-01-31T00:00:00.000Z,815.09,Equity : Sectoral - Pharma,37591
HDFC NIFTY G-Sec Jun 2036 Index Fund-Reg(G),2025-02-28T00:00:00.000Z,813.14,Debt : Long Duration,47714
SBI Nifty 500 Index Fund-Reg(G),2025-01-31T00:00:00.000Z,811.48,Equity : Index Funds,49019
Edelweiss CRISIL PSU Plus SDL 50:50 Oct 2025 Index Fund-Reg(G),2025-02-28T00:00:00.000Z,811.2,Debt : Medium Duration,46448
HDFC NIFTY Smallcap 250 ETF,2025-01-31T00:00:00.000Z,810.14,Equity : ETFs,46874
Canara Rob Infrastructure Fund-Reg(G),2025-01-31T00:00:00.000Z,810.13,Equity : Sectoral - Infrastructure,547
Kotak Silver ETF,2025-01-31T00:00:00.000Z,807.42,Gold : ETFs,46627
Union Large & Midcap Fund-Reg(G),2025-01-31T00:00:00.000Z,805.4,Equity : Large & Mid Cap,44300
HDFC Dynamic Debt Fund(G),2025-02-28T00:00:00.000Z,803.63,Debt : Dynamic Bond,1274
Motilal Oswal Nifty Smallcap 250 Index Fund-Reg(G),2025-01-31T00:00:00.000Z,796.09,Equity : Index Funds,43811
Axis Gold Fund-Reg(G),2025-01-31T00:00:00.000Z,793.5,Gold : MFs,15330
Nippon India Index Fund-BSE Sensex Plan(G),2025-01-31T00:00:00.000Z,788.84,Equity : Index Funds,12865
Bandhan Hybrid Equity Fund-Reg(G),2025-01-31T00:00:00.000Z,786.07,Hybrid : Equity Oriented,34066
Axis Value Fund-Reg(G),2025-01-31T00:00:00.000Z,784.67,Equity : Value / Contra,45838
Invesco India Manufacturing Fund-Reg(G),2025-01-31T00:00:00.000Z,784.17,Equity : Thematic,47579
ITI Large & Mid Cap Fund-Reg(G),2025-01-31T00:00:00.000Z,783.37,Equity : Large & Mid Cap,48956
Edelweiss Nifty Midcap150 Momentum 50 Index Fund-Reg(G),2025-01-31T00:00:00.000Z,781.45,Equity : Index Funds,47175
Kotak Quant Fund-Reg(G),2025-01-31T00:00:00.000Z,775.86,Equity : Thematic,48083
Canara Rob Savings Fund-Reg(G),2025-02-28T00:00:00.000Z,770.26,Debt : Low Duration,535
Axis CRISIL-IBX AAA Bond NBFC - Jun 2027 Index Fund-Reg(G),2025-02-28T00:00:00.000Z,767.29,Debt : Medium to Long Duration,49127
LIC MF Nifty 50 ETF,2025-02-28T00:00:00.000Z,767.14,Equity : ETFs,33580
Mirae Asset Nifty SDL Jun 2027 Index Fund-Reg(G),2025-02-28T00:00:00.000Z,764.81,Debt : Medium to Long Duration,46134
LIC MF Infra Fund-Reg(G),2025-02-28T00:00:00.000Z,763.24,Equity : Sectoral - Infrastructure,4324
Quant PSU Fund-Reg(G),2025-01-31T00:00:00.000Z,759.28,Equity : Thematic,48341
Nippon India ETF Hang Seng BeES,2025-01-31T00:00:00.000Z,759.04,Equity : ETFs,8564
Franklin India Corp Debt Fund-A(G),2025-02-28T00:00:00.000Z,753.56,Debt : Corporate Bond,3381
JM Aggressive Hybrid Fund(G),2025-01-31T00:00:00.000Z,752.06,Hybrid : Equity Oriented,1847
Nippon India US Equity Opp Fund(G),2025-01-31T00:00:00.000Z,750.74,Equity : International,19246
Bank of India Multi Cap Fund-Reg(G),2025-01-31T00:00:00.000Z,749.55,Equity : Multi Cap,46115
PGIM India ELSS Tax Saver Fund-Reg(G),2025-01-31T00:00:00.000Z,749.45,Equity : Tax Saving (ELSS),26780
Nippon India Nifty G-Sec Jun 2036 Maturity Index Fund-Reg(G),2025-02-28T00:00:00.000Z,747.75,Debt : Gilt,47190
ICICI Pru Retirement Fund-Hybrid Aggressive Plan(G),2025-01-31T00:00:00.000Z,745.98,Hybrid : Solution Oriented,25669
Motilal Oswal Digital India Fund-Reg(G),2025-01-31T00:00:00.000Z,743.8,Equity : Sectoral - Technology,48960
HDFC Nifty G-Sec Jun 2027 Index Fund-Reg(G),2025-02-28T00:00:00.000Z,742.6,Debt : Gilt,46618
Kotak Nifty 50 Index Fund-Reg(G),2025-01-31T00:00:00.000Z,742.2,Equity : Index Funds,45556
Motilal Oswal BSE Enhanced Value Index Fund-Reg(G),2025-01-31T00:00:00.000Z,740.42,Equity : Index Funds,46741
Aditya Birla SL Special Opp Fund-Reg(G),2025-01-31T00:00:00.000Z,732.37,Equity : Thematic,45096
Kotak Credit Risk Fund(G),2025-02-28T00:00:00.000Z,728.07,Debt : Credit Risk,8472
WOC Special Opp Fund-Reg(G),2025-01-31T00:00:00.000Z,727.54,Equity : Thematic,48833
Baroda BNP Paribas Conservative Hybrid Fund-Reg(G),2025-02-28T00:00:00.000Z,724.36,Hybrid : Debt Oriented (Conservative),210
DSP Gold ETF,2025-01-31T00:00:00.000Z,721.51,Gold : ETFs,47938
LIC MF BSE Sensex ETF,2025-02-28T00:00:00.000Z,720.02,Equity : ETFs,33579
Motilal Oswal Manufacturing Fund-Reg(G),2025-01-31T00:00:00.000Z,719.64,Equity : Thematic,48962
LIC MF Balanced Advantage Fund-Reg(G),2025-02-28T00:00:00.000Z,719.51,Hybrid : Equity Oriented,45941
LIC MF Manufacturing Fund-Reg(G),2025-02-28T00:00:00.000Z,717.85,Equity : Thematic,49120
SBI Nifty Midcap 150 Index Fund-Reg(G),2025-01-31T00:00:00.000Z,716.78,Equity : Index Funds,45376
360 ONE Dynamic Bond Fund-Reg(G),2025-02-28T00:00:00.000Z,714.74,Debt : Dynamic Bond,17578
UTI Innovation Fund-Reg(G),2025-02-28T00:00:00.000Z,709.54,Equity : Thematic,48238
HDFC NIFTY200 Momentum 30 Index Fund-Reg(G),2025-01-31T00:00:00.000Z,705.45,Equity : Index Funds,48466
Sundaram Corp Bond Fund(G),2025-02-28T00:00:00.000Z,704.66,Debt : Corporate Bond,2955
Aditya Birla SL CRISIL IBX Gilt Apr 2029 Index Fund-Reg(G),2025-02-28T00:00:00.000Z,701.8,Debt : Gilt,46950
Nippon India Equity Savings Fund(G),2025-01-31T00:00:00.000Z,699.3,Hybrid : Equity Oriented,30963
WOC Large Cap Fund-Reg(G),2025-01-31T00:00:00.000Z,698.13,Equity : Large Cap,47079
Sundaram Overnight Fund-Reg(G),2025-02-28T00:00:00.000Z,697.87,Debt : Overnight,42000
Navi Nifty Next 50 Index Fund-Reg(G),2025-01-31T00:00:00.000Z,697.58,Equity : Index Funds,45860
Tata Nifty Midcap 150 Momentum 50 Index Fund-Reg(G),2025-01-31T00:00:00.000Z,695.53,Equity : Index Funds,47010
HDFC Nifty G-Sec Jul 2031 Index Fund-Reg(G),2025-02-28T00:00:00.000Z,686.96,Debt : Gilt,46620
Mirae Asset S&P 500 Top 50 ETF FoF-Reg(G),2025-01-31T00:00:00.000Z,685.19,FoFs : Overseas,45836
Bandhan Overnight Fund-Reg(G),2025-02-28T00:00:00.000Z,681.25,Debt : Overnight,41901
Franklin India NSE Nifty 50 Index Fund(G),2025-01-31T00:00:00.000Z,680.95,Equity : Index Funds,942
Axis NIFTY 50 ETF,2025-01-31T00:00:00.000Z,678.71,Equity : ETFs,33980
Edelweiss Technology Fund-Reg(G),2025-01-31T00:00:00.000Z,678.19,Equity : Sectoral - Technology,43844
Tata Nifty 50 ETF,2025-01-31T00:00:00.000Z,671.56,Equity : ETFs,41017
SBI FMP-66-1361D-Reg(G),2025-02-28T00:00:00.000Z,670.96,Debt : FTP/FMP,46633
DSP FMP 267-1246D-Reg(G),2025-01-31T00:00:00.000Z,668.37,Debt : FTP/FMP,47071
DSP NIFTY 50 Index Fund-Reg(G),2025-01-31T00:00:00.000Z,661.06,Equity : Index Funds,41642
HSBC Medium Duration Fund-Reg(G),2025-02-28T00:00:00.000Z,656.27,Debt : Medium Duration,31014
Franklin India Equity Savings Fund(G),2025-01-31T00:00:00.000Z,655.0,Hybrid : Equity Oriented,39645
Aditya Birla SL Equity Savings Fund-Reg(G),2025-01-31T00:00:00.000Z,650.4,Hybrid : Equity Oriented,30757
DSP NIFTY 1D Rate Liquid ETF,2025-01-31T00:00:00.000Z,648.86,Debt : ETFs,38904
LIC MF Nifty 100 ETF,2025-02-28T00:00:00.000Z,647.5,Equity : ETFs,33578
HSBC Equity Savings Fund-Reg(G),2025-01-31T00:00:00.000Z,645.87,Hybrid : Equity Oriented,15304
UTI Gilt Fund-Reg(G),2025-02-28T00:00:00.000Z,643.56,Debt : Gilt,3560
Baroda BNP Paribas Focused Fund-Reg(G),2025-01-31T00:00:00.000Z,642.35,Equity : Flexi Cap,32452
UTI Equity Savings Fund-Reg(G),2025-02-28T00:00:00.000Z,640.83,Hybrid : Equity Oriented,35818
Aditya Birla SL ESG Integration Strategy Fund-Reg(G),2025-01-31T00:00:00.000Z,629.12,Equity : Thematic,44736
UTI Dynamic Bond Fund-Reg(G),2025-02-28T00:00:00.000Z,626.15,Debt : Dynamic Bond,11896
360 ONE Quant Fund-Reg(G),2025-01-31T00:00:00.000Z,623.03,Equity : Thematic,46015
UTI India Consumer Fund-Reg(G),2025-02-28T00:00:00.000Z,620.33,Equity : Thematic - Consumption,3581
SBI Magnum Comma Fund-Reg(G),2025-01-31T00:00:00.000Z,617.89,Equity : Thematic,2750
DSP Floater Fund-Reg(G),2025-01-31T00:00:00.000Z,614.11,Debt : Floater,45396
ICICI Pru Nifty Midcap 150 Index Fund-Reg(G),2025-01-31T00:00:00.000Z,613.55,Equity : Index Funds,46108
Mahindra Manulife Low Duration Fund-Reg(G),2025-02-28T00:00:00.000Z,613.23,Debt : Low Duration,36894
Union Aggressive Hybrid Fund-Reg(G),2025-01-31T00:00:00.000Z,611.21,Hybrid : Equity Oriented,44512
HDFC Nifty G-Sec Sep 2032 Index Fund-Reg(G),2025-02-28T00:00:00.000Z,607.29,Debt : Gilt,46872
Axis Nifty 50 Index Fund-Reg(G),2025-01-31T00:00:00.000Z,603.54,Equity : Index Funds,45701
PGIM India Large and Mid Cap Fund(G),2025-01-31T00:00:00.000Z,602.29,Equity : Large & Mid Cap,48543
Quant BFSI Fund-Reg(G),2025-01-31T00:00:00.000Z,601.24,Equity : Sectoral - Financial Services,47989
Motilal Oswal Nifty 50 Index Fund-Reg(G),2025-01-31T00:00:00.000Z,598.24,Equity : Index Funds,44366
Kotak Technology Fund-Reg(G),2025-01-31T00:00:00.000Z,596.8,Equity : Sectoral - Technology,48587
Invesco India Aggressive Hybrid Fund-Reg(G),2025-01-31T00:00:00.000Z,595.95,Hybrid : Equity Oriented,39893
JM Small Cap Fund-Reg(G),2025-01-31T00:00:00.000Z,595.33,Equity : Small Cap,48452
LIC MF Nifty Midcap 100 ETF,2025-02-28T00:00:00.000Z,593.5,Equity : ETFs,48473
Nippon India Nifty 500 Momentum 50 Index Fund-Reg(G),2025-01-31T00:00:00.000Z,591.62,Equity : Index Funds,49162
Franklin India Banking & PSU Debt Fund(G),2025-02-28T00:00:00.000Z,587.34,Debt : Banking & PSU,28458
Mahindra Manulife Large Cap Fund-Reg(G),2025-01-31T00:00:00.000Z,586.71,Equity : Large Cap,38073
Kotak Nifty SDL Plus AAA PSU Bond Jul 2028 60:40 Index Fund-Reg(G),2025-02-28T00:00:00.000Z,586.43,Debt : Medium to Long Duration,46730
HDFC MNC Fund-Reg(G),2025-01-31T00:00:00.000Z,585.98,Equity : Thematic - MNC,47648
Motilal Oswal Nifty Bank Index Fund-Reg(G),2025-01-31T00:00:00.000Z,585.68,Equity : Index Funds,43789
HSBC Credit Risk Fund-Reg(G),2025-02-28T00:00:00.000Z,581.61,Debt : Credit Risk,8016
Baroda BNP Paribas Overnight Fund-Reg(G),2025-02-28T00:00:00.000Z,577.28,Debt : Overnight,43376
SBI FMP-67-1467D-Reg(G),2025-02-28T00:00:00.000Z,576.54,Debt : FTP/FMP,46703
Kotak Global Innovation FoF-Reg(G),2025-01-31T00:00:00.000Z,573.39,FoFs : Overseas,45334
Edelweiss Equity Savings Fund-Reg(G),2025-01-31T00:00:00.000Z,572.01,Hybrid : Equity Oriented,30730
PGIM India Large Cap Fund(G),2025-01-31T00:00:00.000Z,570.93,Equity : Large Cap,758
Samco Dynamic Asset Allocation Fund-Reg(G),2025-01-31T00:00:00.000Z,565.3,Hybrid : Dynamic Asset Allocation,48331
Mahindra Manulife Equity Savings Fund-Reg(G),2025-01-31T00:00:00.000Z,564.05,Hybrid : Equity Oriented,36671
Baroda BNP Paribas Business Cycle Fund-Reg(G),2025-01-31T00:00:00.000Z,563.0,Equity : Thematic,45686
Mirae Asset Nifty 1D Rate Liquid ETF(IDCW),2025-02-28T00:00:00.000Z,561.32,Debt : ETFs,48119
Mahindra Manulife Multi Asset Allocation Fund-Reg(G),2025-01-31T00:00:00.000Z,560.24,Hybrid : Multi Asset Allocation,48449
Nippon India Silver ETF FOF-Reg(G),2025-01-31T00:00:00.000Z,556.92,FoFs : Domestic,46198
Union Business Cycle Fund-Reg(G),2025-01-31T00:00:00.000Z,554.99,Equity : Thematic,48599
Bandhan CRISIL IBX 90:10 SDL Plus Gilt - April 2032 Index Fund-Reg(G),2025-02-28T00:00:00.000Z,553.2,Debt : Long Duration,46814
ICICI Pru Nifty FMCG ETF,2025-01-31T00:00:00.000Z,535.99,Equity : ETFs,45651
Axis Global Innovation FoF-Reg(G),2025-01-31T00:00:00.000Z,532.84,FoFs : Overseas,45539
HSBC Low Duration Fund-Reg(G),2025-02-28T00:00:00.000Z,531.31,Debt : Low Duration,13350
Motilal Oswal Nifty Midcap 100 ETF,2025-01-31T00:00:00.000Z,529.98,Equity : ETFs,13595
Bank of India Business Cycle Fund-Reg(G),2025-01-31T00:00:00.000Z,529.03,Equity : Thematic,48964
SBI Silver ETF,2025-01-31T00:00:00.000Z,524.96,Gold : ETFs,48967
Bandhan Transportation and Logistics Fund-Reg(G),2025-01-31T00:00:00.000Z,524.52,Equity : Sectoral - Auto,46986
Tata Housing Opportunities Fund-Reg(G),2025-01-31T00:00:00.000Z,524.28,Equity : Thematic,46764
ICICI Pru Nifty IT Index Fund-Reg(G),2025-01-31T00:00:00.000Z,524.09,Equity : Index Funds,46707
Bank of India Mfg & Infra Fund-Reg(G),2025-01-31T00:00:00.000Z,523.86,Equity : Sectoral - Infrastructure,8484
Aditya Birla SL Silver ETF,2025-01-31T00:00:00.000Z,523.3,Gold : ETFs,46194
ICICI Pru Nifty Bank Index Fund-Reg(G),2025-01-31T00:00:00.000Z,522.06,Equity : Index Funds,45994
Mirae Asset Gold ETF,2025-01-31T00:00:00.000Z,521.37,Gold : ETFs,47117
Navi Nifty Bank Index Fund-Reg(G),2025-01-31T00:00:00.000Z,519.74,Equity : Index Funds,45873
Bajaj Finserv Consumption Fund-Reg(G),2025-01-31T00:00:00.000Z,519.46,Equity : Thematic - Consumption,49345
ICICI Pru Nifty 10 yr Benchmark G-Sec ETF,2025-02-28T00:00:00.000Z,518.9,Debt : Gilt (10 Yr Constant Duration),47331
UTI BSE Low Volatility Index Fund-Reg(G),2025-02-28T00:00:00.000Z,518.31,Equity : Index Funds,46409
Canara Rob Ultra Short Term Fund-Reg(G),2025-02-28T00:00:00.000Z,515.16,Debt : Ultra Short Duration,5902
Invesco India Short Duration Fund(G),2025-02-28T00:00:00.000Z,508.29,Debt : Short Duration,2262
Quantum Liquid Fund-Reg(G),2025-02-28T00:00:00.000Z,507.26,Debt : Liquid,19756
Motilal Oswal Ultra Short Term Fund-Reg(G),2025-02-28T00:00:00.000Z,504.1,Debt : Ultra Short Duration,22532
TRUSTMF Small Cap Fund-Reg(G),2025-01-31T00:00:00.000Z,502.98,Equity : Small Cap,48991
HDFC Silver ETF,2025-01-31T00:00:00.000Z,500.63,Gold : ETFs,46223
ICICI Pru Nifty IT ETF,2025-01-31T00:00:00.000Z,497.18,Equity : ETFs,44401
Motilal Oswal Arbitrage Fund-Reg(G),2025-01-31T00:00:00.000Z,496.69,Hybrid : Arbitrage,49485
Samco Flexi Cap Fund-Reg(G),2025-01-31T00:00:00.000Z,495.13,Equity : Flexi Cap,46217
Franklin India Pension Plan(G),2025-02-28T00:00:00.000Z,492.42,Hybrid : Solution Oriented,3396
Nippon India Nifty Next 50 Junior BeES FoF-Reg(G),2025-01-31T00:00:00.000Z,491.85,FoFs : Domestic,40664
JM Large Cap Fund-Reg(G),2025-01-31T00:00:00.000Z,490.7,Equity : Large Cap,1858
DSP Nifty Bank ETF,2025-01-31T00:00:00.000Z,483.89,Equity : ETFs,46468
Invesco India ESG Integration Strategy Fund-Reg(G),2025-01-31T00:00:00.000Z,483.57,Equity : Thematic,45348
Bandhan Bond Fund - Income Plan-Reg(G),2025-02-28T00:00:00.000Z,482.85,Debt : Long Duration,1090
ITI Focused Equity Fund-Reg(G),2025-01-31T00:00:00.000Z,482.56,Equity : Flexi Cap,45722
Motilal Oswal Nifty 500 Momentum 50 Index Fund-Reg(G),2025-01-31T00:00:00.000Z,480.49,Equity : Index Funds,48961
Kotak Nifty Alpha 50 ETF,2025-01-31T00:00:00.000Z,480.37,Equity : ETFs,45687
Mirae Asset Nifty Smallcap 250 Momentum Quality 100 ETF,2025-01-31T00:00:00.000Z,479.09,Equity : ETFs,48496
Axis Long Duration Fund-Reg(G),2025-02-28T00:00:00.000Z,474.13,Debt : Long Duration,46626
Aditya Birla SL Gold Fund(G),2025-01-31T00:00:00.000Z,471.82,Gold : MFs,16220
SBI FMP-42-1857D-Reg(G),2025-02-28T00:00:00.000Z,470.79,Debt : FTP/FMP,45447
LIC MF Aggressive Hybrid Fund(G),2025-02-28T00:00:00.000Z,468.47,Hybrid : Equity Oriented,2085
ICICI Pru Nifty 200 Momentum 30 Index Fund-Reg(G),2025-01-31T00:00:00.000Z,466.86,Equity : Index Funds,46683
Axis CRISIL IBX 70:30 CPSE Plus SDL April 2025 Index Fund-Reg(G),2025-02-28T00:00:00.000Z,463.52,Debt : Medium Duration,45992
HDFC Nifty LargeMidcap 250 Index Fund-Reg(G),2025-01-31T00:00:00.000Z,459.55,Equity : Index Funds,48969
HDFC FMP-Sr 46-1861D-Mar 2022-Reg(G),2025-02-28T00:00:00.000Z,459.48,Debt : FTP/FMP,46453
Kotak CRISIL-IBX AAA Financial Services Index - Sep 2027 Fund-Reg(G),2025-02-28T00:00:00.000Z,457.65,Debt : Medium to Long Duration,49109
Mirae Asset Nifty Next 50 ETF,2025-01-31T00:00:00.000Z,457.38,Equity : ETFs,44314
HDFC BSE Sensex ETF,2025-01-31T00:00:00.000Z,457.29,Equity : ETFs,34084
Bajaj Finserv Nifty 1D Rate Liquid ETF(G),2025-02-28T00:00:00.000Z,456.95,Debt : ETFs,48746
UTI Nifty 500 Value 50 Index Fund-Reg(G),2025-02-28T00:00:00.000Z,453.34,Equity : Index Funds,47577
LIC MF ULIS,2025-02-28T00:00:00.000Z,450.36,Hybrid : Solution Oriented,2154
Kotak FMP-292-1735D(G),2025-02-28T00:00:00.000Z,449.72,Debt : FTP/FMP,45679
Kotak FMP-292-1735D(IDCW),2025-02-28T00:00:00.000Z,449.72,Debt : FTP/FMP,45790
ICICI Pru FMP-85-10Y-I(G),2025-02-28T00:00:00.000Z,449.26,Debt : FTP/FMP,43023
Union Short Duration Fund-Reg(G),2025-02-28T00:00:00.000Z,447.29,Debt : Short Duration,49467
LIC MF Multi Asset Allocation Fund-Reg(G),2025-02-28T00:00:00.000Z,446.83,Hybrid : Multi Asset Allocation,49465
LIC MF Dividend Yield Fund-Reg(G),2025-02-28T00:00:00.000Z,446.38,Equity : Thematic - Dividend Yield,41332
Bajaj Finserv Overnight Fund-Reg(G),2025-02-28T00:00:00.000Z,445.56,Debt : Overnight,48051
Axis Nifty Smallcap 50 Index Fund-Reg(G),2025-01-31T00:00:00.000Z,445.1,Equity : Index Funds,45856
Bandhan CRISIL IBX Gilt April 2026 Index Fund-Reg(G),2025-02-28T00:00:00.000Z,443.07,Debt : Gilt,46815
Franklin India Overnight Fund(G),2025-02-28T00:00:00.000Z,441.58,Debt : Overnight,43438
Bandhan CRISIL IBX Gilt April 2032 Index Fund-Reg(G),2025-02-28T00:00:00.000Z,440.62,Debt : Long Duration,47601
UTI Nifty200 Quality 30 Index Fund-Reg(G),2025-02-28T00:00:00.000Z,439.88,Equity : Index Funds,49144
ICICI Pru Nifty Smallcap 250 Index Fund(G),2025-01-31T00:00:00.000Z,437.32,Equity : Index Funds,45684
Invesco India Overnight Fund-Reg(G),2025-02-28T00:00:00.000Z,435.06,Debt : Overnight,44317
Mahindra Manulife Consumption Fund-Reg(G),2025-01-31T00:00:00.000Z,434.8,Equity : Thematic - Consumption,38749
LIC MF Small Cap Fund(G),2025-02-28T00:00:00.000Z,433.6,Equity : Small Cap,36914
Aditya Birla SL NASDAQ 100 FOF-Reg(G),2025-01-31T00:00:00.000Z,428.95,FoFs : Overseas,45711
Nippon India Nifty AAA PSU Bond Plus SDL - Sep 2026 Maturity 50:50 Index Fund-Reg(G),2025-02-28T00:00:00.000Z,426.37,Debt : Banking & PSU,47034
Union Largecap Fund-Reg(G),2025-01-31T00:00:00.000Z,423.44,Equity : Large Cap,33066
Kotak Nifty Next 50 Index Fund-Reg(G),2025-01-31T00:00:00.000Z,423.16,Equity : Index Funds,44443
ICICI Pru Nifty Midcap 150 ETF,2025-01-31T00:00:00.000Z,422.7,Equity : ETFs,44494
Invesco India - Invesco EQQQ NASDAQ-100 ETF FoF-Reg(G),2025-01-31T00:00:00.000Z,418.32,FoFs : Overseas,45943
Aditya Birla SL CRISIL IBX 50:50 Gilt Plus SDL Apr 2028 Index Fund-Reg(G),2025-02-28T00:00:00.000Z,418.07,Debt : Medium to Long Duration,46897
Kotak Healthcare Fund-Reg(G),2025-01-31T00:00:00.000Z,415.85,Equity : Sectoral - Pharma,47949
ICICI Pru Nifty 200 Momentum 30 ETF,2025-01-31T00:00:00.000Z,411.67,Equity : ETFs,46682
Nippon India Income Fund(G),2025-02-28T00:00:00.000Z,411.26,Debt : Medium to Long Duration,2580
Edelweiss Overnight Fund-Reg(G),2025-02-28T00:00:00.000Z,408.36,Debt : Overnight,42955
Quant Teck Fund-Reg(G),2025-01-31T00:00:00.000Z,406.7,Equity : Sectoral - Technology,48195
Bank of India Consumption Fund-Reg(G),2025-01-31T00:00:00.000Z,406.61,Equity : Thematic - Consumption,49323
HDFC Nifty500 Multicap 50:25:25 Index Fund-Reg(G),2025-01-31T00:00:00.000Z,406.43,Equity : Index Funds,48970
Axis Nifty Midcap 50 Index Fund-Reg(G),2025-01-31T00:00:00.000Z,405.73,Equity : Index Funds,46459
Aditya Birla SL CRISIL-IBX AAA NBFC-HFC Index-Dec 2025 Fund-Reg(G),2025-02-28T00:00:00.000Z,405.05,Debt : Short Duration,49202
SBI FMP-81-1157D-Reg(G),2025-02-28T00:00:00.000Z,404.51,Debt : FTP/FMP,47876
Nippon India Nifty SDL Plus G-Sec-Jun 2028 Maturity 70:30 Index Fund-Reg(G),2025-02-28T00:00:00.000Z,403.99,Debt : Medium to Long Duration,46822
Quant Healthcare Fund-Reg(G),2025-01-31T00:00:00.000Z,402.5,Equity : Sectoral - Pharma,48035
Invesco India Equity Savings Fund-Reg(G),2025-01-31T00:00:00.000Z,401.88,Hybrid : Equity Oriented,41505
Nippon India Nifty G-Sec Sep 2027 Maturity Index Fund-Reg(G),2025-02-28T00:00:00.000Z,400.36,Debt : Gilt,47186
Union Focused Fund-Reg(G),2025-01-31T00:00:00.000Z,396.5,Equity : Multi Cap,22068
SBI FMP-64-1169D-Reg(G),2025-02-28T00:00:00.000Z,395.83,Debt : FTP/FMP,46858
PGIM India Liquid Fund(G),2025-02-28T00:00:00.000Z,390.62,Debt : Liquid,818
Nippon India Nifty 500 Equal Weight Index Fund-Reg(G),2025-01-31T00:00:00.000Z,390.08,Equity : Index Funds,49022
Union Active Momentum Fund-Reg(G),2025-01-31T00:00:00.000Z,384.98,Equity : Thematic,49020
Aditya Birla SL Nifty India Defence Index Fund-Reg(G),2025-01-31T00:00:00.000Z,384.8,Equity : Index Funds,49044
Edelweiss ELSS Tax saver Fund-Reg(G),2025-01-31T00:00:00.000Z,383.46,Equity : Tax Saving (ELSS),7545
DSP CRISIL SDL Plus G-Sec Apr 2033 50:50 Index Fund-Reg(G),2025-01-31T00:00:00.000Z,382.26,Debt : Long Duration,47476
Kotak Nifty AAA Bond Jun 2025 HTM Index Fund-Reg(G),2025-02-28T00:00:00.000Z,381.42,Debt : Short Duration,48658
Axis Credit Risk Fund-Reg(G),2025-02-28T00:00:00.000Z,380.54,Debt : Credit Risk,23018
SBI FMP-44-1855D-Reg(G),2025-02-28T00:00:00.000Z,379.01,Debt : FTP/FMP,45552
ITI Balanced Advantage Fund-Reg(G),2025-01-31T00:00:00.000Z,378.3,Hybrid : Dynamic Asset Allocation,44362
Quant Commodities Fund-Reg(G),2025-01-31T00:00:00.000Z,375.21,Equity : Thematic,48343
ITI ELSS Tax Saver Fund-Reg(G),2025-01-31T00:00:00.000Z,374.22,Equity : Tax Saving (ELSS),44014
Tata Gold ETF,2025-01-31T00:00:00.000Z,373.73,Gold : ETFs,48435
Aditya Birla SL Retirement Fund-30-Reg(G),2025-01-31T00:00:00.000Z,373.4,Hybrid : Solution Oriented,32078
Sundaram Low Duration Fund(G),2025-02-28T00:00:00.000Z,372.68,Debt : Low Duration,2343
Kotak Nifty 200 Momentum 30 Index Fund-Reg(G),2025-01-31T00:00:00.000Z,372.49,Equity : Index Funds,47977
WOC Ultra Short Duration Fund-Reg(G),2025-02-28T00:00:00.000Z,372.12,Debt : Ultra Short Duration,42221
Nippon India Asset Allocator FoF-Reg(G),2025-01-31T00:00:00.000Z,369.58,FoFs : Domestic,44074
HDFC NIFTY Smallcap 250 Index Fund-Reg(G),2025-01-31T00:00:00.000Z,369.43,Equity : Index Funds,47916
DSP Nifty Midcap 150 Quality 50 Index Fund-Reg(G),2025-01-31T00:00:00.000Z,368.36,Equity : Index Funds,46467
Mirae Asset Nifty 200 Alpha 30 ETF,2025-01-31T00:00:00.000Z,367.74,Equity : ETFs,48243
LIC MF Ultra Short Duration Fund-Reg(G),2025-02-28T00:00:00.000Z,365.85,Debt : Ultra Short Duration,44073
ITI Large Cap Fund-Reg(G),2025-01-31T00:00:00.000Z,364.35,Equity : Large Cap,44400
Bandhan US Equity FoF-Reg(G),2025-01-31T00:00:00.000Z,362.04,FoFs : Overseas,45674
Bandhan US Equity FoF-Reg(IDCW),2025-01-31T00:00:00.000Z,362.04,FoFs : Overseas,45675
Tata BSE Sensex Index Fund-Reg(G),2025-01-31T00:00:00.000Z,361.4,Equity : Index Funds,3249
Nippon India Taiwan Equity Fund-Reg(G),2025-01-31T00:00:00.000Z,358.16,Equity : International,45690
Bank of India Large & Mid Cap Equity Fund-Reg(G),2025-01-31T00:00:00.000Z,356.68,Equity : Large & Mid Cap,6434
Aditya Birla SL Nifty 50 Equal Weight Index Fund-Reg(G),2025-01-31T00:00:00.000Z,356.65,Equity : Index Funds,44741
Baroda BNP Paribas Retirement Fund-Reg(G),2025-01-31T00:00:00.000Z,351.17,Hybrid : Solution Oriented,48794
DSP Nifty Top 10 Equal Weight ETF,2025-01-31T00:00:00.000Z,350.57,Equity : ETFs,49012
Taurus Flexi Cap Fund-Reg(G),2025-01-31T00:00:00.000Z,350.54,Equity : Flexi Cap,3317
Bandhan G-Sec-Constant Maturity Plan-Reg(G),2025-02-28T00:00:00.000Z,350.53,Debt : Gilt (10 Yr Constant Duration),1079
LIC MF Arbitrage Fund-Reg(G),2025-02-28T00:00:00.000Z,349.48,Hybrid : Arbitrage,39948
HDFC NIFTY100 Low Volatility 30 Index Fund-Reg(G),2025-01-31T00:00:00.000Z,349.36,Equity : Index Funds,48653
Tata Young Citizen Fund,2025-01-31T00:00:00.000Z,349.2,Hybrid : Solution Oriented,3304
WOC Liquid Fund-Reg(G),2025-02-28T00:00:00.000Z,347.16,Debt : Liquid,42211
SBI LT Advantage Fund-V-Reg(G),2025-01-31T00:00:00.000Z,346.48,Equity : Tax Saving (ELSS),38291
ICICI Pru BSE 500 ETF,2025-01-31T00:00:00.000Z,345.0,Equity : ETFs,38531
SBI Nifty India Consumption Index Fund-Reg(G),2025-01-31T00:00:00.000Z,344.49,Equity : Index Funds,49106
UTI CRISIL SDL Maturity April 2033 Index Fund-Reg(G),2025-02-28T00:00:00.000Z,342.86,Debt : Long Duration,47337
PGIM India Multi Cap Fund-Reg(G),2025-01-31T00:00:00.000Z,342.33,Equity : Multi Cap,48968
Mirae Asset Short Duration Fund-Reg(G),2025-02-28T00:00:00.000Z,341.97,Debt : Short Duration,38870
Samco Multi Cap Fund-Reg(G),2025-01-31T00:00:00.000Z,340.85,Equity : Multi Cap,49152
Axis Retirement Fund-Dynamic Plan-Reg(G),2025-01-31T00:00:00.000Z,340.55,Hybrid : Solution Oriented,43842
Mirae Asset Global X Artificial Intelligence & Technology ETF FoF-Reg(G),2025-01-31T00:00:00.000Z,339.93,FoFs : Overseas,45380
Bandhan FTP-179-3652D-Reg(G),2025-02-28T00:00:00.000Z,339.56,Debt : FTP/FMP,42924
Mirae Asset Hang Seng TECH ETF,2025-01-31T00:00:00.000Z,339.18,Equity : ETFs,45737
Axis Greater China Equity FoF-Reg(G),2025-01-31T00:00:00.000Z,338.8,FoFs : Overseas,44318
Sundaram Banking & PSU Fund(G),2025-02-28T00:00:00.000Z,337.32,Debt : Banking & PSU,2960
Bandhan Nifty Alpha 50 Index Fund-Reg(G),2025-01-31T00:00:00.000Z,336.34,Equity : Index Funds,48314
Invesco India - Invesco Global Consumer Trends FoF-Reg(G),2025-01-31T00:00:00.000Z,335.69,FoFs : Overseas,45201
Kotak Transportation & Logistics Fund-Reg(G),2025-01-31T00:00:00.000Z,335.08,Equity : Sectoral - Auto,48943
Canara Rob Short Duration Fund-Reg(G),2025-02-28T00:00:00.000Z,334.29,Debt : Short Duration,12382
SBI FMP-72-1239D-Reg(G),2025-02-28T00:00:00.000Z,331.88,Debt : FTP/FMP,47208
SBI FMP-61-1927D-Reg(G),2025-02-28T00:00:00.000Z,329.98,Debt : FTP/FMP,46511
