s_name,aumdate,aumtotal,classification,schemecode
Invesco India Technology Fund-Reg(G),2025-01-31T00:00:00.000Z,329.24,Equity : Sectoral - Technology,49047
Union Corporate Bond Fund-Reg(G),2025-02-28T00:00:00.000Z,328.82,Debt : Corporate Bond,39478
ICICI Pru Global Advantage Fund(FOF)(G),2025-01-31T00:00:00.000Z,327.18,FoFs : Overseas,43240
Franklin India Floating Rate Fund(G),2025-02-28T00:00:00.000Z,323.2,Debt : Floater,3392
Aditya Birla SL BSE Sensex ETF,2025-01-31T00:00:00.000Z,323.1,Equity : ETFs,35815
HDFC NIFTY 100 Equal Weight Index Fund-Reg(G),2025-01-31T00:00:00.000Z,322.81,Equity : Index Funds,45997
Nippon India Nifty Auto ETF,2025-01-31T00:00:00.000Z,321.95,Equity : ETFs,45713
Bank of India Multi Asset Allocation Fund-Reg(G),2025-02-28T00:00:00.000Z,321.88,Hybrid : Multi Asset Allocation,48027
DSP Silver ETF,2025-01-31T00:00:00.000Z,321.71,Gold : ETFs,46354
UTI FTIF-XXXV-I(1260D)(G),2025-02-28T00:00:00.000Z,320.55,Debt : FTP/FMP,45364
HDFC FMP-Sr 46-1359D-Sep 2022-Reg(G),2025-02-28T00:00:00.000Z,320.49,Debt : FTP/FMP,46945
Nippon India Nifty SDL Plus G-Sec - Jun 2029 Maturity 70:30 Index Fund-Reg(G),2025-02-28T00:00:00.000Z,319.49,Debt : Medium to Long Duration,46821
Invesco India Multi Asset Allocation Fund-Reg(G),2025-01-31T00:00:00.000Z,319.27,Hybrid : Multi Asset Allocation,49224
DSP Nifty 50 ETF,2025-01-31T00:00:00.000Z,315.32,Equity : ETFs,36811
WOC Banking & Financial Services Fund-Reg(G),2025-01-31T00:00:00.000Z,314.43,Equity : Sectoral - Financial Services,48332
TRUSTMF Liquid Fund-Reg(G),2025-02-28T00:00:00.000Z,313.12,Debt : Liquid,45451
WOC ELSS Tax Saver Fund-Reg(G),2025-01-31T00:00:00.000Z,312.12,Equity : Tax Saving (ELSS),46773
UTI Medium to Long Duration Fund-Reg(G),2025-02-28T00:00:00.000Z,311.56,Debt : Medium to Long Duration,3441
Quant Consumption Fund-Reg(G),2025-01-31T00:00:00.000Z,310.18,Equity : Thematic - Consumption,48342
Aditya Birla SL FTP-TI-1837D-Reg(G),2025-02-28T00:00:00.000Z,308.87,Debt : FTP/FMP,45593
Aditya Birla SL Nifty Midcap 150 Index Fund-Reg(G),2025-01-31T00:00:00.000Z,308.45,Equity : Index Funds,44738
WOC Digital Bharat Fund-Reg(G),2025-01-31T00:00:00.000Z,308.36,Equity : Sectoral - Technology,49129
HDFC NIFTY Private Bank ETF,2025-01-31T00:00:00.000Z,306.05,Equity : ETFs,46045
DSP Bond Fund-Reg(G),2025-01-31T00:00:00.000Z,305.79,Debt : Medium Duration,637
SBI FMP-53-1839D-Reg(G),2025-02-28T00:00:00.000Z,304.25,Debt : FTP/FMP,45972
Navi Large & Midcap Fund-Reg(G),2025-01-31T00:00:00.000Z,303.69,Equity : Large & Mid Cap,31897
Bajaj Finserv Healthcare Fund-Reg(G),2025-01-31T00:00:00.000Z,301.61,Equity : Sectoral - Pharma,49421
ITI Value Fund-Reg(G),2025-01-31T00:00:00.000Z,301.03,Equity : Value / Contra,45382
Aditya Birla SL CRISIL-IBX AAA NBFC-HFC Index-Sep 2026 Fund-Reg(G),2025-02-28T00:00:00.000Z,300.46,Debt : Short Duration,49201
Mirae Asset Nifty MidSmallcap400 Momentum Quality 100 ETF,2025-01-31T00:00:00.000Z,297.74,Equity : ETFs,48681
SBI Silver ETF FOF-Reg(G),2025-01-31T00:00:00.000Z,296.94,FoFs : Domestic,48895
UTI Credit Risk Fund-Reg(G),2025-02-28T00:00:00.000Z,296.93,Debt : Credit Risk,14960
LIC MF Nifty 50 Index Fund(G),2025-02-28T00:00:00.000Z,295.41,Equity : Index Funds,2129
SBI FMP-51-1846D-Reg(G),2025-02-28T00:00:00.000Z,294.14,Debt : FTP/FMP,45889
HSBC Nifty 50 Index Fund-Reg(G),2025-01-31T00:00:00.000Z,292.73,Equity : Index Funds,44938
Axis Nifty Next 50 Index Fund-Reg(G),2025-01-31T00:00:00.000Z,290.46,Equity : Index Funds,45702
Bandhan Credit Risk Fund-Reg(G),2025-02-28T00:00:00.000Z,289.46,Debt : Credit Risk,36529
Tata Nifty India Tourism Index Fund-Reg(G),2025-01-31T00:00:00.000Z,289.4,Equity : Index Funds,48992
Motilal Oswal Nifty Next 50 Index Fund-Reg(G),2025-01-31T00:00:00.000Z,288.85,Equity : Index Funds,44368
Union Value Fund-Reg(G),2025-01-31T00:00:00.000Z,288.7,Equity : Value / Contra,41740
Quant ESG Equity Fund-Reg(G),2025-01-31T00:00:00.000Z,288.45,Equity : Thematic,45130
Kotak Income Plus Arbitrage FOF-Reg(G),2025-02-28T00:00:00.000Z,287.92,FoFs : Domestic,47093
Axis NIFTY Bank ETF,2025-01-31T00:00:00.000Z,287.67,Equity : ETFs,14654
HDFC NIFTY 100 Index Fund-Reg(G),2025-01-31T00:00:00.000Z,287.42,Equity : Index Funds,45996
Aditya Birla SL CRISIL IBX Gilt - April 2026 Index Fund-Reg(G),2025-02-28T00:00:00.000Z,287.26,Debt : Medium Duration,46891
WOC Pharma and Healthcare Fund-Reg(G),2025-01-31T00:00:00.000Z,285.76,Equity : Sectoral - Pharma,48472
Helios Balanced Advantage Fund-Reg(G),2025-01-31T00:00:00.000Z,284.67,Hybrid : Dynamic Asset Allocation,48678
SBI FMP-56-1232D-Reg(G),2025-02-28T00:00:00.000Z,284.35,Debt : FTP/FMP,46153
Baroda BNP Paribas Low Duration Fund(G),2025-02-28T00:00:00.000Z,283.98,Debt : Low Duration,205
HDFC NIFTY Midcap 150 Index Fund-Reg(G),2025-01-31T00:00:00.000Z,280.04,Equity : Index Funds,46619
Axis Nifty AAA Bond Plus SDL Apr 2026 50:50 ETF FoF-Reg(G),2025-02-28T00:00:00.000Z,278.11,Debt : Medium to Long Duration,45699
SBI LT Advantage Fund-VI-Reg(G),2025-01-31T00:00:00.000Z,278.0,Equity : Tax Saving (ELSS),39495
Nippon India ETF Nifty 100,2025-01-31T00:00:00.000Z,277.45,Equity : ETFs,17643
WOC Quality Equity Fund-Reg(G),2025-01-31T00:00:00.000Z,277.08,Equity : Thematic,49192
LIC MF Midcap Fund(G),2025-02-28T00:00:00.000Z,276.69,Equity : Mid Cap,36348
Franklin India Ultra Short Duration Fund-Reg(G),2025-02-28T00:00:00.000Z,273.02,Debt : Ultra Short Duration,49073
Nippon India Japan Equity Fund(G),2025-01-31T00:00:00.000Z,271.31,Equity : International,24620
Taurus Ethical Fund-Reg(G),2025-01-31T00:00:00.000Z,271.22,Equity : Multi Cap,7615
Canara Rob Overnight Fund-Reg(G),2025-02-28T00:00:00.000Z,270.48,Debt : Overnight,43350
ICICI Pru Income Optimizer Fund(FOF)(G),2025-01-31T00:00:00.000Z,267.84,FoFs : Domestic,1701
Bandhan Floating Rate Fund-Reg(G),2025-02-28T00:00:00.000Z,267.44,Debt : Floater,41962
Axis Conservative Hybrid Fund-Reg(G),2025-02-28T00:00:00.000Z,267.14,Hybrid : Debt Oriented (Conservative),9765
ITI Banking & Financial Services Fund-Reg(G),2025-01-31T00:00:00.000Z,265.94,Equity : Sectoral - Financial Services,45720
DSP Nifty Private Bank ETF,2025-01-31T00:00:00.000Z,265.9,Equity : ETFs,47907
Bandhan Equity Savings Fund-Reg(G),2025-01-31T00:00:00.000Z,265.26,Hybrid : Equity Oriented,5300
Quantum Gold Fund ETF,2025-01-31T00:00:00.000Z,264.21,Gold : ETFs,4326
Edelweiss Banking and PSU Debt Fund-Reg(G),2025-02-28T00:00:00.000Z,263.62,Debt : Banking & PSU,23296
SBI Retirement Benefit Fund-Conservative Hybrid Plan-Reg(G),2025-02-28T00:00:00.000Z,263.45,Hybrid : Solution Oriented,30400
LIC MF Gold ETF,2025-02-28T00:00:00.000Z,263.43,Gold : ETFs,15131
Groww Nifty Total Market Index Fund-Reg(G),2025-01-31T00:00:00.000Z,262.95,Equity : Index Funds,48247
Aditya Birla SL Global Emerging Opp Fund(G),2025-01-31T00:00:00.000Z,258.68,FoFs : Overseas,6063
HSBC Gilt Fund-Reg(G),2025-02-28T00:00:00.000Z,256.96,Debt : Gilt,586
SBI FMP-57-1835D-Reg(G),2025-02-28T00:00:00.000Z,252.95,Debt : FTP/FMP,46158
SBI FMP-55-1849D-Reg(G),2025-02-28T00:00:00.000Z,249.96,Debt : FTP/FMP,46075
Tata Equity Savings Fund-Reg(G),2025-01-31T00:00:00.000Z,249.86,Hybrid : Equity Oriented,3273
Baroda BNP Paribas Equity Savings Fund-Reg(G),2025-01-31T00:00:00.000Z,249.48,Hybrid : Equity Oriented,42783
HDFC FMP-Sr 46-1406D-Aug 2022-Reg(G),2025-02-28T00:00:00.000Z,249.45,Debt : FTP/FMP,46755
Navi Flexi Cap Fund-Reg(G),2025-01-31T00:00:00.000Z,249.24,Equity : Flexi Cap,39516
SBI FMP-58-1842D-Reg(G),2025-02-28T00:00:00.000Z,247.1,Debt : FTP/FMP,46201
Helios Large & Mid Cap Fund-Reg(G),2025-01-31T00:00:00.000Z,247.08,Equity : Large & Mid Cap,49245
NJ ELSS Tax Saver Scheme-Reg(G),2025-01-31T00:00:00.000Z,246.77,Equity : Tax Saving (ELSS),46058
ICICI Pru Nifty SDL Sep 2026 Index Fund-Reg(G),2025-02-28T00:00:00.000Z,245.25,Debt : Medium to Long Duration,47333
SBI BSE Sensex Index Fund-Reg(G),2025-01-31T00:00:00.000Z,245.13,Equity : Index Funds,47966
Kotak FMP-300-1223D(G),2025-02-28T00:00:00.000Z,244.43,Debt : FTP/FMP,47298
Franklin Asian Equity Fund(G),2025-01-31T00:00:00.000Z,243.59,Equity : International,3813
SBI FMP-60-1878D-Reg(G),2025-02-28T00:00:00.000Z,243.48,Debt : FTP/FMP,46397
HDFC Nifty India Digital Index Fund-Reg(G),2025-01-31T00:00:00.000Z,240.74,Equity : Index Funds,49178
Mirae Asset CRISIL IBX Gilt Index - April 2033 Index Fund-Reg(G),2025-02-28T00:00:00.000Z,240.52,Debt : Gilt,47042
HSBC Tax Saver Equity Fund(G),2025-01-31T00:00:00.000Z,236.36,Equity : Tax Saving (ELSS),1462
LIC MF Banking & Financial Services Fund-Reg(G),2025-02-28T00:00:00.000Z,233.85,Equity : Sectoral - Financial Services,19955
Edelweiss NIFTY Large Mid Cap 250 Index Fund-Reg(G),2025-01-31T00:00:00.000Z,233.3,Equity : Index Funds,45864
Edelweiss Gold and Silver ETF FoF-Reg(G),2025-01-31T00:00:00.000Z,231.98,FoFs : Domestic,46800
Canara Rob Banking and PSU Debt Fund-Reg(G),2025-02-28T00:00:00.000Z,230.09,Debt : Banking & PSU,46050
Groww Nifty EV & New Age Automotive ETF,2025-01-31T00:00:00.000Z,228.84,Equity : ETFs,48978
Union Arbitrage Fund-Reg(G),2025-01-31T00:00:00.000Z,228.83,Hybrid : Arbitrage,42524
JM Focused Fund-Reg(G),2025-01-31T00:00:00.000Z,227.74,Equity : Large Cap,4282
Nippon India Passive Flexicap FoF-Reg(G),2025-01-31T00:00:00.000Z,225.59,FoFs : Domestic,43928
Navi Nifty Midcap 150 Index Fund-Reg(G),2025-01-31T00:00:00.000Z,223.74,Equity : Index Funds,45861
Nippon India FHF-XLIII-1-1755D(IDCW),2025-02-28T00:00:00.000Z,223.1,Debt : FTP/FMP,45796
Nippon India ETF Nifty 50 Value 20,2025-01-31T00:00:00.000Z,222.73,Equity : ETFs,31920
SBI FMP-45-1840D-Reg(G),2025-02-28T00:00:00.000Z,222.5,Debt : FTP/FMP,45580
Invesco India Gold ETF,2025-01-31T00:00:00.000Z,221.51,Gold : ETFs,8505
Nippon India FHF-XLV-5-1158D(G),2025-02-28T00:00:00.000Z,221.3,Debt : FTP/FMP,47900
UTI Nifty Midcap 150 Quality 50 Index Fund-Reg(G),2025-02-28T00:00:00.000Z,220.64,Equity : Index Funds,45718
Axis NIFTY IT ETF,2025-01-31T00:00:00.000Z,219.44,Equity : ETFs,45427
JM Low Duration Fund(G),2025-02-28T00:00:00.000Z,219.36,Debt : Low Duration,1938
TRUSTMF Banking & PSU Fund-Reg(G),2025-02-28T00:00:00.000Z,219.21,Debt : Banking & PSU,45242
Mirae Asset Nifty Financial Services ETF,2025-01-31T00:00:00.000Z,219.05,Equity : ETFs,45669
Mirae Asset Nifty Bank ETF,2025-01-31T00:00:00.000Z,217.33,Equity : ETFs,47993
ITI Pharma & Healthcare Fund-Reg(G),2025-01-31T00:00:00.000Z,216.51,Equity : Sectoral - Pharma,45724
Axis Nifty 500 Index Fund-Reg(G),2025-01-31T00:00:00.000Z,215.98,Equity : Index Funds,48963
Sundaram Arbitrage Fund(G),2025-01-31T00:00:00.000Z,215.76,Hybrid : Arbitrage,32098
Aditya Birla SL FTP-TQ-1879D-Reg(G),2025-02-28T00:00:00.000Z,214.76,Debt : FTP/FMP,46536
DSP Nifty 50 Equal Weight ETF,2025-01-31T00:00:00.000Z,214.51,Equity : ETFs,45715
Baroda BNP Paribas Banking and Fin Serv Fund-Reg(G),2025-01-31T00:00:00.000Z,214.42,Equity : Sectoral - Financial Services,16955
SBI Equity Minimum Variance Fund-Reg(G),2025-01-31T00:00:00.000Z,214.12,Equity : Thematic,33878
Kotak Nifty SDL Jul 2033 Index Fund-Reg(G),2025-02-28T00:00:00.000Z,213.74,Debt : Long Duration,47612
Sundaram Short Duration Fund(G),2025-02-28T00:00:00.000Z,213.14,Debt : Short Duration,2381
Aditya Birla SL Nifty Next 50 ETF,2025-01-31T00:00:00.000Z,212.58,Equity : ETFs,38262
TATA FMP-61-D-91D(G),2025-02-28T00:00:00.000Z,212.22,Debt : FTP/FMP,49448
Quantum ELSS Tax Saver Fund-Reg(G),2025-01-31T00:00:00.000Z,212.1,Equity : Tax Saving (ELSS),19878
Aditya Birla SL Global Excellence Equity FoF(G),2025-01-31T00:00:00.000Z,211.47,FoFs : Overseas,3841
Baroda BNP Paribas Short Duration Fund-Reg(G),2025-02-28T00:00:00.000Z,211.1,Debt : Short Duration,8374
HDFC Silver ETF FoF-Reg(G),2025-01-31T00:00:00.000Z,210.28,Gold : MFs,46465
Baroda BNP Paribas Corp Bond Fund(G),2025-02-28T00:00:00.000Z,210.1,Debt : Corporate Bond,6932
JM Arbitrage Fund(G),2025-01-31T00:00:00.000Z,209.87,Hybrid : Arbitrage,1843
Aditya Birla SL Nifty Smallcap 50 Index Fund-Reg(G),2025-01-31T00:00:00.000Z,209.2,Equity : Index Funds,44737
SBI LT Advantage Fund-IV-Reg(G),2025-01-31T00:00:00.000Z,208.55,Equity : Tax Saving (ELSS),36734
Aditya Birla SL Financial Planning FOF Aggressive Plan(G),2025-01-31T00:00:00.000Z,208.52,FoFs : Domestic,8303
HDFC BSE 500 Index Fund-Reg(G),2025-01-31T00:00:00.000Z,208.52,Equity : Index Funds,47913
Motilal Oswal Gold and Silver ETFs FoF-Reg(G),2025-01-31T00:00:00.000Z,207.31,Gold : MFs,17788
PGIM India Hybrid Equity Fund(G),2025-01-31T00:00:00.000Z,207.15,Hybrid : Equity Oriented,835
Mirae Asset Nifty India Manufacturing ETF,2025-01-31T00:00:00.000Z,205.92,Equity : ETFs,45869
Mahindra Manulife Ultra Short Duration Fund-Reg(G),2025-02-28T00:00:00.000Z,204.72,Debt : Ultra Short Duration,43845
PGIM India Ultra Short Duration Fund(G),2025-02-28T00:00:00.000Z,204.13,Debt : Ultra Short Duration,5925
Mirae Asset Nifty MidSmallcap400 Momentum Quality 100 ETF FoF-Reg(G),2025-01-31T00:00:00.000Z,204.11,FoFs : Domestic,48822
UTI Gold ETF FoF-Reg(G),2025-02-28T00:00:00.000Z,203.67,Gold : MFs,47003
Kotak Nifty IT ETF,2025-01-31T00:00:00.000Z,198.8,Equity : ETFs,45377
SBI FMP-73-1226D-Reg(G),2025-02-28T00:00:00.000Z,198.44,Debt : FTP/FMP,47260
HSBC CRISIL IBX Gilt June 2027 Index Fund-Reg(G),2025-02-28T00:00:00.000Z,197.88,Debt : Medium Duration,47676
HDFC Nifty SDL Oct 2026 Index Fund-Reg(G),2025-02-28T00:00:00.000Z,196.41,Debt : Medium Duration,46867
ITI Ultra Short Duration Fund-Reg(G),2025-02-28T00:00:00.000Z,195.73,Debt : Ultra Short Duration,45498
Mirae Asset Nifty 1D Rate Liquid ETF(G),2025-02-28T00:00:00.000Z,195.02,Debt : ETFs,49344
Franklin India Debt Hybrid Fund(G),2025-02-28T00:00:00.000Z,194.87,Hybrid : Debt Oriented (Conservative),1018
Bajaj Finserv Nifty 50 ETF,2025-01-31T00:00:00.000Z,193.85,Equity : ETFs,48461
HDFC Charity Fund for Cancer Cure-Reg(50% IDCW Donation Option),2025-02-28T00:00:00.000Z,193.43,Debt : FTP/FMP,46200
LIC MF Medium to Long Duration Fund-Reg(G),2025-02-28T00:00:00.000Z,192.7,Debt : Medium to Long Duration,2087
Aditya Birla SL Intl. Equity Fund(G),2025-01-31T00:00:00.000Z,192.4,Equity : International,460
SBI FMP-68-1302D-Reg(G),2025-02-28T00:00:00.000Z,190.76,Debt : FTP/FMP,46919
Samco Multi Asset Allocation Fund-Reg(G),2025-01-31T00:00:00.000Z,190.76,Hybrid : Multi Asset Allocation,49316
DSP Credit Risk Fund-Reg(G),2025-01-31T00:00:00.000Z,189.7,Debt : Credit Risk,685
Shriram Multi Sector Rotation Fund-Reg(G),2025-01-31T00:00:00.000Z,189.65,Equity : Thematic,49112
Union Money Market Fund-Reg(G),2025-02-28T00:00:00.000Z,188.75,Debt : Money Market,45360
Franklin India Arbitrage Fund-Reg(G),2025-01-31T00:00:00.000Z,188.46,Hybrid : Arbitrage,49339
Aditya Birla SL Silver ETF FOF-Reg(G),2025-01-31T00:00:00.000Z,188.41,FoFs : Domestic,46225
Bajaj Finserv Nifty Bank ETF,2025-01-31T00:00:00.000Z,188.08,Equity : ETFs,48462
Aditya Birla SL Asset Allocator FoF(G),2025-01-31T00:00:00.000Z,187.38,FoFs : Domestic,2279
Union Overnight Fund-Reg(G),2025-02-28T00:00:00.000Z,187.37,Debt : Overnight,43213
Bandhan Long Duration Fund-Reg(G),2025-02-28T00:00:00.000Z,186.28,Debt : Long Duration,48582
Nippon India ETF Nifty 5 yr Benchmark G-Sec,2025-02-28T00:00:00.000Z,185.87,Debt : ETFs,45428
Shriram Overnight Fund-Reg(G),2025-02-28T00:00:00.000Z,185.7,Debt : Overnight,46777
Axis NASDAQ 100 FoF-Reg(G),2025-01-31T00:00:00.000Z,185.11,FoFs : Overseas,47017
Aditya Birla SL US Treasury 3-10 year Bond ETFs FoF-Reg(G),2025-01-31T00:00:00.000Z,183.9,Debt : ETFs,48284
Bank of India Bluechip Fund-Reg(G),2025-01-31T00:00:00.000Z,183.87,Equity : Large Cap,45571
DSP Nifty Smallcap250 Quality 50 Index Fund-Reg(G),2025-01-31T00:00:00.000Z,183.65,Equity : Index Funds,48377
TRUSTMF Overnight Fund-Reg(G),2025-02-28T00:00:00.000Z,182.33,Debt : Overnight,45719
UTI BSE Sensex Index Fund-Reg(G),2025-02-28T00:00:00.000Z,181.62,Equity : Index Funds,46317
DSP FMP 270-1144D-Reg(G),2025-01-31T00:00:00.000Z,181.5,Debt : FTP/FMP,47634
ICICI Pru Nifty50 Value 20 ETF,2025-01-31T00:00:00.000Z,180.89,Equity : ETFs,33839
ICICI Pru Nifty LargeMidcap 250 Index Fund-Reg(G),2025-01-31T00:00:00.000Z,180.19,Equity : Index Funds,48643
JM ELSS Tax Saver Fund(G),2025-01-31T00:00:00.000Z,180.14,Equity : Tax Saving (ELSS),4198
Tata Nifty G-Sec Dec 2029 Index Fund-Reg(G),2025-02-28T00:00:00.000Z,179.81,Debt : Medium to Long Duration,47405
UTI Nifty SDL Plus AAA PSU Bond Apr 2026 75:25 Index Fund-Reg(G),2025-02-28T00:00:00.000Z,179.14,Debt : Medium Duration,47587
UTI FTIF-XXXV-II(1223D)(G),2025-02-28T00:00:00.000Z,178.68,Debt : FTP/FMP,47273
Baroda BNP Paribas Dynamic Bond Fund(G),2025-02-28T00:00:00.000Z,178.18,Debt : Dynamic Bond,116
Tata Nifty200 Alpha 30 Index Fund-Reg(G),2025-01-31T00:00:00.000Z,177.89,Equity : Index Funds,49080
UTI Nifty Private Bank Index Fund-Reg(G),2025-02-28T00:00:00.000Z,177.68,Equity : Index Funds,49146
Mirae Asset Nifty200 Alpha 30 ETF FoF-Reg(G),2025-01-31T00:00:00.000Z,177.01,FoFs : Domestic,48937
PGIM India Money Market Fund-Reg(G),2025-02-28T00:00:00.000Z,176.78,Debt : Money Market,34742
Baroda BNP Paribas Credit Risk Fund-Reg(G),2025-02-28T00:00:00.000Z,175.93,Debt : Credit Risk,25569
Mirae Asset Nifty Smallcap 250 Momentum Quality 100 ETF FoF-Reg(G),2025-01-31T00:00:00.000Z,174.07,FoFs : Domestic,48497
ICICI Pru Passive Strategy Fund(FOF)(G),2025-01-31T00:00:00.000Z,173.27,FoFs : Domestic,1698
Nippon India FHF-XLIII-5-2315D(G),2025-02-28T00:00:00.000Z,172.39,Debt : FTP/FMP,46433
Edelweiss Government Securities Fund-Reg(G),2025-02-28T00:00:00.000Z,171.29,Debt : Gilt,21922
SBI Retirement Benefit Fund-Conservative Plan-Reg(G),2025-02-28T00:00:00.000Z,171.23,Hybrid : Solution Oriented,30401
Quant Overnight Fund-Reg(G),2025-02-28T00:00:00.000Z,171.19,Debt : Overnight,47327
Bandhan Retirement Fund-Reg(G),2025-01-31T00:00:00.000Z,170.96,Hybrid : Solution Oriented,48226
Bank of India Money Market Fund-Reg(G),2025-02-28T00:00:00.000Z,170.14,Debt : Money Market,49468
Nippon India ETF Nifty Infrastructure BeES,2025-01-31T00:00:00.000Z,169.39,Equity : ETFs,12859
Mirae Asset Nifty EV and New Age Automotive ETF,2025-01-31T00:00:00.000Z,168.75,Equity : ETFs,48935
Tata Retirement Sav Fund - Cons Plan(G),2025-02-28T00:00:00.000Z,168.71,Hybrid : Solution Oriented,15378
UTI Silver ETF,2025-02-28T00:00:00.000Z,168.32,Gold : ETFs,46881
WOC Arbitrage Fund-Reg(G),2025-01-31T00:00:00.000Z,167.81,Hybrid : Arbitrage,48900
UTI Gilt Fund with 10 year Constant Duration-Reg(G),2025-02-28T00:00:00.000Z,167.78,Debt : Gilt (10 Yr Constant Duration),40967
Samco Special Opportunities Fund-Reg(G),2025-01-31T00:00:00.000Z,167.24,Equity : Thematic,48744
Tata Nifty India Digital ETF,2025-01-31T00:00:00.000Z,165.99,Equity : ETFs,45944
Axis Floater Fund-Reg(G),2025-02-28T00:00:00.000Z,165.87,Debt : Floater,45632
Edelweiss Nifty500 Multicap Momentum Quality 50 Index Fund-Reg(G),2025-01-31T00:00:00.000Z,165.68,Equity : Index Funds,49278
Aditya Birla SL Nifty Next 50 Index Fund-Reg(G),2025-01-31T00:00:00.000Z,164.97,Equity : Index Funds,46360
HDFC NIFTY G-Sec Apr 2029 Index Fund-Reg(G),2025-02-28T00:00:00.000Z,164.77,Debt : Medium to Long Duration,47712
Aditya Birla SL CRISIL IBX 60:40 SDL + AAA PSU - Apr 2025 Index Fund-Reg(G),2025-02-28T00:00:00.000Z,164.44,Debt : Medium Duration,46226
DSP Regular Savings Fund-Reg(G),2025-01-31T00:00:00.000Z,164.3,Hybrid : Debt Oriented (Conservative),719
Axis Silver ETF,2025-01-31T00:00:00.000Z,164.28,Gold : ETFs,46369
Edelweiss US Value Equity Offshore Fund-Reg(G),2025-01-31T00:00:00.000Z,163.95,FoFs : Overseas,21920
SBI FMP-76-1221D-Reg(G),2025-02-28T00:00:00.000Z,163.39,Debt : FTP/FMP,47541
Invesco India Medium Duration Fund-Reg(G),2025-02-28T00:00:00.000Z,163.38,Debt : Medium Duration,45607
HDFC FMP-Sr 46-1158D-July 2022-Reg(G),2025-02-28T00:00:00.000Z,163.29,Debt : FTP/FMP,46672
Mirae Asset Nifty IT ETF,2025-01-31T00:00:00.000Z,163.12,Equity : ETFs,48250
Quantum Gold Saving Fund-Reg(G),2025-01-31T00:00:00.000Z,161.32,Gold : MFs,19961
Aditya Birla SL CRISIL IBX SDL Jun 2032 Index Fund-Reg(G),2025-02-28T00:00:00.000Z,160.72,Debt : Long Duration,47592
Tata Gold ETF FoF-Reg(G),2025-01-31T00:00:00.000Z,160.63,FoFs : Domestic,48437
Kotak Nifty 100 Low Volatility 30 ETF,2025-01-31T00:00:00.000Z,160.59,Equity : ETFs,45688
SBI Nifty Private Bank ETF,2025-01-31T00:00:00.000Z,160.56,Equity : ETFs,36351
ICICI Pru Nifty Oil & Gas ETF,2025-01-31T00:00:00.000Z,159.73,Equity : ETFs,33836
Zerodha Gold ETF,2025-01-31T00:00:00.000Z,159.48,Gold : ETFs,48500
Groww Liquid Fund-Reg(G),2025-02-28T00:00:00.000Z,157.97,Debt : Liquid,15502
Bank of India Ultra Short Duration Fund-Reg(G),2025-02-28T00:00:00.000Z,157.4,Debt : Ultra Short Duration,5842
WOC Balanced Hybrid Fund-Reg(G),2025-01-31T00:00:00.000Z,157.08,Hybrid : Dynamic Asset Allocation,48213
SBI FMP-74-1243D-Reg(G),2025-02-28T00:00:00.000Z,156.06,Debt : FTP/FMP,47381
Mahindra Manulife Overnight Fund-Reg(G),2025-02-28T00:00:00.000Z,155.99,Debt : Overnight,42560
Edelweiss Nifty 100 Quality 30 Index Fund-Reg(G),2025-01-31T00:00:00.000Z,154.74,Equity : Index Funds,45961
HDFC Retirement Savings Fund-Hybrid-Debt Plan-Reg(G),2025-02-28T00:00:00.000Z,154.7,Hybrid : Solution Oriented,24807
Edelweiss CRISIL IBX 50:50 Gilt Plus SDL Sep 2028 Index Fund-Reg(G),2025-02-28T00:00:00.000Z,153.96,Debt : Medium to Long Duration,47075
HDFC FMP-Sr 47-2638D-Feb 2023-Reg(G),2025-02-28T00:00:00.000Z,153.7,Debt : FTP/FMP,47642
Bandhan Nifty 100 Index Fund-Reg(G),2025-01-31T00:00:00.000Z,153.46,Equity : Index Funds,46119
Edelweiss MSCI India Domestic & World Healthcare 45 Index Fund-Reg(G),2025-01-31T00:00:00.000Z,152.78,Equity : Index Funds,45117
ICICI Pru India Equity (FOF)(G),2025-01-31T00:00:00.000Z,152.73,FoFs : Domestic,44626
Edelweiss CRISIL IBX 50:50 Gilt Plus SDL Short Duration Index Fund-Reg(G),2025-02-28T00:00:00.000Z,152.59,Debt : Short Duration,47430
Bandhan CRISIL IBX 90:10 SDL Plus Gilt - Sep 2027 Index Fund-Reg(G),2025-02-28T00:00:00.000Z,152.21,Debt : Gilt,46212
Nippon India Nifty IT Index Fund-Reg(G),2025-01-31T00:00:00.000Z,152.16,Equity : Index Funds,48568
Union Retirement Fund-Reg(G),2025-01-31T00:00:00.000Z,151.86,Hybrid : Solution Oriented,45735
HSBC Dynamic Bond Fund-Reg(G),2025-02-28T00:00:00.000Z,151.54,Debt : Dynamic Bond,925
Franklin India G-Sec Fund(G),2025-02-28T00:00:00.000Z,151.23,Debt : Gilt,3373
Aditya Birla SL Long Duration Fund-Reg(G),2025-02-28T00:00:00.000Z,150.81,Debt : Long Duration,46711
Nippon India Retirement Fund-Income Generation(G),2025-02-28T00:00:00.000Z,150.05,Hybrid : Solution Oriented,17166
Kotak Long Duration Fund-Reg(G),2025-02-28T00:00:00.000Z,148.89,Debt : Long Duration,48538
Helios Overnight Fund-Reg(G),2025-02-28T00:00:00.000Z,148.3,Debt : Overnight,48295
Helios Financial Services Fund-Reg(G),2025-01-31T00:00:00.000Z,147.03,Equity : Sectoral - Financial Services,48897
Shriram Multi Asset Allocation Fund-Reg(G),2025-01-31T00:00:00.000Z,146.26,Hybrid : Multi Asset Allocation,48029
HSBC Conservative Hybrid Fund(G),2025-02-28T00:00:00.000Z,145.73,Hybrid : Debt Oriented (Conservative),1458
Motilal Oswal Quant Fund-Reg(G),2025-01-31T00:00:00.000Z,142.94,Equity : Thematic,48806
Bandhan US Treasury Bond 0-1 year FoF-Reg(G),2025-01-31T00:00:00.000Z,142.64,FoFs : Overseas,47724
Axis Income Advantage FOFs-Reg(G),2025-02-28T00:00:00.000Z,142.63,FoFs : Domestic,43840
SBI FMP-47-1434D-Reg(G),2025-02-28T00:00:00.000Z,141.96,Debt : FTP/FMP,45660
Tata Floating Rate Fund-Reg(G),2025-02-28T00:00:00.000Z,140.98,Debt : Floater,45375
Axis NIFTY IT Index Fund-Reg(G),2025-01-31T00:00:00.000Z,140.82,Equity : Index Funds,47983
Invesco India Credit Risk Fund(G),2025-02-28T00:00:00.000Z,140.32,Debt : Credit Risk,21522
Tata Silver ETF,2025-01-31T00:00:00.000Z,140.15,Gold : ETFs,48436
Axis CRISIL-IBX AAA Bond Financial Services - Sep 2027 Index Fund-Reg(G),2025-02-28T00:00:00.000Z,139.24,Debt : Medium to Long Duration,49254
Nippon India CRISIL-IBX AAA Financial Services - Jan 2028 Index Fund-Reg(G),2025-02-28T00:00:00.000Z,139.05,Debt : Medium to Long Duration,49221
Motilal Oswal Nifty India Defence ETF,2025-01-31T00:00:00.000Z,135.75,Equity : ETFs,49103
Canara Rob Gilt Fund-Reg(G),2025-02-28T00:00:00.000Z,135.35,Debt : Gilt,538
ICICI Pru Nifty Auto Index Fund-Reg(G),2025-01-31T00:00:00.000Z,135.28,Equity : Sectoral - Auto,45995
SBI FMP-52-1848D-Reg(G),2025-02-28T00:00:00.000Z,135.03,Debt : FTP/FMP,45915
Union Equity Savings Fund-Reg(G),2025-01-31T00:00:00.000Z,134.86,Hybrid : Equity Oriented,40627
Edelweiss Nifty 50 Index Fund-Reg(G),2025-01-31T00:00:00.000Z,133.9,Equity : Index Funds,45957
Nippon India ETF Nifty India Consumption,2025-01-31T00:00:00.000Z,133.54,Equity : ETFs,17478
Quantum Dynamic Bond Fund-Reg(G),2025-02-28T00:00:00.000Z,132.47,Debt : Dynamic Bond,37428
Bank of India Balanced Advantage Fund-Reg(G),2025-01-31T00:00:00.000Z,132.36,Hybrid : Dynamic Asset Allocation,21917
Motilal Oswal BSE Enhanced Value ETF,2025-01-31T00:00:00.000Z,132.13,Equity : ETFs,46740
Edelweiss CRISIL IBX AAA Financial Services Bond - Jan 2028 Index Fund-Reg(G),2025-02-28T00:00:00.000Z,131.8,Debt : Medium to Long Duration,49393
LIC MF Value Fund-Reg(G),2025-02-28T00:00:00.000Z,131.31,Equity : Value / Contra,39956
ICICI Pru FMP-88-1226D-F(G),2025-02-28T00:00:00.000Z,131.16,Debt : FTP/FMP,47232
Nippon India Nifty Bank Index Fund-Reg(G),2025-01-31T00:00:00.000Z,130.97,Equity : Index Funds,48148
SBI Nifty 200 Quality 30 ETF,2025-01-31T00:00:00.000Z,130.07,Equity : ETFs,41015
Tata BSE Select Business Groups Index Fund-Reg(G),2025-01-31T00:00:00.000Z,129.74,Equity : Index Funds,49326
SBI FMP-46-1850D-Reg(G),2025-02-28T00:00:00.000Z,129.69,Debt : FTP/FMP,45620
Shriram Flexi Cap Fund-Reg(G),2025-01-31T00:00:00.000Z,129.67,Equity : Flexi Cap,38781
DSP World Mining FoF-Reg(G),2025-01-31T00:00:00.000Z,128.51,FoFs : Overseas,8359
ICICI Pru Nifty Healthcare ETF,2025-01-31T00:00:00.000Z,127.34,Equity : ETFs,45383
Kotak FMP-310-1131D(G),2025-02-28T00:00:00.000Z,127.16,Debt : FTP/FMP,47871
JM Overnight Fund-Reg(G),2025-02-28T00:00:00.000Z,126.78,Debt : Overnight,44156
Tata Nifty MidSmall Healthcare Index Fund-Reg(G),2025-01-31T00:00:00.000Z,126.29,Equity : Index Funds,48764
