s_name,aumdate,aumtotal,classification,schemecode
Tata Retirement Sav Fund - Mod Plan(G),2025-01-31T00:00:00.000Z,2061.76,Hybrid : Solution Oriented,15379
LIC MF Low Duration Fund(G),2025-02-28T00:00:00.000Z,2058.92,Debt : Low Duration,2149
Quant Absolute Fund(G),2025-01-31T00:00:00.000Z,2056.4,Hybrid : Equity Oriented,865
Baroda BNP Paribas Mid Cap Fund-Reg(G),2025-01-31T00:00:00.000Z,2046.02,Equity : Mid Cap,172
Motilal Oswal Nifty 500 Index Fund-Reg(G),2025-01-31T00:00:00.000Z,2039.81,Equity : Index Funds,43809
Franklin India Equity Hybrid Fund(G),2025-01-31T00:00:00.000Z,2031.12,Hybrid : Equity Oriented,999
Mirae Asset NYSE FANG+ETF FoF-Reg(G),2025-01-31T00:00:00.000Z,2010.37,FoFs : Overseas,45496
Sundaram Ultra Short Duration Fund(G),2025-02-28T00:00:00.000Z,2004.57,Debt : Ultra Short Duration,4186
Aditya Birla SL G-Sec Fund(G),2025-02-28T00:00:00.000Z,1992.37,Debt : Gilt,399
Bank of India Flexi Cap Fund-Reg(G),2025-01-31T00:00:00.000Z,1991.04,Equity : Flexi Cap,44987
Axis Strategic Bond Fund-Reg(G),2025-02-28T00:00:00.000Z,1986.75,Debt : Medium Duration,8136
Motilal Oswal Nifty Midcap 150 Index Fund-Reg(G),2025-01-31T00:00:00.000Z,1981.68,Equity : Index Funds,43810
Sundaram Flexi Cap Fund-Reg(G),2025-01-31T00:00:00.000Z,1979.11,Equity : Flexi Cap,46622
Tata Retirement Sav Fund - Prog Plan(G),2025-01-31T00:00:00.000Z,1979.06,Hybrid : Solution Oriented,15380
NJ Flexi Cap Fund-Reg(G),2025-01-31T00:00:00.000Z,1977.83,Equity : Flexi Cap,48135
Franklin India Technology Fund(G),2025-01-31T00:00:00.000Z,1959.75,Equity : Sectoral - Technology,961
DSP Nifty 50 Equal Weight Index Fund-Reg(G),2025-01-31T00:00:00.000Z,1945.75,Equity : Index Funds,38179
Nippon India ETF Nifty Midcap 150,2025-01-31T00:00:00.000Z,1930.61,Equity : ETFs,40028
UTI Infrastructure Fund-Reg(G),2025-02-28T00:00:00.000Z,1921.26,Equity : Sectoral - Infrastructure,3582
Nippon India Nifty Smallcap 250 Index Fund-Reg(G),2025-01-31T00:00:00.000Z,1902.6,Equity : Index Funds,44504
SBI Magnum Income Fund-Reg(G),2025-02-28T00:00:00.000Z,1899.32,Debt : Medium to Long Duration,2776
DSP Multicap Fund-Reg(G),2025-01-31T00:00:00.000Z,1899.28,Equity : Multi Cap,48040
Quant Momentum Fund-Reg(G),2025-01-31T00:00:00.000Z,1890.28,Equity : Thematic,48334
Mahindra Manulife Focused Fund-Reg(G),2025-01-31T00:00:00.000Z,1883.51,Equity : Flexi Cap,45141
HSBC CRISIL IBX 50:50 Gilt Plus SDL Apr 2028 Index Fund-Reg(G),2025-02-28T00:00:00.000Z,1883.18,Debt : Medium to Long Duration,46506
LIC MF Banking & PSU Fund-Reg(G),2025-02-28T00:00:00.000Z,1881.91,Debt : Banking & PSU,2139
Kotak Medium Term Fund(G),2025-02-28T00:00:00.000Z,1879.61,Debt : Medium Duration,22514
Motilal Oswal Nifty Microcap 250 Index Fund-Reg(G),2025-01-31T00:00:00.000Z,1865.24,Equity : Index Funds,41176
ICICI Pru FMCG Fund(G),2025-01-31T00:00:00.000Z,1849.81,Equity : Thematic - Consumption,1517
SBI Magnum Constant Maturity Fund-Reg(G),2025-02-28T00:00:00.000Z,1843.12,Debt : Gilt (10 Yr Constant Duration),2756
Bandhan Multi Asset Allocation Fund-Reg(G),2025-01-31T00:00:00.000Z,1833.99,Hybrid : Multi Asset Allocation,48252
HSBC Large Cap Fund(G),2025-01-31T00:00:00.000Z,1827.54,Equity : Large Cap,1348
DSP Strategic Bond Fund-Reg(G),2025-01-31T00:00:00.000Z,1813.98,Debt : Dynamic Bond,742
ICICI Pru NASDAQ 100 Index Fund(G),2025-01-31T00:00:00.000Z,1810.55,Equity : International,45683
Mirae Asset Multi Asset Allocation Fund-Reg(G),2025-01-31T00:00:00.000Z,1799.77,Hybrid : Multi Asset Allocation,48465
Quant Value Fund-Reg(G),2025-01-31T00:00:00.000Z,1775.98,Equity : Value / Contra,46064
ICICI Pru Nifty SDL Sep 2027 Index Fund-Reg(G),2025-02-28T00:00:00.000Z,1763.31,Debt : Medium to Long Duration,46528
Baroda BNP Paribas Gilt Fund-Reg(G),2025-02-28T00:00:00.000Z,1762.07,Debt : Gilt,497
ICICI Pru BSE Sensex Index Fund(G),2025-01-31T00:00:00.000Z,1751.62,Equity : Index Funds,36396
Mirae Asset Balanced Advantage Fund-Reg(G),2025-01-31T00:00:00.000Z,1750.9,Hybrid : Dynamic Asset Allocation,46224
HSBC India Export Opportunities Fund-Reg(G),2025-01-31T00:00:00.000Z,1747.25,Equity : Thematic,49091
Bank of India Liquid Fund-Reg(G),2025-02-28T00:00:00.000Z,1740.74,Debt : Liquid,5836
Tata Focused Equity Fund-Reg(G),2025-01-31T00:00:00.000Z,1739.42,Equity : Multi Cap,44148
Aditya Birla SL Dynamic Bond Fund-Reg(G),2025-02-28T00:00:00.000Z,1737.54,Debt : Dynamic Bond,302
Mirae Asset Banking and Financial Services Fund-Reg(G),2025-01-31T00:00:00.000Z,1735.72,Equity : Sectoral - Financial Services,45174
Bandhan Large Cap Fund-Reg(G),2025-01-31T00:00:00.000Z,1726.24,Equity : Large Cap,2860
Edelweiss Business Cycle Fund-Reg(G),2025-01-31T00:00:00.000Z,1719.83,Equity : Thematic,48499
Bandhan Focused Equity Fund-Reg(G),2025-01-31T00:00:00.000Z,1717.34,Equity : Multi Cap,2896
DSP Gilt Fund-Reg(G),2025-01-31T00:00:00.000Z,1715.91,Debt : Gilt,693
Aditya Birla SL Business Cycle Fund-Reg(G),2025-01-31T00:00:00.000Z,1712.96,Equity : Thematic,45733
UTI Gold ETF,2025-02-28T00:00:00.000Z,1712.76,Gold : ETFs,3564
Bajaj Finserv Large and Mid Cap Fund-Reg(G),2025-01-31T00:00:00.000Z,1703.73,Equity : Large & Mid Cap,48063
HDFC NIFTY Next 50 Index Fund-Reg(G),2025-01-31T00:00:00.000Z,1696.59,Equity : Index Funds,45985
Aditya Birla SL CRISIL IBX 60:40 SDL + AAA PSU - Apr 2027 Index Fund-Reg(G),2025-02-28T00:00:00.000Z,1684.62,Debt : Medium to Long Duration,46227
Motilal Oswal Large Cap Fund-Reg(G),2025-01-31T00:00:00.000Z,1684.03,Equity : Large Cap,48488
Axis Nifty 100 Index Fund-Reg(G),2025-01-31T00:00:00.000Z,1680.51,Equity : Index Funds,43785
Canara Rob Consumer Trends Fund-Reg(G),2025-01-31T00:00:00.000Z,1679.31,Equity : Thematic - Consumption,7876
ICICI Pru MNC Fund(G),2025-01-31T00:00:00.000Z,1677.7,Equity : Thematic - MNC,41965
Tata India Innovation Fund-Reg(G),2025-01-31T00:00:00.000Z,1676.82,Equity : Thematic,49235
Edelweiss Gr China Equity Off-Shore Fund-Reg(G),2025-01-31T00:00:00.000Z,1670.86,FoFs : Overseas,7869
Bandhan Nifty 50 Index Fund-Reg(G),2025-01-31T00:00:00.000Z,1666.32,Equity : Index Funds,9078
ICICI Pru Nifty Alpha Low - Volatility 30 ETF,2025-01-31T00:00:00.000Z,1664.68,Equity : ETFs,45038
Motilal Oswal Business Cycle Fund-Reg(G),2025-01-31T00:00:00.000Z,1645.05,Equity : Thematic,48959
Bandhan Infrastructure Fund-Reg(G),2025-01-31T00:00:00.000Z,1640.82,Equity : Sectoral - Infrastructure,12459
Kotak Multi Asset Allocator FoF-Dynamic(G),2025-01-31T00:00:00.000Z,1634.44,FoFs : Domestic,1981
HSBC Focused Fund-Reg(G),2025-01-31T00:00:00.000Z,1627.93,Equity : Multi Cap,44739
Nippon India Nifty Midcap 150 Index Fund-Reg(G),2025-01-31T00:00:00.000Z,1625.48,Equity : Index Funds,44503
Bandhan Business Cycle Fund-Reg(G),2025-01-31T00:00:00.000Z,1623.28,Equity : Thematic,49014
Parag Parikh Dynamic Asset Allocation Fund-Reg(G),2025-01-31T00:00:00.000Z,1610.19,Hybrid : Dynamic Asset Allocation,48512
UTI Conservative Hybrid Fund-Reg(G),2025-02-28T00:00:00.000Z,1609.65,Hybrid : Debt Oriented (Conservative),3631
Quant Liquid Plan(G),2025-02-28T00:00:00.000Z,1602.88,Debt : Liquid,883
Mirae Asset Ultra Short Duration Fund-Reg(G),2025-02-28T00:00:00.000Z,1601.77,Debt : Ultra Short Duration,45100
Canara Rob Manufacturing Fund-Reg(G),2025-01-31T00:00:00.000Z,1593.33,Equity : Thematic,48606
ICICI Pru Regular Gold Savings Fund(FOF)(G),2025-01-31T00:00:00.000Z,1575.68,Gold : MFs,14885
HDFC Pharma and Healthcare Fund-Reg(G),2025-01-31T00:00:00.000Z,1568.02,Equity : Sectoral - Pharma,48220
Sundaram Business Cycle Fund-Reg(G),2025-01-31T00:00:00.000Z,1557.1,Equity : Thematic,35200
Bank of India Small Cap Fund-Reg(G),2025-01-31T00:00:00.000Z,1555.78,Equity : Small Cap,41323
HDFC Retirement Savings Fund-Hybrid-Equity Plan-Reg(G),2025-01-31T00:00:00.000Z,1551.16,Hybrid : Solution Oriented,24805
Axis Aggressive Hybrid Fund-Reg(G),2025-01-31T00:00:00.000Z,1529.76,Hybrid : Equity Oriented,40568
Mahindra Manulife Aggressive Hybrid Fund-Reg(G),2025-01-31T00:00:00.000Z,1523.64,Hybrid : Equity Oriented,43978
Sundaram Consumption Fund(G),2025-01-31T00:00:00.000Z,1518.44,Equity : Thematic - Consumption,3050
Motilal Oswal Focused Fund-Reg(G),2025-01-31T00:00:00.000Z,1503.81,Equity : Large Cap,21769
Invesco India Low Duration Fund(G),2025-02-28T00:00:00.000Z,1501.78,Debt : Low Duration,2253
Invesco India Infrastructure Fund(G),2025-01-31T00:00:00.000Z,1496.41,Equity : Sectoral - Infrastructure,2237
Sundaram Balanced Advantage Fund(G),2025-01-31T00:00:00.000Z,1495.91,Hybrid : Dynamic Asset Allocation,13366
WOC Large & Mid Cap Fund-Reg(G),2025-01-31T00:00:00.000Z,1493.62,Equity : Large & Mid Cap,48333
Union Small Cap Fund-Reg(G),2025-01-31T00:00:00.000Z,1492.65,Equity : Small Cap,15717
Bandhan Midcap Fund-Reg(G),2025-01-31T00:00:00.000Z,1490.55,Equity : Mid Cap,45868
HSBC Balanced Advantage Fund-Reg(G),2025-01-31T00:00:00.000Z,1484.41,Hybrid : Dynamic Asset Allocation,13019
WOC Multi Cap Fund-Reg(G),2025-01-31T00:00:00.000Z,1480.98,Equity : Multi Cap,48199
HSBC Consumption Fund-Reg(G),2025-01-31T00:00:00.000Z,1480.05,Equity : Thematic - Consumption,48124
SBI Retirement Benefit Fund-Aggressive Hybrid Plan-Reg(G),2025-01-31T00:00:00.000Z,1479.6,Hybrid : Solution Oriented,30399
Edelweiss Multi Asset Allocation Fund-Reg(G),2025-01-31T00:00:00.000Z,1478.6,Hybrid : Multi Asset Allocation,47994
ICICI Pru ESG Exclusionary Strategy Fund(G),2025-01-31T00:00:00.000Z,1470.84,Equity : Thematic,44087
Bandhan Bond Fund - Medium Term Plan-Reg(G),2025-02-28T00:00:00.000Z,1469.57,Debt : Medium Duration,1084
Sundaram Diversified Equity(G),2025-01-31T00:00:00.000Z,1467.94,Equity : Tax Saving (ELSS),3072
Aditya Birla SL Dividend Yield Fund(G),2025-01-31T00:00:00.000Z,1461.33,Equity : Thematic - Dividend Yield,301
PGIM India Global Equity Opp Fund(G),2025-01-31T00:00:00.000Z,1455.86,FoFs : Overseas,8812
SBI Nifty Next 50 Index Fund-Reg(G),2025-01-31T00:00:00.000Z,1447.87,Equity : Index Funds,45529
Baroda BNP Paribas Large & Mid Cap Fund-Reg(G),2025-01-31T00:00:00.000Z,1445.39,Equity : Large & Mid Cap,44222
HDFC Technology Fund-Reg(G),2025-01-31T00:00:00.000Z,1439.14,Equity : Sectoral - Technology,48189
UTI Floater Fund-Reg(G),2025-02-28T00:00:00.000Z,1438.82,Debt : Floater,39630
Aditya Birla SL Conglomerate Fund-Reg(G),2025-01-31T00:00:00.000Z,1434.99,Equity : Thematic,49209
Aditya Birla SL Transportation and Logistics Fund-Reg(G),2025-01-31T00:00:00.000Z,1430.2,Equity : Sectoral - Auto,48291
PGIM India Small Cap Fund-Reg(G),2025-01-31T00:00:00.000Z,1413.28,Equity : Small Cap,45616
Bandhan Nifty100 Low Volatility 30 Index Fund-Reg(G),2025-01-31T00:00:00.000Z,1413.0,Equity : Index Funds,46607
ICICI Pru Nifty 100 Low Volatility 30 ETF FOF(G),2025-01-31T00:00:00.000Z,1409.78,Equity : ETFs,45443
Baroda BNP Paribas Ultra Short Duration Fund-Reg(G),2025-02-28T00:00:00.000Z,1407.51,Debt : Ultra Short Duration,39448
Baroda BNP Paribas India Consumption Fund-Reg(G),2025-01-31T00:00:00.000Z,1404.66,Equity : Thematic - Consumption,17168
Mahindra Manulife Flexi Cap Fund-Reg(G),2025-01-31T00:00:00.000Z,1399.25,Equity : Flexi Cap,45670
HDFC NIFTY50 Equal Weight Index Fund-Reg(G),2025-01-31T00:00:00.000Z,1397.44,Equity : Index Funds,45708
Kotak Nifty PSU Bank ETF,2025-01-31T00:00:00.000Z,1393.79,Equity : ETFs,3723
Sundaram Fin Serv Opp Fund(G),2025-01-31T00:00:00.000Z,1385.95,Equity : Sectoral - Financial Services,5144
ICICI Pru Exports & Services Fund(G),2025-01-31T00:00:00.000Z,1385.43,Equity : Thematic,1680
Quant Business Cycle Fund-Reg(G),2025-01-31T00:00:00.000Z,1385.4,Equity : Thematic,47951
Union Balanced Advantage Fund-Reg(G),2025-01-31T00:00:00.000Z,1382.66,Hybrid : Dynamic Asset Allocation,38378
Aditya Birla SL Regular Savings Fund(G),2025-02-28T00:00:00.000Z,1373.98,Hybrid : Debt Oriented (Conservative),422
Canara Rob Balanced Advantage Fund-Reg(G),2025-02-28T00:00:00.000Z,1372.63,Hybrid : Dynamic Asset Allocation,48747
Mirae Asset Equity Savings Fund-Reg(G),2025-01-31T00:00:00.000Z,1370.74,Hybrid : Equity Oriented,39401
Axis Dynamic Bond Fund-Reg(G),2025-02-28T00:00:00.000Z,1360.23,Debt : Dynamic Bond,12380
360 ONE Flexicap Fund-Reg(G),2025-01-31T00:00:00.000Z,1357.04,Equity : Flexi Cap,47567
Bandhan Innovation Fund-Reg(G),2025-01-31T00:00:00.000Z,1354.53,Equity : Thematic,48656
Baroda BNP Paribas Value Fund-Reg(G),2025-01-31T00:00:00.000Z,1352.64,Equity : Value / Contra,47940
HDFC Nifty G-Sec Dec 2026 Index Fund-Reg(G),2025-02-28T00:00:00.000Z,1343.35,Debt : Gilt,46871
Bajaj Finserv Large Cap Fund-Reg(G),2025-01-31T00:00:00.000Z,1342.49,Equity : Large Cap,48965
Invesco India Ultra Short Duration Fund(G),2025-02-28T00:00:00.000Z,1337.07,Debt : Ultra Short Duration,13460
DSP Nifty Top 10 Equal Weight Index Fund-Reg(G),2025-01-31T00:00:00.000Z,1330.79,Equity : Index Funds,49011
Bank of India ELSS Tax Saver-Reg(G),2025-01-31T00:00:00.000Z,1329.97,Equity : Tax Saving (ELSS),7516
WOC Balanced Advantage Fund-Reg(G),2025-01-31T00:00:00.000Z,1327.52,Hybrid : Dynamic Asset Allocation,46990
HDFC Developed World Indexes FoF-Reg(G),2025-01-31T00:00:00.000Z,1325.51,FoFs : Overseas,45884
Mahindra Manulife Liquid Fund-Reg(G),2025-02-28T00:00:00.000Z,1323.65,Debt : Liquid,35846
JM Midcap Fund-Reg(G),2025-01-31T00:00:00.000Z,1320.48,Equity : Mid Cap,47089
UTI Quant Fund-Reg(G),2025-02-28T00:00:00.000Z,1319.44,Equity : Thematic,49528
Axis Multi Asset Allocation Fund-Reg(G),2025-01-31T00:00:00.000Z,1316.16,Hybrid : Multi Asset Allocation,8583
Edelweiss Money Market Fund-Reg(G),2025-02-28T00:00:00.000Z,1314.05,Debt : Dynamic Bond,5437
ITI Multi-Cap Fund-Reg(G),2025-01-31T00:00:00.000Z,1312.94,Equity : Multi Cap,43408
Axis Gold ETF,2025-01-31T00:00:00.000Z,1303.5,Gold : ETFs,12461
Invesco India Largecap Fund(G),2025-01-31T00:00:00.000Z,1301.33,Equity : Large Cap,7870
Union Midcap Fund-Reg(G),2025-01-31T00:00:00.000Z,1301.2,Equity : Mid Cap,44313
Sundaram ELSS Tax Saver Fund-Reg(G),2025-01-31T00:00:00.000Z,1299.14,Equity : Tax Saving (ELSS),2433
WOC Multi Asset Allocation Fund-Reg(G),2025-01-31T00:00:00.000Z,1289.01,Hybrid : Multi Asset Allocation,47946
HDFC Housing Opp Fund-Reg(G),2025-01-31T00:00:00.000Z,1286.85,Equity : Sectoral - Infrastructure,38242
Baroda BNP Paribas Manufacturing Fund-Reg(G),2025-01-31T00:00:00.000Z,1283.86,Equity : Thematic,48904
LIC MF Large Cap Fund-Reg(G),2025-02-28T00:00:00.000Z,1283.83,Equity : Large Cap,2127
ICICI Pru Child Care Fund-Gift Plan,2025-01-31T00:00:00.000Z,1280.2,Hybrid : Solution Oriented,1489
Bajaj Finserv Balanced Advantage Fund-Reg(G),2025-01-31T00:00:00.000Z,1278.31,Hybrid : Dynamic Asset Allocation,48062
HDFC Transportation and Logistics Fund-Reg(G),2025-01-31T00:00:00.000Z,1278.31,Equity : Sectoral - Auto,48114
Quant Dynamic Asset Allocation Fund-Reg(G),2025-01-31T00:00:00.000Z,1274.13,Hybrid : Dynamic Asset Allocation,47895
Franklin India Dynamic Asset Allocation FOFs(G),2025-01-31T00:00:00.000Z,1270.93,FoFs : Domestic,1001
Axis Momentum Fund-Reg(G),2025-01-31T00:00:00.000Z,1263.46,Equity : Thematic,49376
LIC MF Multi Cap Fund-Reg(G),2025-02-28T00:00:00.000Z,1260.76,Equity : Multi Cap,46624
Baroda BNP Paribas Small Cap Fund-Reg(G),2025-01-31T00:00:00.000Z,1255.25,Equity : Small Cap,48146
Axis ESG Integration Strategy Fund-Reg(G),2025-01-31T00:00:00.000Z,1249.2,Equity : Thematic,44495
SBI Floating Rate Debt Fund-Reg(G),2025-02-28T00:00:00.000Z,1241.34,Debt : Floater,45111
Nippon India Nifty Alpha Low Volatility 30 Index Fund(G),2025-01-31T00:00:00.000Z,1235.29,Equity : Index Funds,46717
ICICI Pru Rural Opportunities Fund-Reg(G),2025-01-31T00:00:00.000Z,1232.77,Equity : Thematic,49521
Kotak Consumption Fund-Reg(G),2025-01-31T00:00:00.000Z,1231.06,Equity : Thematic - Consumption,47948
Invesco India PSU Equity Fund(G),2025-01-31T00:00:00.000Z,1229.51,Equity : Thematic,7996
Invesco India Gilt Fund(G),2025-02-28T00:00:00.000Z,1219.89,Debt : Gilt,4378
Baroda BNP Paribas Flexi Cap Fund-Reg(G),2025-01-31T00:00:00.000Z,1212.5,Equity : Flexi Cap,46699
Tata India Pharma & Healthcare Fund-Reg(G),2025-01-31T00:00:00.000Z,1211.73,Equity : Sectoral - Pharma,33729
ICICI Pru Nifty Next 50 ETF,2025-01-31T00:00:00.000Z,1211.16,Equity : ETFs,39950
SBI Nifty Smallcap 250 Index Fund-Reg(G),2025-01-31T00:00:00.000Z,1208.99,Equity : Index Funds,46937
ICICI Pru Long Term Bond Fund(G),2025-02-28T00:00:00.000Z,1207.05,Debt : Long Duration,1617
Parag Parikh Arbitrage Fund-Reg(G),2025-01-31T00:00:00.000Z,1204.44,Hybrid : Arbitrage,48215
ITI Flexi Cap Fund-Reg(G),2025-01-31T00:00:00.000Z,1200.6,Equity : Flexi Cap,45721
Mirae Asset Low Duration Fund-Reg Savings Plan(G),2025-02-28T00:00:00.000Z,1199.97,Debt : Low Duration,4609
DSP Natural Res & New Energy Fund-Reg(G),2025-01-31T00:00:00.000Z,1190.43,Equity : Sectoral - Energy / Power,4584
Axis Nifty AAA Bond Plus SDL Apr 2026 50:50 ETF,2025-02-28T00:00:00.000Z,1164.6,Debt : ETFs,45337
Axis Innovation Fund-Reg(G),2025-01-31T00:00:00.000Z,1157.43,Equity : Thematic,44315
Baroda BNP Paribas Aggressive Hybrid Fund-Reg(G),2025-01-31T00:00:00.000Z,1155.07,Hybrid : Equity Oriented,33800
Old Bridge Focused Equity Fund-Reg(G),2025-01-31T00:00:00.000Z,1153.42,Equity : Flexi Cap,48527
Quantum Long Term Equity Value Fund-Reg(G),2025-01-31T00:00:00.000Z,1150.05,Equity : Value / Contra,19759
Baroda BNP Paribas Multi Asset Fund-Reg(G),2025-01-31T00:00:00.000Z,1147.15,Hybrid : Multi Asset Allocation,46852
Baroda BNP Paribas Arbitrage Fund-Reg(G),2025-01-31T00:00:00.000Z,1145.91,Hybrid : Arbitrage,35820
Mahindra Manulife Business Cycle Fund-Reg(G),2025-01-31T00:00:00.000Z,1144.52,Equity : Thematic,48179
Invesco India Financial Services Fund(G),2025-01-31T00:00:00.000Z,1126.35,Equity : Sectoral - Financial Services,5348
SBI CRISIL IBX SDL Index - Sep 2027 Fund-Reg(G),2025-02-28T00:00:00.000Z,1116.15,Debt : Medium to Long Duration,46975
Aditya Birla SL Mfg. Equity Fund-Reg(G),2025-01-31T00:00:00.000Z,1112.11,Equity : Thematic - Consumption,30774
Tata NIFTY 50 Index Fund-Reg(G),2025-01-31T00:00:00.000Z,1110.68,Equity : Index Funds,3247
Bajaj Finserv Multi Asset Allocation Fund-Reg(G),2025-01-31T00:00:00.000Z,1110.43,Hybrid : Multi Asset Allocation,48748
ICICI Pru Passive Multi-Asset FoF(G),2025-01-31T00:00:00.000Z,1109.66,FoFs : Domestic,46182
Edelweiss Large Cap Fund-Reg(G),2025-01-31T00:00:00.000Z,1108.38,Equity : Large Cap,7785
UTI Banking and Financial Services Fund-Reg(G),2025-02-28T00:00:00.000Z,1106.91,Equity : Sectoral - Financial Services,3439
ITI Mid Cap Fund-Reg(G),2025-01-31T00:00:00.000Z,1095.38,Equity : Mid Cap,45314
Kotak Nifty 1D Rate Liquid ETF,2025-02-28T00:00:00.000Z,1090.28,Debt : Liquid,47545
360 ONE Liquid Fund-Reg(G),2025-02-28T00:00:00.000Z,1089.62,Debt : Liquid,15687
DSP World Gold FoF-Reg(G),2025-01-31T00:00:00.000Z,1089.01,FoFs : Overseas,755
Aditya Birla SL Infrastructure Fund(G),2025-01-31T00:00:00.000Z,1086.77,Equity : Sectoral - Infrastructure,413
Tata Gilt Securities Fund-Reg(G),2025-02-28T00:00:00.000Z,1070.87,Debt : Gilt,3230
Sundaram Equity Savings Fund(G),2025-01-31T00:00:00.000Z,1066.96,Hybrid : Equity Oriented,2393
Sundaram Money Market Fund-Reg(G),2025-02-28T00:00:00.000Z,1063.83,Debt : Money Market,39625
Quant Focused Fund(G),2025-01-31T00:00:00.000Z,1063.56,Equity : Large Cap,5742
Sundaram Focused Fund(G),2025-01-31T00:00:00.000Z,1062.46,Equity : Flexi Cap,2390
ICICI Pru Retirement Fund-Pure Equity Plan(G),2025-01-31T00:00:00.000Z,1060.05,Hybrid : Solution Oriented,25667
Navi NASDAQ 100 FoF-Reg(G),2025-01-31T00:00:00.000Z,1058.86,FoFs : Overseas,45870
UTI Healthcare Fund-Reg(G),2025-02-28T00:00:00.000Z,1057.17,Equity : Sectoral - Pharma,3646
Baroda BNP Paribas Innovation Fund-Reg(G),2025-01-31T00:00:00.000Z,1054.04,Equity : Thematic,48463
Bank of India Mid & Small Cap Equity & Debt Fund-Reg(G),2025-01-31T00:00:00.000Z,1051.92,Hybrid : Equity Oriented,32972
Mirae Asset Small Cap Fund-Reg(G),2025-01-31T00:00:00.000Z,1049.52,Equity : Small Cap,49453
SBI Nifty50 Equal Weight Index Fund-Reg(G),2025-01-31T00:00:00.000Z,1044.03,Equity : Index Funds,48498
Union Multicap Fund-Reg(G),2025-01-31T00:00:00.000Z,1041.57,Equity : Mid Cap,43846
Baroda BNP Paribas Money Market Fund-Reg(G),2025-02-28T00:00:00.000Z,1032.74,Debt : Money Market,25167
Aditya Birla SL Bal Bhavishya Yojna-Reg(G),2025-01-31T00:00:00.000Z,1031.92,Hybrid : Solution Oriented,41375
Kotak Banking & Financial Services Fund-Reg(G),2025-01-31T00:00:00.000Z,1027.25,Equity : Sectoral - Financial Services,46629
JM Value Fund(G),2025-01-31T00:00:00.000Z,1027.07,Equity : Value / Contra,1849
Aditya Birla SL Gold ETF,2025-01-31T00:00:00.000Z,1022.83,Gold : ETFs,13056
LIC MF Overnight Fund-Reg(G),2025-02-28T00:00:00.000Z,1017.69,Debt : Overnight,43784
DSP Quant Fund-Reg(G),2025-01-31T00:00:00.000Z,1015.68,Equity : Thematic,42237
DSP Banking & Financial Services Fund-Reg(G),2025-01-31T00:00:00.000Z,1011.64,Equity : Sectoral - Financial Services,48350
Motilal Oswal Balanced Advantage Fund-Reg(G),2025-01-31T00:00:00.000Z,1011.12,Hybrid : Dynamic Asset Allocation,35831
Tata Resources & Energy Fund-Reg(G),2025-01-31T00:00:00.000Z,1009.28,Equity : Sectoral - Energy / Power,33731
ICICI Pru Silver ETF FOF(G),2025-01-31T00:00:00.000Z,1008.48,FoFs : Domestic,46215
LIC MF ELSS Tax Saver-Reg(G),2025-02-28T00:00:00.000Z,1007.32,Equity : Tax Saving (ELSS),2153
Edelweiss CRISIL IBX 50:50 Gilt Plus SDL April 2037 Index Fund-Reg(G),2025-02-28T00:00:00.000Z,1004.58,Debt : Long Duration,46863
UTI Childrens Equity Fund(G),2025-02-28T00:00:00.000Z,994.15,Hybrid : Solution Oriented,3450
SBI International Access-US Equity FoF-Reg(G),2025-01-31T00:00:00.000Z,989.0,FoFs : Overseas,44224
Nippon India Credit Risk Fund(G),2025-02-28T00:00:00.000Z,988.86,Debt : Credit Risk,2661
ICICI Pru Nifty G-Sec Dec 2030 Index Fund-Reg(G),2025-02-28T00:00:00.000Z,986.56,Debt : Medium to Long Duration,46358
ICICI Pru Nifty SDL Dec 2028 Index Fund-Reg(G),2025-02-28T00:00:00.000Z,985.42,Debt : Medium to Long Duration,46359
Navi US Total Stock Market FoF-Reg(G),2025-01-31T00:00:00.000Z,982.16,FoFs : Overseas,45871
PGIM India Balanced Advantage Fund-Reg(G),2025-01-31T00:00:00.000Z,977.98,Hybrid : Dynamic Asset Allocation,45262
Axis Quant Fund-Reg(G),2025-01-31T00:00:00.000Z,974.54,Equity : Thematic,44329
Baroda BNP Paribas Dividend Yield Fund-Reg(G),2025-01-31T00:00:00.000Z,972.95,Equity : Thematic - Dividend Yield,49067
Axis Equity Savings Fund-Reg(G),2025-01-31T00:00:00.000Z,967.8,Hybrid : Equity Oriented,33370
DSP Global Innovation FoF-Reg(G),2025-01-31T00:00:00.000Z,966.95,FoFs : Overseas,45728
Aditya Birla SL Nifty 50 Index Fund-Reg(G),2025-01-31T00:00:00.000Z,964.82,Equity : Index Funds,407
Aditya Birla SL Credit Risk Fund-Reg(G),2025-02-28T00:00:00.000Z,963.57,Debt : Credit Risk,29571
Motilal Oswal Liquid Fund-Reg(G),2025-02-28T00:00:00.000Z,961.62,Debt : Liquid,41872
HSBC Business Cycles Fund-Reg(G),2025-01-31T00:00:00.000Z,958.69,Equity : Thematic,29553
Tata CRISIL IBX Gilt Index - April 2026 Index Fund-Reg(G),2025-02-28T00:00:00.000Z,956.35,Debt : Medium Duration,46952
Mirae Asset Nifty Midcap 150 ETF,2025-01-31T00:00:00.000Z,953.36,Equity : ETFs,46105
Bajaj Finserv Arbitrage Fund-Reg(G),2025-01-31T00:00:00.000Z,951.38,Hybrid : Arbitrage,48064
Invesco India Balanced Advantage Fund(G),2025-01-31T00:00:00.000Z,934.59,Hybrid : Dynamic Asset Allocation,2171
Tata Dividend Yield Fund-Reg(G),2025-01-31T00:00:00.000Z,925.58,Equity : Thematic - Dividend Yield,45374
Bandhan Financial Services Fund-Reg(G),2025-01-31T00:00:00.000Z,923.94,Equity : Sectoral - Financial Services,47389
Nippon India Nifty 50 Value 20 Index Fund-Reg(G),2025-01-31T00:00:00.000Z,923.75,Equity : Index Funds,45289
DSP US Flexible Equity FoF-Reg(G),2025-01-31T00:00:00.000Z,920.17,FoFs : Overseas,17236
DSP Business Cycle Fund-Reg(G),2025-01-31T00:00:00.000Z,917.73,Equity : Thematic,48957
Canara Rob Conservative Hybrid Fund-Reg(G),2025-02-28T00:00:00.000Z,916.34,Hybrid : Debt Oriented (Conservative),520
Axis Gilt Fund-Reg(G),2025-02-28T00:00:00.000Z,912.09,Debt : Gilt,15652
Sundaram Infra Advantage Fund(G),2025-01-31T00:00:00.000Z,908.35,Equity : Sectoral - Infrastructure,2945
Edelweiss Recently Listed IPO Fund-Reg(G),2025-01-31T00:00:00.000Z,907.41,Equity : Thematic,38375
SBI FMP-41-1498D-Reg(G),2025-02-28T00:00:00.000Z,905.88,Debt : FTP/FMP,45439
DSP Value Fund-Reg(G),2025-01-31T00:00:00.000Z,899.68,Equity : Value / Contra,44293
Edelweiss Focused Fund-Reg(G),2025-01-31T00:00:00.000Z,896.98,Equity : Flexi Cap,46055
Mahindra Manulife ELSS Tax Saver Fund-Reg(G),2025-01-31T00:00:00.000Z,895.53,Equity : Tax Saving (ELSS),36058
Quant Manufacturing Fund-Reg(G),2025-01-31T00:00:00.000Z,893.96,Equity : Thematic,48120
Baroda BNP Paribas ELSS Tax Saver Fund-Reg(G),2025-01-31T00:00:00.000Z,892.99,Equity : Tax Saving (ELSS),226
Samco Active Momentum Fund-Reg(G),2025-01-31T00:00:00.000Z,890.41,Equity : Thematic,47753
HDFC Non-Cyclical Consumer Fund-Reg(G),2025-01-31T00:00:00.000Z,884.5,Equity : Thematic - Consumption,46357
TRUSTMF Flexi Cap Fund-Reg(G),2025-01-31T00:00:00.000Z,881.88,Equity : Flexi Cap,48451
Mahindra Manulife Balanced Advantage Fund-Reg(G),2025-01-31T00:00:00.000Z,880.38,Hybrid : Dynamic Asset Allocation,45993
Sundaram Dividend Yield Fund(G),2025-01-31T00:00:00.000Z,879.51,Equity : Thematic - Dividend Yield,2337
ICICI Pru Nifty Alpha Low - Volatility 30 ETF FOF(G),2025-01-31T00:00:00.000Z,879.45,FoFs : Domestic,45389
LIC MF Flexi Cap Fund-Reg(G),2025-02-28T00:00:00.000Z,874.5,Equity : Flexi Cap,2090
Axis Global Equity Alpha FoF-Reg(G),2025-01-31T00:00:00.000Z,874.46,FoFs : Overseas,23016
Union Innovation & Opp Fund-Reg(G),2025-01-31T00:00:00.000Z,872.62,Equity : Thematic,45727
HDFC Income Fund(G),2025-02-28T00:00:00.000Z,869.96,Debt : Medium to Long Duration,1281
Axis Childrens Fund-No Lock in-Reg(G),2025-01-31T00:00:00.000Z,868.75,Hybrid : Solution Oriented,34004
Axis Childrens Fund-Compulsory Lock in-Reg(G),2025-01-31T00:00:00.000Z,868.75,Hybrid : Solution Oriented,34008
Nippon India Nifty Pharma ETF,2025-01-31T00:00:00.000Z,866.14,Equity : ETFs,45584
Union ELSS Tax Saver Fund(G),2025-01-31T00:00:00.000Z,863.07,Equity : Tax Saving (ELSS),14893
