s_name,aumdate,aumtotal,classification,schemecode
Mirae Asset Hang Seng TECH ETF,2024-11-30T00:00:00.000Z,305.86,Equity : ETFs,45737
Aditya Birla SL FTP-TI-1837D-Reg(G),2024-12-31T00:00:00.000Z,304.85,Debt : FTP/FMP,45593
Axis Nifty Next 50 Index Fund-Reg(G),2024-11-30T00:00:00.000Z,303.16,Equity : Index Funds,45702
WOC Banking & Financial Services Fund-Reg(G),2024-11-30T00:00:00.000Z,301.91,Equity : Sectoral - Financial Services,48332
Franklin India Floating Rate Fund(G),2024-11-30T00:00:00.000Z,301.81,Debt : Floater,3392
Mahindra Manulife Overnight Fund-Reg(G),2024-11-30T00:00:00.000Z,300.68,Debt : Overnight,42560
Union Value Fund-Reg(G),2024-11-30T00:00:00.000Z,300.49,Equity : Value / Contra,41740
Bandhan Credit Risk Fund-Reg(G),2024-11-30T00:00:00.000Z,300.19,Debt : Credit Risk,36529
SBI LT Advantage Fund-VI-Reg(G),2024-11-30T00:00:00.000Z,299.79,Equity : Tax Saving (ELSS),39495
Mirae Asset Nifty MidSmallcap400 Momentum Quality 100 ETF,2024-11-30T00:00:00.000Z,299.23,Equity : ETFs,48681
SBI FMP-53-1839D-Reg(G),2024-11-30T00:00:00.000Z,298.72,Debt : FTP/FMP,45972
Aditya Birla SL Nifty Midcap 150 Index Fund-Reg(G),2024-11-30T00:00:00.000Z,298.14,Equity : Index Funds,44738
Nippon India Nifty SDL Plus G-Sec - Jun 2029 Maturity 70:30 Index Fund-Reg(G),2024-11-30T00:00:00.000Z,297.81,Debt : Medium to Long Duration,46821
Axis Conservative Hybrid Fund-Reg(G),2024-11-30T00:00:00.000Z,297.23,Hybrid : Debt Oriented (Conservative),9765
Nippon India Nifty Auto ETF,2024-11-30T00:00:00.000Z,295.15,Equity : ETFs,45713
Aditya Birla SL CRISIL IBX Gilt - April 2026 Index Fund-Reg(G),2024-12-31T00:00:00.000Z,294.3,Debt : Medium Duration,46891
HSBC Nifty 50 Index Fund-Reg(G),2024-11-30T00:00:00.000Z,292.47,Equity : Index Funds,44938
Tata Gold ETF,2024-11-30T00:00:00.000Z,289.58,Gold : ETFs,48435
SBI Silver ETF FOF-Reg(G),2024-11-30T00:00:00.000Z,289.55,FoFs : Domestic,48895
SBI FMP-51-1846D-Reg(G),2024-11-30T00:00:00.000Z,288.8,Debt : FTP/FMP,45889
DSP Silver ETF,2024-11-30T00:00:00.000Z,284.22,Gold : ETFs,46354
Tata Nifty India Tourism Index Fund-Reg(G),2024-11-30T00:00:00.000Z,283.9,Equity : Index Funds,48992
TRUSTMF Liquid Fund-Reg(G),2024-11-30T00:00:00.000Z,280.91,Debt : Liquid,45451
HDFC NIFTY 100 Index Fund-Reg(G),2024-11-30T00:00:00.000Z,280.88,Equity : Index Funds,45996
SBI FMP-56-1232D-Reg(G),2024-11-30T00:00:00.000Z,279.83,Debt : FTP/FMP,46153
WOC Digital Bharat Fund-Reg(G),2024-11-30T00:00:00.000Z,278.17,Equity : Sectoral - Technology,49129
Axis Nifty AAA Bond Plus SDL Apr 2026 50:50 ETF FoF-Reg(G),2024-11-30T00:00:00.000Z,276.44,Debt : Medium to Long Duration,45699
SBI Retirement Benefit Fund-Conservative Hybrid Plan-Reg(G),2024-11-30T00:00:00.000Z,275.79,Hybrid : Solution Oriented,30400
Nippon India ETF Nifty 100,2024-11-30T00:00:00.000Z,275.72,Equity : ETFs,17643
Aditya Birla SL CRISIL-IBX AAA NBFC-HFC Index-Sep 2026 Fund-Reg(G),2024-12-31T00:00:00.000Z,274.91,Debt : Short Duration,49201
WOC Liquid Fund-Reg(G),2024-11-30T00:00:00.000Z,273.21,Debt : Liquid,42211
ITI Banking & Financial Services Fund-Reg(G),2024-11-30T00:00:00.000Z,271.75,Equity : Sectoral - Financial Services,45720
Edelweiss Banking and PSU Debt Fund-Reg(G),2024-11-30T00:00:00.000Z,270.97,Debt : Banking & PSU,23296
Mirae Asset Nifty Financial Services ETF,2024-11-30T00:00:00.000Z,270.82,Equity : ETFs,45669
ICICI Pru Income Optimizer Fund(FOF)(G),2024-11-30T00:00:00.000Z,270.77,FoFs : Domestic,1701
Shriram Overnight Fund-Reg(G),2024-11-30T00:00:00.000Z,269.8,Debt : Overnight,46777
Nippon India Japan Equity Fund(G),2024-11-30T00:00:00.000Z,267.13,Equity : International,24620
ICICI Pru Nifty SDL Sep 2026 Index Fund-Reg(G),2024-11-30T00:00:00.000Z,266.64,Debt : Medium to Long Duration,47333
Navi Flexi Cap Fund-Reg(G),2024-11-30T00:00:00.000Z,266.14,Equity : Flexi Cap,39516
Helios Balanced Advantage Fund-Reg(G),2024-11-30T00:00:00.000Z,263.92,Hybrid : Dynamic Asset Allocation,48678
Taurus Ethical Fund-Reg(G),2024-11-30T00:00:00.000Z,263.18,Equity : Multi Cap,7615
LIC MF Banking & Financial Services Fund-Reg(G),2024-11-30T00:00:00.000Z,263.11,Equity : Sectoral - Financial Services,19955
HDFC NIFTY Midcap 150 Index Fund-Reg(G),2024-11-30T00:00:00.000Z,261.31,Equity : Index Funds,46619
HSBC Tax Saver Equity Fund(G),2024-11-30T00:00:00.000Z,260.16,Equity : Tax Saving (ELSS),1462
Union Corporate Bond Fund-Reg(G),2024-11-30T00:00:00.000Z,259.62,Debt : Corporate Bond,39478
HSBC Gilt Fund-Reg(G),2024-11-30T00:00:00.000Z,258.89,Debt : Gilt,586
Groww Nifty Total Market Index Fund-Reg(G),2024-11-30T00:00:00.000Z,254.89,Equity : Index Funds,48247
WOC Pharma and Healthcare Fund-Reg(G),2024-11-30T00:00:00.000Z,254.08,Equity : Sectoral - Pharma,48472
Baroda BNP Paribas Equity Savings Fund-Reg(G),2024-11-30T00:00:00.000Z,253.69,Hybrid : Equity Oriented,42783
Mirae Asset CRISIL IBX Gilt Index - April 2033 Index Fund-Reg(G),2024-11-30T00:00:00.000Z,251.98,Debt : Gilt,47042
NJ ELSS Tax Saver Scheme-Reg(G),2024-11-30T00:00:00.000Z,250.67,Equity : Tax Saving (ELSS),46058
UTI Nifty Midcap 150 Quality 50 Index Fund-Reg(G),2024-11-30T00:00:00.000Z,250.59,Equity : Index Funds,45718
SBI FMP-57-1835D-Reg(G),2024-11-30T00:00:00.000Z,248.31,Debt : FTP/FMP,46158
Aditya Birla SL Global Emerging Opp Fund(G),2024-11-30T00:00:00.000Z,248.15,FoFs : Overseas,6063
Bandhan Equity Savings Fund-Reg(G),2024-11-30T00:00:00.000Z,245.7,Hybrid : Equity Oriented,5300
Franklin Asian Equity Fund(G),2024-11-30T00:00:00.000Z,245.5,Equity : International,3813
SBI FMP-55-1849D-Reg(G),2024-11-30T00:00:00.000Z,245.36,Debt : FTP/FMP,46075
Franklin India Debt Hybrid Fund(G),2024-11-30T00:00:00.000Z,245.13,Hybrid : Debt Oriented (Conservative),1018
HDFC FMP-Sr 46-1406D-Aug 2022-Reg(G),2024-11-30T00:00:00.000Z,245.13,Debt : FTP/FMP,46755
DSP Nifty Top 10 Equal Weight ETF,2024-11-30T00:00:00.000Z,244.01,Equity : ETFs,49012
SBI FMP-58-1842D-Reg(G),2024-11-30T00:00:00.000Z,242.54,Debt : FTP/FMP,46201
SBI BSE Sensex Index Fund-Reg(G),2024-11-30T00:00:00.000Z,241.76,Equity : Index Funds,47966
PGIM India Ultra Short Duration Fund(G),2024-11-30T00:00:00.000Z,241.25,Debt : Ultra Short Duration,5925
Axis NIFTY Bank ETF,2024-11-30T00:00:00.000Z,240.82,Equity : ETFs,14654
Kotak FMP-300-1223D(G),2024-11-30T00:00:00.000Z,240.13,Debt : FTP/FMP,47298
Quantum Gold Fund ETF,2024-11-30T00:00:00.000Z,239.68,Gold : ETFs,4326
Aditya Birla SL Nifty Smallcap 50 Index Fund-Reg(G),2024-11-30T00:00:00.000Z,239.28,Equity : Index Funds,44737
SBI FMP-60-1878D-Reg(G),2024-11-30T00:00:00.000Z,238.99,Debt : FTP/FMP,46397
LIC MF Arbitrage Fund-Reg(G),2024-11-30T00:00:00.000Z,237.58,Hybrid : Arbitrage,39948
Nippon India Passive Flexicap FoF-Reg(G),2024-11-30T00:00:00.000Z,237.41,FoFs : Domestic,43928
DSP Nifty Private Bank ETF,2024-11-30T00:00:00.000Z,236.3,Equity : ETFs,47907
Sundaram Short Duration Fund(G),2024-11-30T00:00:00.000Z,234.97,Debt : Short Duration,2381
Union Arbitrage Fund-Reg(G),2024-11-30T00:00:00.000Z,233.48,Hybrid : Arbitrage,42524
Bajaj Finserv Overnight Fund-Reg(G),2024-11-30T00:00:00.000Z,233.31,Debt : Overnight,48051
Axis Floater Fund-Reg(G),2024-11-30T00:00:00.000Z,233.23,Debt : Floater,45632
Canara Rob Banking and PSU Debt Fund-Reg(G),2024-11-30T00:00:00.000Z,232.5,Debt : Banking & PSU,46050
JM Low Duration Fund(G),2024-11-30T00:00:00.000Z,231.17,Debt : Low Duration,1938
Sundaram Arbitrage Fund(G),2024-11-30T00:00:00.000Z,230.53,Hybrid : Arbitrage,32098
Invesco India Medium Duration Fund-Reg(G),2024-11-30T00:00:00.000Z,229.37,Debt : Medium Duration,45607
Baroda BNP Paribas Low Duration Fund(G),2024-11-30T00:00:00.000Z,228.03,Debt : Low Duration,205
Axis Nifty 500 Index Fund-Reg(G),2024-11-30T00:00:00.000Z,227.74,Equity : Index Funds,48963
Edelweiss NIFTY Large Mid Cap 250 Index Fund-Reg(G),2024-11-30T00:00:00.000Z,225.36,Equity : Index Funds,45864
Tata Equity Savings Fund-Reg(G),2024-11-30T00:00:00.000Z,224.14,Hybrid : Equity Oriented,3273
Groww Nifty EV & New Age Automotive ETF,2024-11-30T00:00:00.000Z,223.79,Equity : ETFs,48978
Mahindra Manulife Ultra Short Duration Fund-Reg(G),2024-11-30T00:00:00.000Z,222.52,Debt : Ultra Short Duration,43845
SBI LT Advantage Fund-IV-Reg(G),2024-11-30T00:00:00.000Z,221.68,Equity : Tax Saving (ELSS),36734
Nippon India ETF Nifty 50 Value 20,2024-11-30T00:00:00.000Z,221.51,Equity : ETFs,31920
Nippon India FHF-XLIII-1-1755D(IDCW),2024-11-30T00:00:00.000Z,219.15,Debt : FTP/FMP,45796
SBI FMP-45-1840D-Reg(G),2024-11-30T00:00:00.000Z,218.59,Debt : FTP/FMP,45580
Navi Nifty Midcap 150 Index Fund-Reg(G),2024-11-30T00:00:00.000Z,217.97,Equity : Index Funds,45861
ITI Pharma & Healthcare Fund-Reg(G),2024-11-30T00:00:00.000Z,217.92,Equity : Sectoral - Pharma,45724
Mirae Asset Nifty Bank ETF,2024-11-30T00:00:00.000Z,217.7,Equity : ETFs,47993
Nippon India FHF-XLV-5-1158D(G),2024-11-30T00:00:00.000Z,217.07,Debt : FTP/FMP,47900
SBI Equity Minimum Variance Fund-Reg(G),2024-11-30T00:00:00.000Z,216.72,Equity : Thematic,33878
Franklin India Ultra Short Duration Fund-Reg(G),2024-11-30T00:00:00.000Z,216.26,Debt : Ultra Short Duration,49073
Aditya Birla SL Financial Planning FOF Aggressive Plan(G),2024-11-30T00:00:00.000Z,216.04,FoFs : Domestic,8303
Mirae Asset Nifty India Manufacturing ETF,2024-11-30T00:00:00.000Z,215.24,Equity : ETFs,45869
Quantum ELSS Tax Saver Fund-Reg(G),2024-11-30T00:00:00.000Z,214.84,Equity : Tax Saving (ELSS),19878
Helios Large & Mid Cap Fund-Reg(G),2024-11-30T00:00:00.000Z,213.95,Equity : Large & Mid Cap,49245
PGIM India Hybrid Equity Fund(G),2024-11-30T00:00:00.000Z,212.31,Hybrid : Equity Oriented,835
JM Focused Fund-Reg(G),2024-11-30T00:00:00.000Z,211.91,Equity : Large Cap,4282
Aditya Birla SL FTP-TQ-1879D-Reg(G),2024-12-31T00:00:00.000Z,211.79,Debt : FTP/FMP,46536
DSP Nifty 50 Equal Weight ETF,2024-11-30T00:00:00.000Z,210.46,Equity : ETFs,45715
Bajaj Finserv Nifty 50 ETF,2024-11-30T00:00:00.000Z,209.72,Equity : ETFs,48461
Mirae Asset Nifty MidSmallcap400 Momentum Quality 100 ETF FoF-Reg(G),2024-11-30T00:00:00.000Z,208.62,FoFs : Domestic,48822
Baroda BNP Paribas Corp Bond Fund(G),2024-11-30T00:00:00.000Z,207.19,Debt : Corporate Bond,6932
Kotak Nifty SDL Jul 2033 Index Fund-Reg(G),2024-11-30T00:00:00.000Z,206.06,Debt : Long Duration,47612
Bandhan Long Duration Fund-Reg(G),2024-11-30T00:00:00.000Z,205.94,Debt : Long Duration,48582
Baroda BNP Paribas Banking and Fin Serv Fund-Reg(G),2024-11-30T00:00:00.000Z,204.47,Equity : Sectoral - Financial Services,16955
Aditya Birla SL Global Excellence Equity FoF(G),2024-11-30T00:00:00.000Z,201.41,FoFs : Overseas,3841
Kotak Nifty IT ETF,2024-11-30T00:00:00.000Z,199.95,Equity : ETFs,45377
ITI Ultra Short Duration Fund-Reg(G),2024-11-30T00:00:00.000Z,199.69,Debt : Ultra Short Duration,45498
Baroda BNP Paribas Short Duration Fund-Reg(G),2024-11-30T00:00:00.000Z,197.71,Debt : Short Duration,8374
Bank of India Bluechip Fund-Reg(G),2024-11-30T00:00:00.000Z,197.41,Equity : Large Cap,45571
HDFC BSE 500 Index Fund-Reg(G),2024-11-30T00:00:00.000Z,195.55,Equity : Index Funds,47913
SBI FMP-73-1226D-Reg(G),2024-11-30T00:00:00.000Z,194.99,Debt : FTP/FMP,47260
HSBC CRISIL IBX Gilt June 2027 Index Fund-Reg(G),2024-11-30T00:00:00.000Z,194.6,Debt : Medium Duration,47676
Nippon India ETF Nifty 5 yr Benchmark G-Sec,2024-11-30T00:00:00.000Z,194.09,Debt : ETFs,45428
Canara Rob Overnight Fund-Reg(G),2024-11-30T00:00:00.000Z,193.88,Debt : Overnight,43350
UTI BSE Sensex Index Fund-Reg(G),2024-11-30T00:00:00.000Z,193.74,Equity : Index Funds,46317
Union Money Market Fund-Reg(G),2024-11-30T00:00:00.000Z,193.27,Debt : Money Market,45360
Samco Special Opportunities Fund-Reg(G),2024-11-30T00:00:00.000Z,193.16,Equity : Thematic,48744
HDFC Nifty SDL Oct 2026 Index Fund-Reg(G),2024-11-30T00:00:00.000Z,191.7,Debt : Medium Duration,46867
Edelweiss Government Securities Fund-Reg(G),2024-11-30T00:00:00.000Z,191.67,Debt : Gilt,21922
TRUSTMF Banking & PSU Fund-Reg(G),2024-11-30T00:00:00.000Z,190.34,Debt : Banking & PSU,45242
HDFC Charity Fund for Cancer Cure-Reg(50% IDCW Donation Option),2024-11-30T00:00:00.000Z,189.81,Debt : FTP/FMP,46200
DSP Credit Risk Fund-Reg(G),2024-11-30T00:00:00.000Z,188.49,Debt : Credit Risk,685
Mirae Asset Nifty Smallcap 250 Momentum Quality 100 ETF FoF-Reg(G),2024-11-30T00:00:00.000Z,188.21,FoFs : Domestic,48497
Mirae Asset Nifty200 Alpha 30 ETF FoF-Reg(G),2024-11-30T00:00:00.000Z,187.98,FoFs : Domestic,48937
Aditya Birla SL Intl. Equity Fund(G),2024-11-30T00:00:00.000Z,187.65,Equity : International,460
SBI FMP-68-1302D-Reg(G),2024-11-30T00:00:00.000Z,187.52,Debt : FTP/FMP,46919
Aditya Birla SL Asset Allocator FoF(G),2024-11-30T00:00:00.000Z,187.45,FoFs : Domestic,2279
Edelweiss Gold and Silver ETF FoF-Reg(G),2024-11-30T00:00:00.000Z,187.29,FoFs : Domestic,46800
Aditya Birla SL US Treasury 3-10 year Bond ETFs FoF-Reg(G),2024-11-30T00:00:00.000Z,185.42,Debt : ETFs,48284
Bank of India Ultra Short Duration Fund-Reg(G),2024-11-30T00:00:00.000Z,184.59,Debt : Ultra Short Duration,5842
JM ELSS Tax Saver Fund(G),2024-11-30T00:00:00.000Z,183.48,Equity : Tax Saving (ELSS),4198
Tata Nifty200 Alpha 30 Index Fund-Reg(G),2024-11-30T00:00:00.000Z,181.98,Equity : Index Funds,49080
LIC MF Medium to Long Duration Fund-Reg(G),2024-11-30T00:00:00.000Z,181.33,Debt : Medium to Long Duration,2087
HDFC Silver ETF FoF-Reg(G),2024-11-30T00:00:00.000Z,180.38,Gold : MFs,46465
DSP Regular Savings Fund-Reg(G),2024-11-30T00:00:00.000Z,180.31,Hybrid : Debt Oriented (Conservative),719
Axis NIFTY IT ETF,2024-11-30T00:00:00.000Z,180.09,Equity : ETFs,45427
Tata Nifty G-Sec Dec 2029 Index Fund-Reg(G),2024-11-30T00:00:00.000Z,179.55,Debt : Medium to Long Duration,47405
DSP FMP 270-1144D-Reg(G),2024-11-30T00:00:00.000Z,179.39,Debt : FTP/FMP,47634
Kotak Long Duration Fund-Reg(G),2024-11-30T00:00:00.000Z,178.37,Debt : Long Duration,48538
DSP Nifty Smallcap250 Quality 50 Index Fund-Reg(G),2024-11-30T00:00:00.000Z,178.09,Equity : Index Funds,48377
JM Arbitrage Fund(G),2024-11-30T00:00:00.000Z,177.82,Hybrid : Arbitrage,1843
SBI Retirement Benefit Fund-Conservative Plan-Reg(G),2024-11-30T00:00:00.000Z,177.76,Hybrid : Solution Oriented,30401
UTI Nifty SDL Plus AAA PSU Bond Apr 2026 75:25 Index Fund-Reg(G),2024-11-30T00:00:00.000Z,177.75,Debt : Medium Duration,47587
Axis NASDAQ 100 FoF-Reg(G),2024-11-30T00:00:00.000Z,176.15,FoFs : Overseas,47017
ICICI Pru Nifty50 Value 20 ETF,2024-11-30T00:00:00.000Z,175.69,Equity : ETFs,33839
ICICI Pru Nifty LargeMidcap 250 Index Fund-Reg(G),2024-11-30T00:00:00.000Z,175.63,Equity : Index Funds,48643
UTI FTIF-XXXV-II(1223D)(G),2024-11-30T00:00:00.000Z,175.59,Debt : FTP/FMP,47273
ICICI Pru Passive Strategy Fund(FOF)(G),2024-11-30T00:00:00.000Z,174.63,FoFs : Domestic,1698
Tata Retirement Sav Fund - Cons Plan(G),2024-11-30T00:00:00.000Z,174.55,Hybrid : Solution Oriented,15378
Aditya Birla SL Silver ETF FOF-Reg(G),2024-11-30T00:00:00.000Z,173.97,FoFs : Domestic,46225
Bandhan Retirement Fund-Reg(G),2024-11-30T00:00:00.000Z,173.36,Hybrid : Solution Oriented,48226
PGIM India Money Market Fund-Reg(G),2024-11-30T00:00:00.000Z,170.77,Debt : Money Market,34742
Motilal Oswal Gold and Silver ETFs FoF-Reg(G),2024-11-30T00:00:00.000Z,170.52,Gold : MFs,17788
LIC MF Gold ETF,2024-11-30T00:00:00.000Z,170.02,Gold : ETFs,15131
Union Overnight Fund-Reg(G),2024-11-30T00:00:00.000Z,169.64,Debt : Overnight,43213
Quant Overnight Fund-Reg(G),2024-11-30T00:00:00.000Z,169.05,Debt : Overnight,47327
Nippon India FHF-XLIII-5-2315D(G),2024-11-30T00:00:00.000Z,169.01,Debt : FTP/FMP,46433
Baroda BNP Paribas Dynamic Bond Fund(G),2024-11-30T00:00:00.000Z,168.38,Debt : Dynamic Bond,116
Aditya Birla SL CRISIL IBX 60:40 SDL + AAA PSU - Apr 2025 Index Fund-Reg(G),2024-12-31T00:00:00.000Z,168.08,Debt : Medium Duration,46226
UTI Gilt Fund with 10 year Constant Duration-Reg(G),2024-11-30T00:00:00.000Z,167.36,Debt : Gilt (10 Yr Constant Duration),40967
Aditya Birla SL Nifty Next 50 Index Fund-Reg(G),2024-11-30T00:00:00.000Z,167.07,Equity : Index Funds,46360
SBI Nifty Private Bank ETF,2024-11-30T00:00:00.000Z,165.99,Equity : ETFs,36351
Nippon India ETF Nifty Infrastructure BeES,2024-11-30T00:00:00.000Z,164.3,Equity : ETFs,12859
HDFC NIFTY G-Sec Apr 2029 Index Fund-Reg(G),2024-11-30T00:00:00.000Z,163.8,Debt : Medium to Long Duration,47712
Nippon India CRISIL-IBX AAA Financial Services - Jan 2028 Index Fund-Reg(G),2024-11-30T00:00:00.000Z,163.61,Debt : Medium to Long Duration,49221
Mirae Asset Nifty IT ETF,2024-11-30T00:00:00.000Z,161.96,Equity : ETFs,48250
Baroda BNP Paribas Credit Risk Fund-Reg(G),2024-11-30T00:00:00.000Z,161.79,Debt : Credit Risk,25569
Tata Nifty India Digital ETF,2024-11-30T00:00:00.000Z,161.5,Equity : ETFs,45944
HDFC Retirement Savings Fund-Hybrid-Debt Plan-Reg(G),2024-11-30T00:00:00.000Z,161.42,Hybrid : Solution Oriented,24807
SBI FMP-76-1221D-Reg(G),2024-11-30T00:00:00.000Z,160.62,Debt : FTP/FMP,47541
HDFC FMP-Sr 46-1158D-July 2022-Reg(G),2024-11-30T00:00:00.000Z,160.58,Debt : FTP/FMP,46672
Shriram Multi Asset Allocation Fund-Reg(G),2024-11-30T00:00:00.000Z,160.49,Hybrid : Multi Asset Allocation,48029
Aditya Birla SL CRISIL IBX SDL Jun 2032 Index Fund-Reg(G),2024-12-31T00:00:00.000Z,160.03,Debt : Long Duration,47592
HSBC Dynamic Bond Fund-Reg(G),2024-11-30T00:00:00.000Z,158.95,Debt : Dynamic Bond,925
Mirae Asset Nifty EV and New Age Automotive ETF,2024-11-30T00:00:00.000Z,158.46,Equity : ETFs,48935
Shriram Liquid Fund-Reg(G),2024-11-30T00:00:00.000Z,158.22,Debt : Liquid,48954
Edelweiss CRISIL IBX 50:50 Gilt Plus SDL Sep 2028 Index Fund-Reg(G),2024-11-30T00:00:00.000Z,156.68,Debt : Medium to Long Duration,47075
Nippon India Retirement Fund-Income Generation(G),2024-11-30T00:00:00.000Z,156.45,Hybrid : Solution Oriented,17166
Edelweiss Nifty500 Multicap Momentum Quality 50 Index Fund-Reg(G),2024-11-30T00:00:00.000Z,156.24,Equity : Index Funds,49278
UTI Nifty Private Bank Index Fund-Reg(G),2024-11-30T00:00:00.000Z,155.39,Equity : Index Funds,49146
Aditya Birla SL Long Duration Fund-Reg(G),2024-12-31T00:00:00.000Z,154.91,Debt : Long Duration,46711
Motilal Oswal Quant Fund-Reg(G),2024-11-30T00:00:00.000Z,154.11,Equity : Thematic,48806
WOC Balanced Hybrid Fund-Reg(G),2024-11-30T00:00:00.000Z,154.05,Hybrid : Dynamic Asset Allocation,48213
Groww Liquid Fund-Reg(G),2024-11-30T00:00:00.000Z,154.05,Debt : Liquid,15502
Union Retirement Fund-Reg(G),2024-11-30T00:00:00.000Z,154.02,Hybrid : Solution Oriented,45735
Edelweiss MSCI India Domestic & World Healthcare 45 Index Fund-Reg(G),2024-11-30T00:00:00.000Z,153.72,Equity : Index Funds,45117
SBI FMP-74-1243D-Reg(G),2024-11-30T00:00:00.000Z,153.37,Debt : FTP/FMP,47381
Axis Silver ETF,2024-11-30T00:00:00.000Z,153.18,Gold : ETFs,46369
Edelweiss CRISIL IBX 50:50 Gilt Plus SDL Short Duration Index Fund-Reg(G),2024-11-30T00:00:00.000Z,152.81,Debt : Short Duration,47430
Bandhan Nifty 100 Index Fund-Reg(G),2024-11-30T00:00:00.000Z,152.77,Equity : Index Funds,46119
Kotak Nifty 100 Low Volatility 30 ETF,2024-11-30T00:00:00.000Z,152.11,Equity : ETFs,45688
ICICI Pru Nifty Healthcare ETF,2024-11-30T00:00:00.000Z,152.04,Equity : ETFs,45383
UTI Silver ETF,2024-11-30T00:00:00.000Z,151.77,Gold : ETFs,46881
Franklin India G-Sec Fund(G),2024-11-30T00:00:00.000Z,151.22,Debt : Gilt,3373
HDFC FMP-Sr 47-2638D-Feb 2023-Reg(G),2024-11-30T00:00:00.000Z,151.02,Debt : FTP/FMP,47642
ICICI Pru India Equity (FOF)(G),2024-11-30T00:00:00.000Z,150.04,FoFs : Domestic,44626
Bandhan CRISIL IBX 90:10 SDL Plus Gilt - Sep 2027 Index Fund-Reg(G),2024-11-30T00:00:00.000Z,149.74,Debt : Gilt,46212
TRUSTMF Overnight Fund-Reg(G),2024-11-30T00:00:00.000Z,149.53,Debt : Overnight,45719
Nippon India Nifty IT Index Fund-Reg(G),2024-11-30T00:00:00.000Z,149.16,Equity : Index Funds,48568
UTI Gold ETF FoF-Reg(G),2024-11-30T00:00:00.000Z,147.69,Gold : MFs,47003
JM Overnight Fund-Reg(G),2024-11-30T00:00:00.000Z,146.63,Debt : Overnight,44156
ICICI Pru Nifty Oil & Gas ETF,2024-11-30T00:00:00.000Z,144.48,Equity : ETFs,33836
Invesco India Gold ETF,2024-11-30T00:00:00.000Z,144.43,Gold : ETFs,8505
HSBC Conservative Hybrid Fund(G),2024-11-30T00:00:00.000Z,144.17,Hybrid : Debt Oriented (Conservative),1458
LIC MF Focused Fund-Reg(G),2024-11-30T00:00:00.000Z,143.09,Equity : Large Cap,32627
Quantum Gold Saving Fund-Reg(G),2024-11-30T00:00:00.000Z,143.05,Gold : MFs,19961
LIC MF Value Fund-Reg(G),2024-11-30T00:00:00.000Z,142.7,Equity : Value / Contra,39956
Invesco India Credit Risk Fund(G),2024-11-30T00:00:00.000Z,141.97,Debt : Credit Risk,21522
Tata Floating Rate Fund-Reg(G),2024-11-30T00:00:00.000Z,141.65,Debt : Floater,45375
Axis All Seasons Debt FOFs-Reg(G),2024-11-30T00:00:00.000Z,141.52,FoFs : Domestic,43840
Franklin India Arbitrage Fund-Reg(G),2024-11-30T00:00:00.000Z,141.35,Hybrid : Arbitrage,49339
Bandhan US Treasury Bond 0-1 year FoF-Reg(G),2024-11-30T00:00:00.000Z,141.11,FoFs : Overseas,47724
Shriram Flexi Cap Fund-Reg(G),2024-11-30T00:00:00.000Z,140.73,Equity : Flexi Cap,38781
Union Gilt Fund-Reg(G),2024-11-30T00:00:00.000Z,140.36,Debt : Gilt,46221
Union Equity Savings Fund-Reg(G),2024-11-30T00:00:00.000Z,140.34,Hybrid : Equity Oriented,40627
Edelweiss US Value Equity Offshore Fund-Reg(G),2024-11-30T00:00:00.000Z,140.27,FoFs : Overseas,21920
Axis NIFTY IT Index Fund-Reg(G),2024-11-30T00:00:00.000Z,140.01,Equity : Index Funds,47983
Edelweiss Nifty 100 Quality 30 Index Fund-Reg(G),2024-11-30T00:00:00.000Z,139.67,Equity : Index Funds,45961
SBI FMP-47-1434D-Reg(G),2024-11-30T00:00:00.000Z,139.64,Debt : FTP/FMP,45660
Bandhan Nifty200 Momentum 30 Index Fund-Reg(G),2024-11-30T00:00:00.000Z,138.83,Equity : Index Funds,46608
Motilal Oswal BSE Enhanced Value ETF,2024-11-30T00:00:00.000Z,137.53,Equity : ETFs,46740
DSP World Mining FoF-Reg(G),2024-11-30T00:00:00.000Z,137.45,FoFs : Overseas,8359
TRUSTMF Short Duration Fund-Reg(G),2024-11-30T00:00:00.000Z,136.96,Debt : Short Duration,45652
Bank of India Balanced Advantage Fund-Reg(G),2024-11-30T00:00:00.000Z,135.85,Hybrid : Dynamic Asset Allocation,21917
Helios Financial Services Fund-Reg(G),2024-11-30T00:00:00.000Z,135.41,Equity : Sectoral - Financial Services,48897
Navi Aggressive Hybrid Fund-Reg(G),2024-11-30T00:00:00.000Z,135.28,Hybrid : Equity Oriented,39479
HSBC Nifty Next 50 Index Fund-Reg(G),2024-11-30T00:00:00.000Z,134.78,Equity : Index Funds,33548
ICICI Pru Nifty Auto Index Fund-Reg(G),2024-11-30T00:00:00.000Z,134.77,Equity : Sectoral - Auto,45995
Canara Rob Corp Bond Fund-Reg(G),2024-11-30T00:00:00.000Z,134.3,Debt : Corporate Bond,23504
WOC Arbitrage Fund-Reg(G),2024-11-30T00:00:00.000Z,133.88,Hybrid : Arbitrage,48900
Axis CRISIL-IBX AAA Bond Financial Services - Sep 2027 Index Fund-Reg(G),2024-11-30T00:00:00.000Z,133.47,Debt : Medium to Long Duration,49254
SBI FMP-52-1848D-Reg(G),2024-11-30T00:00:00.000Z,132.58,Debt : FTP/FMP,45915
Edelweiss CRISIL IBX AAA Financial Services Bond - Jan 2028 Index Fund-Reg(G),2024-11-30T00:00:00.000Z,132.4,Debt : Medium to Long Duration,49393
SBI Nifty 200 Quality 30 ETF,2024-11-30T00:00:00.000Z,131.61,Equity : ETFs,41015
Helios Overnight Fund-Reg(G),2024-12-31T00:00:00.000Z,131.49,Debt : Overnight,48295
Taurus Mid Cap Fund-Reg(G),2024-11-30T00:00:00.000Z,129.59,Equity : Mid Cap,3306
Nippon India ETF Nifty India Consumption,2024-11-30T00:00:00.000Z,129.25,Equity : ETFs,17478
Nippon India Nifty Bank Index Fund-Reg(G),2024-11-30T00:00:00.000Z,129.0,Equity : Index Funds,48148
Axis BSE Sensex ETF,2024-11-30T00:00:00.000Z,128.86,Equity : ETFs,47768
ICICI Pru FMP-88-1226D-F(G),2024-11-30T00:00:00.000Z,128.85,Debt : FTP/FMP,47232
Quantum Equity FoF-Reg(G),2024-11-30T00:00:00.000Z,128.11,FoFs : Domestic,19904
SBI FMP-46-1850D-Reg(G),2024-11-30T00:00:00.000Z,127.44,Debt : FTP/FMP,45620
Groww Largecap Fund-Reg(G),2024-11-30T00:00:00.000Z,127.19,Equity : Large Cap,15997
ICICI Pru Nifty 200 Quality 30 ETF,2024-11-30T00:00:00.000Z,126.49,Equity : ETFs,48118
Axis Nifty Bank Index Fund-Reg(G),2024-11-30T00:00:00.000Z,126.33,Equity : Index Funds,48680
Zerodha Gold ETF,2024-11-30T00:00:00.000Z,126.21,Gold : ETFs,48500
Quant Gilt Fund-Reg(G),2024-11-30T00:00:00.000Z,125.48,Debt : Gilt,47345
Mirae Asset Nifty 100 ESG Sector Leaders ETF,2024-11-30T00:00:00.000Z,125.02,Equity : ETFs,45134
Kotak FMP-310-1131D(G),2024-11-30T00:00:00.000Z,124.93,Debt : FTP/FMP,47871
JM Short Duration Fund-Reg(G),2024-11-30T00:00:00.000Z,124.0,Debt : Short Duration,46751
Tata Nifty MidSmall Healthcare Index Fund-Reg(G),2024-11-30T00:00:00.000Z,123.46,Equity : Index Funds,48764
Canara Rob Gilt Fund-Reg(G),2024-11-30T00:00:00.000Z,122.72,Debt : Gilt,538
Tata Silver ETF,2024-11-30T00:00:00.000Z,122.65,Gold : ETFs,48436
SBI Magnum Childrens Benefit Fund-Savings Plan,2024-11-30T00:00:00.000Z,122.53,Hybrid : Solution Oriented,2748
ICICI Pru BSE 500 ETF FOF-Reg(G),2024-11-30T00:00:00.000Z,122.05,FoFs : Domestic,45726
DSP FMP 268-1281D-Reg(G),2024-11-30T00:00:00.000Z,121.96,Debt : FTP/FMP,47124
Bajaj Finserv Banking and PSU Fund-Reg(G),2024-11-30T00:00:00.000Z,121.89,Debt : Banking & PSU,48214
Samco ELSS Tax Saver Fund-Reg(G),2024-11-30T00:00:00.000Z,121.84,Equity : Tax Saving (ELSS),46606
Tata Gold ETF FoF-Reg(G),2024-11-30T00:00:00.000Z,121.64,FoFs : Domestic,48437
SBI FMP-78-1170D-Reg(G),2024-11-30T00:00:00.000Z,121.45,Debt : FTP/FMP,47638
Kotak Nifty SDL Jul 2026 Index Fund-Reg(G),2024-11-30T00:00:00.000Z,121.18,Debt : Medium to Long Duration,46729
ICICI Pru Global Stable Equity Fund(FOF)(G),2024-11-30T00:00:00.000Z,120.37,FoFs : Overseas,16718
Tata Nifty500 Multicap India Manufacturing 50:30:20 Index Fund-Reg(G),2024-11-30T00:00:00.000Z,120.27,Equity : Index Funds,48782
Canara Rob Income Fund-Reg(G),2024-11-30T00:00:00.000Z,120.23,Debt : Medium to Long Duration,542
Mirae Asset Dynamic Bond Fund-Reg(G),2024-11-30T00:00:00.000Z,119.92,Debt : Dynamic Bond,36556
Bandhan Conservative Hybrid Fund-Reg(G),2024-11-30T00:00:00.000Z,119.2,Hybrid : Debt Oriented (Conservative),8465
Canara Rob Dynamic Bond Fund-Reg(G),2024-11-30T00:00:00.000Z,119.01,Debt : Dynamic Bond,7792
UTI Long Duration Fund-Reg(G),2024-11-30T00:00:00.000Z,118.7,Debt : Long Duration,47733
Motilal Oswal Nifty 200 Momentum 30 ETF,2024-11-30T00:00:00.000Z,118.42,Equity : ETFs,46325
